Chapter_Number,Chapter_English,Chapter_Arabic,Section_Number,Section_English,Section_Arabic,Hadith_number,English_Hadith,English_Isnad,English_Matn,Arabic_Hadith,Arabic_Isnad,Arabic_Matn,Arabic_Comment,English_Grade,Arabic_Grade
89.0,(Statements made under) Coercion,كتاب الإكراه,5.0,Compulsion,مِنَ الإِكْرَاهِ‏‏,6948.0,"Narrated Ibn `Abbas: Regarding the Qur'anic Verse: 'O you who believe! You are forbidden to inherit women against theirwill.' (4.19) The custom (in the Pre-lslamic Period) was that if a man died, his relatives used to havethe right to inherit his wife, and if one of them wished, he could marry her, or they could marry her tosomebody else, or prevent her from marrying if they wished, for they had more right to dispose of herthan her own relatives. Therefore this Verse was revealed concerning this matter.",Narrated Ibn `Abbas:,"Regarding the Qur'anic Verse: 'O you who believe! You are forbidden to inherit women against theirwill.' (4.19) The custom (in the Pre-lslamic Period) was that if a man died, his relatives used to havethe right to inherit his wife, and if one of them wished, he could marry her, or they could marry her tosomebody else, or prevent her from marrying if they wished, for they had more right to dispose of herthan her own relatives. Therefore this Verse was revealed concerning this matter.",حَدَّثَنَا حُسَيْنُ بْنُ مَنْصُورٍ، حَدَّثَنَا أَسْبَاطُ بْنُ مُحَمَّدٍ، حَدَّثَنَا الشَّيْبَانِيُّ، سُلَيْمَانُ بْنُ فَيْرُوزَ عَنْ عِكْرِمَةَ، عَنِ ابْنِ عَبَّاسٍ،‏.‏ قَالَ الشَّيْبَانِيُّ وَحَدَّثَنِي عَطَاءٌ أَبُو الْحَسَنِ السُّوَائِيُّ،، وَلاَ أَظُنُّهُ إِلاَّ ذَكَرَهُ عَنِ ابْنِ عَبَّاسٍ ـ رضى الله عنهما ـ ‏{‏يَا أَيُّهَا الَّذِينَ آمَنُوا لاَ يَحِلُّ لَكُمْ أَنْ تَرِثُوا النِّسَاءَ كَرْهًا‏}‏ الآيَةَ قَالَ كَانُوا إِذَا مَاتَ الرَّجُلُ كَانَ أَوْلِيَاؤُهُ أَحَقَّ بِامْرَأَتِهِ، إِنْ شَاءَ بَعْضُهُمْ تَزَوَّجَهَا، وَإِنْ شَاءُوا زَوَّجَهَا، وَإِنْ شَاءُوا لَمْ يُزَوِّجْهَا، فَهُمْ أَحَقُّ بِهَا مِنْ أَهْلِهَا، فَنَزَلَتْ هَذِهِ الآيَةُ فِي ذَلِكَ‏.‏,حَدَّثَنَا حُسَيْنُ بْنُ مَنْصُورٍ، حَدَّثَنَا أَسْبَاطُ بْنُ مُحَمَّدٍ، حَدَّثَنَا الشَّيْبَانِيُّ، سُلَيْمَانُ بْنُ فَيْرُوزَ عَنْ عِكْرِمَةَ، عَنِ ابْنِ عَبَّاسٍ،‏.‏ قَالَ الشَّيْبَانِيُّ وَحَدَّثَنِي عَطَاءٌ أَبُو الْحَسَنِ السُّوَائِيُّ،، وَلاَ أَظُنُّهُ إِلاَّ ذَكَرَهُ عَنِ ابْنِ عَبَّاسٍ ـ رضى الله عنهما ـ,‏{‏يَا أَيُّهَا الَّذِينَ آمَنُوا لاَ يَحِلُّ لَكُمْ أَنْ تَرِثُوا النِّسَاءَ كَرْهًا‏}‏ الآيَةَ قَالَ كَانُوا إِذَا مَاتَ الرَّجُلُ كَانَ أَوْلِيَاؤُهُ أَحَقَّ بِامْرَأَتِهِ، إِنْ شَاءَ بَعْضُهُمْ تَزَوَّجَهَا، وَإِنْ شَاءُوا زَوَّجَهَا، وَإِنْ شَاءُوا لَمْ يُزَوِّجْهَا، فَهُمْ أَحَقُّ بِهَا مِنْ أَهْلِهَا، فَنَزَلَتْ هَذِهِ الآيَةُ فِي ذَلِكَ‏.‏,nan,Sahih-Authentic,صحيح
89.0,(Statements made under) Coercion,كتاب الإكراه,6.0,If a woman is compelled to commit illegal sexual intercourse against her will,إِذَا اسْتُكْرِهَتِ الْمَرْأَةُ عَلَى الزِّنَا، فَلاَ حَدَّ عَلَيْهَا,6949.0,"And Safiyya bint 'Ubaid said: ""A governmental male-slave tried to seduce a slave-girl from the Khumus of the war booty till he deflowered her by force against her will; therefore 'Umar flogged him according to the law, and exiled him, but he did not flog the female slave because the male-slave had committed illegal sexual intercourse by force, against her will.""Az-Zuhri said regarding a virgin slave-girl raped by a free man: The judge has to fine the adulterer as much money as is equal to the price of the female slave and the adulterer has to be flogged (according to the Islamic Law); but if the slave woman is a matron, then, according to the verdict of the Imam, the adulterer is not fined but he has to receive the legal punishment (according to the Islamic Law).",And Safiyya bint 'Ubaid said:,"""A governmental male-slave tried to seduce a slave-girl from the Khumus of the war booty till he deflowered her by force against her will; therefore 'Umar flogged him according to the law, and exiled him, but he did not flog the female slave because the male-slave had committed illegal sexual intercourse by force, against her will.""Az-Zuhri said regarding a virgin slave-girl raped by a free man: The judge has to fine the adulterer as much money as is equal to the price of the female slave and the adulterer has to be flogged (according to the Islamic Law); but if the slave woman is a matron, then, according to the verdict of the Imam, the adulterer is not fined but he has to receive the legal punishment (according to the Islamic Law).",وَقَالَ اللَّيْثُ حَدَّثَنِي نَافِعٌ، أَنَّ صَفِيَّةَ ابْنَةَ أَبِي عُبَيْدٍ، أَخْبَرَتْهُ أَنَّ عَبْدًا مِنْ رَقِيقِ الإِمَارَةِ وَقَعَ عَلَى وَلِيدَةٍ مِنَ الْخُمُسِ، فَاسْتَكْرَهَهَا حَتَّى افْتَضَّهَا، فَجَلَدَهُ عُمَرُ الْحَدَّ وَنَفَاهُ، وَلَمْ يَجْلِدِ الْوَلِيدَةَ مِنْ أَجْلِ أَنَّهُ اسْتَكْرَهَهَا‏.‏ قَالَ الزُّهْرِيُّ فِي الأَمَةِ الْبِكْرِ، يَفْتَرِعُهَا الْحُرُّ، يُقِيمُ ذَلِكَ الْحَكَمُ مِنَ الأَمَةِ الْعَذْرَاءِ بِقَدْرِ قِيمَتِهَا، وَيُجْلَدُ، وَلَيْسَ فِي الأَمَةِ الثَّيِّبِ فِي قَضَاءِ الأَئِمَّةِ غُرْمٌ، وَلَكِنْ عَلَيْهِ الْحَدُّ‏.‏,وَقَالَ اللَّيْثُ حَدَّثَنِي نَافِعٌ، أَنَّ صَفِيَّةَ ابْنَةَ أَبِي عُبَيْدٍ، أَخْبَرَتْهُ أَنَّ,عَبْدًا مِنْ رَقِيقِ الإِمَارَةِ وَقَعَ عَلَى وَلِيدَةٍ مِنَ الْخُمُسِ، فَاسْتَكْرَهَهَا حَتَّى افْتَضَّهَا، فَجَلَدَهُ عُمَرُ الْحَدَّ وَنَفَاهُ، وَلَمْ يَجْلِدِ الْوَلِيدَةَ مِنْ أَجْلِ أَنَّهُ اسْتَكْرَهَهَا‏.‏ قَالَ الزُّهْرِيُّ فِي الأَمَةِ الْبِكْرِ، يَفْتَرِعُهَا الْحُرُّ، يُقِيمُ ذَلِكَ الْحَكَمُ مِنَ الأَمَةِ الْعَذْرَاءِ بِقَدْرِ قِيمَتِهَا، وَيُجْلَدُ، وَلَيْسَ فِي الأَمَةِ الثَّيِّبِ فِي قَضَاءِ الأَئِمَّةِ غُرْمٌ، وَلَكِنْ عَلَيْهِ الْحَدُّ‏.‏,nan,Sahih-Authentic,صحيح
89.0,(Statements made under) Coercion,كتاب الإكراه,6.0,If a woman is compelled to commit illegal sexual intercourse against her will,إِذَا اسْتُكْرِهَتِ الْمَرْأَةُ عَلَى الزِّنَا، فَلاَ حَدَّ عَلَيْهَا,6950.0,"Narrated Abu Huraira: Allah's Messenger (ﷺ) said, ""(The Prophet) Abraham migrated with his wife Sarah till he reached a townwhere there was a king or a tyrant who sent a message, to Abraham, ordering him to send Sarah tohim. So when Abraham had sent Sarah, the tyrant got up, intending to do evil with her, but she got upand performed ablution and prayed and said, 'O Allah ! If I have believed in You and in Your Apostle,then do not empower this oppressor over me.' So he (the king) had an epileptic fit and started movinghis legs violently. """,Narrated Abu Huraira:,"Allah's Messenger (ﷺ) said, ""(The Prophet) Abraham migrated with his wife Sarah till he reached a townwhere there was a king or a tyrant who sent a message, to Abraham, ordering him to send Sarah tohim. So when Abraham had sent Sarah, the tyrant got up, intending to do evil with her, but she got upand performed ablution and prayed and said, 'O Allah ! If I have believed in You and in Your Apostle,then do not empower this oppressor over me.' So he (the king) had an epileptic fit and started movinghis legs violently. """,حَدَّثَنَا أَبُو الْيَمَانِ، حَدَّثَنَا شُعَيْبٌ، حَدَّثَنَا أَبُو الزِّنَادِ، عَنِ الأَعْرَجِ، عَنْ أَبِي هُرَيْرَةَ، قَالَ قَالَ رَسُولُ اللَّهِ صلى الله عليه وسلم ‏ ‏ هَاجَرَ إِبْرَاهِيمُ بِسَارَةَ، دَخَلَ بِهَا قَرْيَةً فِيهَا مَلِكٌ مِنَ الْمُلُوكِ أَوْ جَبَّارٌ مِنَ الْجَبَابِرَةِ، فَأَرْسَلَ إِلَيْهِ أَنْ أَرْسِلْ إِلَىَّ بِهَا‏.‏ فَأَرْسَلَ بِهَا، فَقَامَ إِلَيْهَا فَقَامَتْ تَوَضَّأُ وَتُصَلِّي فَقَالَتِ اللَّهُمَّ إِنْ كُنْتُ آمَنْتُ بِكَ وَبِرَسُولِكَ فَلاَ تُسَلِّطْ عَلَىَّ الْكَافِرَ، فَغُطَّ حَتَّى رَكَضَ بِرِجْلِهِ ‏‏‏.‏,حَدَّثَنَا أَبُو الْيَمَانِ، حَدَّثَنَا شُعَيْبٌ، حَدَّثَنَا أَبُو الزِّنَادِ، عَنِ الأَعْرَجِ، عَنْ أَبِي هُرَيْرَةَ، قَالَ,قَالَ رَسُولُ اللَّهِ صلى الله عليه وسلم ‏ ‏ هَاجَرَ إِبْرَاهِيمُ بِسَارَةَ، دَخَلَ بِهَا قَرْيَةً فِيهَا مَلِكٌ مِنَ الْمُلُوكِ أَوْ جَبَّارٌ مِنَ الْجَبَابِرَةِ، فَأَرْسَلَ إِلَيْهِ أَنْ أَرْسِلْ إِلَىَّ بِهَا‏.‏ فَأَرْسَلَ بِهَا، فَقَامَ إِلَيْهَا فَقَامَتْ تَوَضَّأُ وَتُصَلِّي فَقَالَتِ اللَّهُمَّ إِنْ كُنْتُ آمَنْتُ بِكَ وَبِرَسُولِكَ فَلاَ تُسَلِّطْ عَلَىَّ الْكَافِرَ، فَغُطَّ حَتَّى رَكَضَ بِرِجْلِهِ ‏‏‏.‏,nan,Sahih-Authentic,صحيح
89.0,(Statements made under) Coercion,كتاب الإكراه,7.0,The oath of a man that his companion is his brother when he fears,يَمِينِ الرَّجُلِ لِصَاحِبِهِ إِنَّهُ أَخُوهُ، إِذَا خَافَ عَلَيْهِ الْقَتْلَ أَوْ نَحْوَهُ,6951.0,"Narrated `Abdullah bin `Umar: Allah's Messenger (ﷺ) said, ""A Muslim is a brother of another Muslim. So he should neither oppress him norhand him over to an oppressor. And whoever fulfilled the needs of his brother, Allah will fulfill hisneeds.""",Narrated `Abdullah bin `Umar:,"Allah's Messenger (ﷺ) said, ""A Muslim is a brother of another Muslim. So he should neither oppress him norhand him over to an oppressor. And whoever fulfilled the needs of his brother, Allah will fulfill hisneeds.""",حَدَّثَنَا يَحْيَى بْنُ بُكَيْرِ، حَدَّثَنَا اللَّيْثُ، عَنْ عُقَيْلٍ، عَنِ ابْنِ شِهَابٍ، أَنَّ سَالِمًا، أَخْبَرَهُ أَنَّ عَبْدَ اللَّهِ بْنَ عُمَرَ ـ رضى الله عنهما ـ أَخْبَرَهُ أَنَّ رَسُولَ اللَّهِ صلى الله عليه وسلم قَالَ ‏ ‏ الْمُسْلِمُ أَخُو الْمُسْلِمِ، لاَ يَظْلِمُهُ، وَلاَ يُسْلِمُهُ، وَمَنْ كَانَ فِي حَاجَةِ أَخِيهِ، كَانَ اللَّهُ فِي حَاجَتِهِ ‏‏‏.‏,حَدَّثَنَا يَحْيَى بْنُ بُكَيْرِ، حَدَّثَنَا اللَّيْثُ، عَنْ عُقَيْلٍ، عَنِ ابْنِ شِهَابٍ، أَنَّ سَالِمًا، أَخْبَرَهُ أَنَّ عَبْدَ اللَّهِ بْنَ عُمَرَ ـ رضى الله عنهما ـ أَخْبَرَهُ أَنَّ,رَسُولَ اللَّهِ صلى الله عليه وسلم قَالَ ‏ ‏ الْمُسْلِمُ أَخُو الْمُسْلِمِ، لاَ يَظْلِمُهُ، وَلاَ يُسْلِمُهُ، وَمَنْ كَانَ فِي حَاجَةِ أَخِيهِ، كَانَ اللَّهُ فِي حَاجَتِهِ ‏‏‏.‏,nan,Sahih-Authentic,صحيح
89.0,(Statements made under) Coercion,كتاب الإكراه,7.0,The oath of a man that his companion is his brother when he fears,يَمِينِ الرَّجُلِ لِصَاحِبِهِ إِنَّهُ أَخُوهُ، إِذَا خَافَ عَلَيْهِ الْقَتْلَ أَوْ نَحْوَهُ,6952.0,"Narrated Anas: Allah's Messenger (ﷺ) said, ""Help your brother whether he is an oppressor or an oppressed,"" A man said, ""OAllah's Messenger (ﷺ)! I will help him if he is oppressed, but if he is an oppressor, how shall I help him?""The Prophet (ﷺ) said, ""By preventing him from oppressing (others), for that is how to help him.""",Narrated Anas:,"Allah's Messenger (ﷺ) said, ""Help your brother whether he is an oppressor or an oppressed,"" A man said, ""OAllah's Messenger (ﷺ)! I will help him if he is oppressed, but if he is an oppressor, how shall I help him?""The Prophet (ﷺ) said, ""By preventing him from oppressing (others), for that is how to help him.""","حَدَّثَنَا مُحَمَّدُ بْنُ عَبْدِ الرَّحِيمِ، حَدَّثَنَا سَعِيدُ بْنُ سُلَيْمَانَ، حَدَّثَنَا هُشَيْمٌ، أَخْبَرَنَا عُبَيْدُ اللَّهِ بْنُ أَبِي بَكْرِ بْنِ أَنَسٍ، عَنْ أَنَسٍ ـ رضى الله عنه ـ قَالَ قَالَ رَسُولُ اللَّهِ صلى الله عليه وسلم ‏""‏ انْصُرْ أَخَاكَ ظَالِمًا أَوْ مَظْلُومًا ‏""‏‏.‏ فَقَالَ رَجُلٌ يَا رَسُولَ اللَّهِ أَنْصُرُهُ إِذَا كَانَ مَظْلُومًا، أَفَرَأَيْتَ إِذَا كَانَ ظَالِمًا كَيْفَ أَنْصُرُهُ قَالَ ‏""‏ تَحْجُزُهُ أَوْ تَمْنَعُهُ مِنَ الظُّلْمِ، فَإِنَّ ذَلِكَ نَصْرُهُ ‏""‏‏.‏",حَدَّثَنَا مُحَمَّدُ بْنُ عَبْدِ الرَّحِيمِ، حَدَّثَنَا سَعِيدُ بْنُ سُلَيْمَانَ، حَدَّثَنَا هُشَيْمٌ، أَخْبَرَنَا عُبَيْدُ اللَّهِ بْنُ أَبِي بَكْرِ بْنِ أَنَسٍ، عَنْ أَنَسٍ ـ رضى الله عنه ـ قَالَ,"قَالَ رَسُولُ اللَّهِ صلى الله عليه وسلم ‏""‏ انْصُرْ أَخَاكَ ظَالِمًا أَوْ مَظْلُومًا ‏""‏‏.‏ فَقَالَ رَجُلٌ يَا رَسُولَ اللَّهِ أَنْصُرُهُ إِذَا كَانَ مَظْلُومًا، أَفَرَأَيْتَ إِذَا كَانَ ظَالِمًا كَيْفَ أَنْصُرُهُ قَالَ ‏""‏ تَحْجُزُهُ أَوْ تَمْنَعُهُ مِنَ الظُّلْمِ، فَإِنَّ ذَلِكَ نَصْرُهُ ‏""‏‏.‏",nan,Sahih-Authentic,صحيح
