Chapter_Number,Chapter_English,Chapter_Arabic,Section_Number,Section_English,Section_Arabic,Hadith_number,English_Hadith,English_Isnad,English_Matn,Arabic_Hadith,Arabic_Isnad,Arabic_Matn,Arabic_Comment,English_Grade,Arabic_Grade
53.0,Peacemaking,كتاب الصلح,10.0,Should the Imam suggest reconciliation?,هَلْ يُشِيرُ الإِمَامُ بِالصُّلْحِ,2705,"Narrated Aisha: Once Allah's Messenger (ﷺ) heard the loud voices of some opponents quarreling at the door. One of themwas appealing to the other to deduct his debt and asking him to be lenient but the other was saying,""By Allah I will not do so."" Allah's Messenger (ﷺ) went out to them and said, ""Who is the one who wasswearing by Allah that he would not do a favor?"" That man said, ""I am that person, O Allah's Messenger (ﷺ)!I will give my opponent whatever he wishes.""",Narrated Aisha:,"Once Allah's Messenger (ﷺ) heard the loud voices of some opponents quarreling at the door. One of themwas appealing to the other to deduct his debt and asking him to be lenient but the other was saying,""By Allah I will not do so."" Allah's Messenger (ﷺ) went out to them and said, ""Who is the one who wasswearing by Allah that he would not do a favor?"" That man said, ""I am that person, O Allah's Messenger (ﷺ)!I will give my opponent whatever he wishes.""",حَدَّثَنَا إِسْمَاعِيلُ بْنُ أَبِي أُوَيْسٍ، قَالَ حَدَّثَنِي أَخِي، عَنْ سُلَيْمَانَ، عَنْ يَحْيَى بْنِ سَعِيدٍ، عَنْ أَبِي الرِّجَالِ، مُحَمَّدِ بْنِ عَبْدِ الرَّحْمَنِ أَنَّ أُمَّهُ، عَمْرَةَ بِنْتَ عَبْدِ الرَّحْمَنِ قَالَتْ سَمِعْتُ عَائِشَةَ ـ رضى الله عنها ـ تَقُولُ سَمِعَ رَسُولُ اللَّهِ صلى الله عليه وسلم صَوْتَ خُصُومٍ بِالْبَابِ عَالِيَةٍ أَصْوَاتُهُمَا، وَإِذَا أَحَدُهُمَا يَسْتَوْضِعُ الآخَرَ، وَيَسْتَرْفِقُهُ فِي شَىْءٍ وَهْوَ يَقُولُ وَاللَّهِ لاَ أَفْعَلُ‏.‏ فَخَرَجَ عَلَيْهِمَا رَسُولُ اللَّهِ صلى الله عليه وسلم فَقَالَ ‏ ‏ أَيْنَ الْمُتَأَلِّي عَلَى اللَّهِ لاَ يَفْعَلُ الْمَعْرُوفَ ‏‏‏.‏ فَقَالَ أَنَا يَا رَسُولَ اللَّهِ، وَلَهُ أَىُّ ذَلِكَ أَحَبَّ‏.‏,حَدَّثَنَا إِسْمَاعِيلُ بْنُ أَبِي أُوَيْسٍ، قَالَ حَدَّثَنِي أَخِي، عَنْ سُلَيْمَانَ، عَنْ يَحْيَى بْنِ سَعِيدٍ، عَنْ أَبِي الرِّجَالِ، مُحَمَّدِ بْنِ عَبْدِ الرَّحْمَنِ أَنَّ أُمَّهُ، عَمْرَةَ بِنْتَ عَبْدِ الرَّحْمَنِ قَالَتْ سَمِعْتُ عَائِشَةَ ـ رضى الله عنها ـ تَقُولُ,سَمِعَ رَسُولُ اللَّهِ صلى الله عليه وسلم صَوْتَ خُصُومٍ بِالْبَابِ عَالِيَةٍ أَصْوَاتُهُمَا، وَإِذَا أَحَدُهُمَا يَسْتَوْضِعُ الآخَرَ، وَيَسْتَرْفِقُهُ فِي شَىْءٍ وَهْوَ يَقُولُ وَاللَّهِ لاَ أَفْعَلُ‏.‏ فَخَرَجَ عَلَيْهِمَا رَسُولُ اللَّهِ صلى الله عليه وسلم فَقَالَ ‏ ‏ أَيْنَ الْمُتَأَلِّي عَلَى اللَّهِ لاَ يَفْعَلُ الْمَعْرُوفَ ‏‏‏.‏ فَقَالَ أَنَا يَا رَسُولَ اللَّهِ، وَلَهُ أَىُّ ذَلِكَ أَحَبَّ‏.‏,nan,Sahih-Authentic,صحيح
53.0,Peacemaking,كتاب الصلح,10.0,Should the Imam suggest reconciliation?,هَلْ يُشِيرُ الإِمَامُ بِالصُّلْحِ,2706,"Narrated `Abdullah bin Ka`b bin Malik from Ka`b bin Malik: `Abdullah bin Abu Hadrad Al-Aslami owed Ka`b bin Malik some money. One day the latter met theformer and demanded his right, and their voices grew very loud. The Prophet (ﷺ) passed by them and said,""O Ka`b,"" beckoning with his hand as if intending to say, ""Deduct half the debts."" So, Ka`b took halfwhat the other owed him and remitted the other half.",Narrated `Abdullah bin Ka`b bin Malik from Ka`b bin Malik:,"`Abdullah bin Abu Hadrad Al-Aslami owed Ka`b bin Malik some money. One day the latter met theformer and demanded his right, and their voices grew very loud. The Prophet (ﷺ) passed by them and said,""O Ka`b,"" beckoning with his hand as if intending to say, ""Deduct half the debts."" So, Ka`b took halfwhat the other owed him and remitted the other half.",حَدَّثَنَا يَحْيَى بْنُ بُكَيْرٍ، حَدَّثَنَا اللَّيْثُ، عَنْ جَعْفَرِ بْنِ رَبِيعَةَ، عَنِ الأَعْرَجِ، قَالَ حَدَّثَنِي عَبْدُ اللَّهِ بْنُ كَعْبِ بْنِ مَالِكٍ، عَنْ كَعْبِ بْنِ مَالِكٍ، أَنَّهُ كَانَ لَهُ عَلَى عَبْدِ اللَّهِ بْنِ أَبِي حَدْرَدٍ الأَسْلَمِيِّ مَالٌ، فَلَقِيَهُ فَلَزِمَهُ حَتَّى ارْتَفَعَتْ أَصْوَاتُهُمَا، فَمَرَّ بِهِمَا النَّبِيُّ صلى الله عليه وسلم فَقَالَ ‏ ‏ يَا كَعْبُ ‏‏‏.‏ فَأَشَارَ بِيَدِهِ كَأَنَّهُ يَقُولُ النِّصْفَ‏.‏ فَأَخَذَ نِصْفَ مَا عَلَيْهِ وَتَرَكَ نِصْفًا‏.‏,حَدَّثَنَا يَحْيَى بْنُ بُكَيْرٍ، حَدَّثَنَا اللَّيْثُ، عَنْ جَعْفَرِ بْنِ رَبِيعَةَ، عَنِ الأَعْرَجِ، قَالَ حَدَّثَنِي عَبْدُ اللَّهِ بْنُ كَعْبِ بْنِ مَالِكٍ، عَنْ كَعْبِ بْنِ مَالِكٍ، أَنَّهُ,كَانَ لَهُ عَلَى عَبْدِ اللَّهِ بْنِ أَبِي حَدْرَدٍ الأَسْلَمِيِّ مَالٌ، فَلَقِيَهُ فَلَزِمَهُ حَتَّى ارْتَفَعَتْ أَصْوَاتُهُمَا، فَمَرَّ بِهِمَا النَّبِيُّ صلى الله عليه وسلم فَقَالَ ‏ ‏ يَا كَعْبُ ‏‏‏.‏ فَأَشَارَ بِيَدِهِ كَأَنَّهُ يَقُولُ النِّصْفَ‏.‏ فَأَخَذَ نِصْفَ مَا عَلَيْهِ وَتَرَكَ نِصْفًا‏.‏,nan,Sahih-Authentic,صحيح
53.0,Peacemaking,كتاب الصلح,11.0,The superoirity of making peace and establishing justice among the people,فَضْلِ الإِصْلاَحِ بَيْنَ النَّاسِ وَالْعَدْلِ بَيْنَهُمْ,2707,"Narrated Abu Huraira: Allah's Messenger (ﷺ) said, ""There is a Sadaqa to be given for every joint of the human body; and for everyday on which the sun rises there is a reward of a Sadaqa (i.e. charitable gift) for the one whoestablishes justice among people.""",Narrated Abu Huraira:,"Allah's Messenger (ﷺ) said, ""There is a Sadaqa to be given for every joint of the human body; and for everyday on which the sun rises there is a reward of a Sadaqa (i.e. charitable gift) for the one whoestablishes justice among people.""",حَدَّثَنَا إِسْحَاقُ، أَخْبَرَنَا عَبْدُ الرَّزَّاقِ، أَخْبَرَنَا مَعْمَرٌ، عَنْ هَمَّامٍ، عَنْ أَبِي هُرَيْرَةَ ـ رضى الله عنه ـ قَالَ قَالَ رَسُولُ اللَّهِ صلى الله عليه وسلم ‏ ‏ كُلُّ سُلاَمَى مِنَ النَّاسِ عَلَيْهِ صَدَقَةٌ، كُلَّ يَوْمٍ تَطْلُعُ فِيهِ الشَّمْسُ يَعْدِلُ بَيْنَ النَّاسِ صَدَقَةٌ ‏‏‏.‏,حَدَّثَنَا إِسْحَاقُ، أَخْبَرَنَا عَبْدُ الرَّزَّاقِ، أَخْبَرَنَا مَعْمَرٌ، عَنْ هَمَّامٍ، عَنْ أَبِي هُرَيْرَةَ ـ رضى الله عنه ـ قَالَ,قَالَ رَسُولُ اللَّهِ صلى الله عليه وسلم ‏ ‏ كُلُّ سُلاَمَى مِنَ النَّاسِ عَلَيْهِ صَدَقَةٌ، كُلَّ يَوْمٍ تَطْلُعُ فِيهِ الشَّمْسُ يَعْدِلُ بَيْنَ النَّاسِ صَدَقَةٌ ‏‏‏.‏,nan,Sahih-Authentic,صحيح
53.0,Peacemaking,كتاب الصلح,12.0," If the Imam (i.ei., ruler) suggests a (re)conciliation",إِذَا أَشَارَ الإِمَامُ بِالصُّلْحِ فَأَبَى حَكَمَ عَلَيْهِ بِالْحُكْمِ الْبَيِّنِ,2708,"Narrated `Urwa bin Az-Zubair: Az-Zubair told me that he quarreled with an Ansari man who had participated in (the battle of) Badr infront of Allah's Messenger (ﷺ) about a water stream which both of them used for irrigation. Allah's Messenger (ﷺ)said to Az-Zubair, ""O Zubair! Irrigate (your garden) first, and then let the water flow to yourneighbor."" The Ansari became angry and said, ""O Allah's Messenger (ﷺ)! Is it because he is your cousin?""On that the complexion of Allah's Messenger (ﷺ) changed (because of anger) and said (to Az-Zubair), ""Iirrigate (your garden) and then withhold the water till it reaches the walls (surrounding the palms).""So, Allah's Messenger (ﷺ) gave Az-Zubair his full right. Before that Allah's Messenger (ﷺ) had given a generousjudgment beneficial for Az-Zubair and the Ansari, but when the Ansan irritated Allah's Messenger (ﷺ) hegave Az-Zubair his full right according to the evident law. Az-Zubair said, ""By Allah ! I think thefollowing Verse was revealed concerning that case: ""But no by your Lord They can have No faithUntil they make you judge In all disputes between them."" (4.65)",Narrated `Urwa bin Az-Zubair:,"Az-Zubair told me that he quarreled with an Ansari man who had participated in (the battle of) Badr infront of Allah's Messenger (ﷺ) about a water stream which both of them used for irrigation. Allah's Messenger (ﷺ)said to Az-Zubair, ""O Zubair! Irrigate (your garden) first, and then let the water flow to yourneighbor."" The Ansari became angry and said, ""O Allah's Messenger (ﷺ)! Is it because he is your cousin?""On that the complexion of Allah's Messenger (ﷺ) changed (because of anger) and said (to Az-Zubair), ""Iirrigate (your garden) and then withhold the water till it reaches the walls (surrounding the palms).""So, Allah's Messenger (ﷺ) gave Az-Zubair his full right. Before that Allah's Messenger (ﷺ) had given a generousjudgment beneficial for Az-Zubair and the Ansari, but when the Ansan irritated Allah's Messenger (ﷺ) hegave Az-Zubair his full right according to the evident law. Az-Zubair said, ""By Allah ! I think thefollowing Verse was revealed concerning that case: ""But no by your Lord They can have No faithUntil they make you judge In all disputes between them."" (4.65)","حَدَّثَنَا أَبُو الْيَمَانِ، أَخْبَرَنَا شُعَيْبٌ، عَنِ الزُّهْرِيِّ، قَالَ أَخْبَرَنِي عُرْوَةُ بْنُ الزُّبَيْرِ، أَنَّ الزُّبَيْرَ، كَانَ يُحَدِّثُ أَنَّهُ خَاصَمَ رَجُلاً مِنَ الأَنْصَارِ قَدْ شَهِدَ بَدْرًا إِلَى رَسُولِ اللَّهِ صلى الله عليه وسلم فِي شِرَاجٍ مِنَ الْحَرَّةِ كَانَا يَسْقِيَانِ بِهِ كِلاَهُمَا فَقَالَ رَسُولُ اللَّهِ صلى الله عليه وسلم لِلزُّبَيْرِ ‏""‏ اسْقِ يَا زُبَيْرُ ثُمَّ أَرْسِلْ إِلَى جَارِكَ ‏""‏‏.‏ فَغَضِبَ الأَنْصَارِيُّ فَقَالَ يَا رَسُولَ اللَّهِ آنْ كَانَ ابْنَ عَمَّتِكَ فَتَلَوَّنَ وَجْهُ رَسُولِ اللَّهِ صلى الله عليه وسلم ثُمَّ قَالَ ‏""‏ اسْقِ ثُمَّ احْبِسْ حَتَّى يَبْلُغَ الْجَدْرَ ‏""‏‏.‏ فَاسْتَوْعَى رَسُولُ اللَّهِ صلى الله عليه وسلم حِينَئِذٍ حَقَّهُ لِلزُّبَيْرِ، وَكَانَ رَسُولُ اللَّهِ صلى الله عليه وسلم قَبْلَ ذَلِكَ أَشَارَ عَلَى الزُّبَيْرِ بِرَأْىٍ سَعَةٍ لَهُ وَلِلأَنْصَارِيِّ، فَلَمَّا أَحْفَظَ الأَنْصَارِيُّ رَسُولَ اللَّهِ صلى الله عليه وسلم اسْتَوْعَى لِلزُّبَيْرِ حَقَّهُ فِي صَرِيحِ الْحُكْمِ‏.‏ قَالَ عُرْوَةُ قَالَ الزُّبَيْرُ وَاللَّهِ مَا أَحْسِبُ هَذِهِ الآيَةَ نَزَلَتْ إِلاَّ فِي ذَلِكَ ‏{‏فَلاَ وَرَبِّكَ لاَ يُؤْمِنُونَ حَتَّى يُحَكِّمُوكَ فِيمَا شَجَرَ بَيْنَهُمْ‏}‏ الآيَةَ‏.‏",حَدَّثَنَا أَبُو الْيَمَانِ، أَخْبَرَنَا شُعَيْبٌ، عَنِ الزُّهْرِيِّ، قَالَ أَخْبَرَنِي عُرْوَةُ بْنُ الزُّبَيْرِ،,"أَنَّ الزُّبَيْرَ، كَانَ يُحَدِّثُ أَنَّهُ خَاصَمَ رَجُلاً مِنَ الأَنْصَارِ قَدْ شَهِدَ بَدْرًا إِلَى رَسُولِ اللَّهِ صلى الله عليه وسلم فِي شِرَاجٍ مِنَ الْحَرَّةِ كَانَا يَسْقِيَانِ بِهِ كِلاَهُمَا فَقَالَ رَسُولُ اللَّهِ صلى الله عليه وسلم لِلزُّبَيْرِ ‏""‏ اسْقِ يَا زُبَيْرُ ثُمَّ أَرْسِلْ إِلَى جَارِكَ ‏""‏‏.‏ فَغَضِبَ الأَنْصَارِيُّ فَقَالَ يَا رَسُولَ اللَّهِ آنْ كَانَ ابْنَ عَمَّتِكَ فَتَلَوَّنَ وَجْهُ رَسُولِ اللَّهِ صلى الله عليه وسلم ثُمَّ قَالَ ‏""‏ اسْقِ ثُمَّ احْبِسْ حَتَّى يَبْلُغَ الْجَدْرَ ‏""‏‏.‏ فَاسْتَوْعَى رَسُولُ اللَّهِ صلى الله عليه وسلم حِينَئِذٍ حَقَّهُ لِلزُّبَيْرِ، وَكَانَ رَسُولُ اللَّهِ صلى الله عليه وسلم قَبْلَ ذَلِكَ أَشَارَ عَلَى الزُّبَيْرِ بِرَأْىٍ سَعَةٍ لَهُ وَلِلأَنْصَارِيِّ، فَلَمَّا أَحْفَظَ الأَنْصَارِيُّ رَسُولَ اللَّهِ صلى الله عليه وسلم اسْتَوْعَى لِلزُّبَيْرِ حَقَّهُ فِي صَرِيحِ الْحُكْمِ‏.‏ قَالَ عُرْوَةُ قَالَ الزُّبَيْرُ وَاللَّهِ مَا أَحْسِبُ هَذِهِ الآيَةَ نَزَلَتْ إِلاَّ فِي ذَلِكَ ‏{‏فَلاَ وَرَبِّكَ لاَ يُؤْمِنُونَ حَتَّى يُحَكِّمُوكَ فِيمَا شَجَرَ بَيْنَهُمْ‏}‏ الآيَةَ‏.‏",nan,Sahih-Authentic,صحيح
53.0,Peacemaking,كتاب الصلح,13.0,Reconciliation between the creditors and between the inheritors,الصُّلْحِ بَيْنَ الْغُرَمَاءِ وَأَصْحَابِ الْمِيرَاثِ وَالْمُجَازَفَةِ فِي ذَلِكَ,2709,"Narrated Jabir bin `Abdullah: My father died and was in debt. I suggested that his creditors take the fruits (i.e. dates) of my gardenin lieu of the debt of my father, but they refused the offer, as they thought that it would not cover thefull debt. So, I went to the Prophet (ﷺ) and told him about it. He said (to me), ""When you pluck the datesand collect them in the Mirbad (i.e. a place where dates are dried), call me (Allah's Messenger (ﷺ))."" Finallyhe came accompanied by Abu Bakr and `Umar and sat on the dates and invoked Allah to bless them.Then he said, ""Call your creditors and give them their full rights."" So, I paid all my father's creditorsin full and yet thirteen extra Wasqs of dates remained, seven of which were 'Ajwa and six were Launor six of which were Ajwa and seven were Laun. I met Allah's Messenger (ﷺ) at sunset and informed himabout it. On that he smiled and said, ""Go to Abu Bakr and `Umar and tell them about it."" They said,""We perceived that was going to happen, as Allah's Messenger (ﷺ) did what he did.""",Narrated Jabir bin `Abdullah:,"My father died and was in debt. I suggested that his creditors take the fruits (i.e. dates) of my gardenin lieu of the debt of my father, but they refused the offer, as they thought that it would not cover thefull debt. So, I went to the Prophet (ﷺ) and told him about it. He said (to me), ""When you pluck the datesand collect them in the Mirbad (i.e. a place where dates are dried), call me (Allah's Messenger (ﷺ))."" Finallyhe came accompanied by Abu Bakr and `Umar and sat on the dates and invoked Allah to bless them.Then he said, ""Call your creditors and give them their full rights."" So, I paid all my father's creditorsin full and yet thirteen extra Wasqs of dates remained, seven of which were 'Ajwa and six were Launor six of which were Ajwa and seven were Laun. I met Allah's Messenger (ﷺ) at sunset and informed himabout it. On that he smiled and said, ""Go to Abu Bakr and `Umar and tell them about it."" They said,""We perceived that was going to happen, as Allah's Messenger (ﷺ) did what he did.""","حَدَّثَنِي مُحَمَّدُ بْنُ بَشَّارٍ، حَدَّثَنَا عَبْدُ الْوَهَّابِ، حَدَّثَنَا عُبَيْدُ اللَّهِ، عَنْ وَهْبِ بْنِ كَيْسَانَ، عَنْ جَابِرِ بْنِ عَبْدِ اللَّهِ ـ رضى الله عنهما ـ قَالَ تُوُفِّيَ أَبِي وَعَلَيْهِ دَيْنٌ، فَعَرَضْتُ عَلَى غُرَمَائِهِ أَنْ يَأْخُذُوا التَّمْرَ بِمَا عَلَيْهِ، فَأَبَوْا وَلَمْ يَرَوْا أَنَّ فِيهِ وَفَاءً، فَأَتَيْتُ النَّبِيَّ صلى الله عليه وسلم فَذَكَرْتُ ذَلِكَ لَهُ، فَقَالَ ‏""‏ إِذَا جَدَدْتَهُ فَوَضَعْتَهُ فِي الْمِرْبَدِ آذَنْتُ رَسُولَ اللَّهِ صلى الله عليه وسلم ‏""‏‏.‏ فَجَاءَ وَمَعَهُ أَبُو بَكْرٍ وَعُمَرُ فَجَلَسَ عَلَيْهِ، وَدَعَا بِالْبَرَكَةِ ثُمَّ قَالَ ‏""‏ ادْعُ غُرَمَاءَكَ، فَأَوْفِهِمْ ‏""‏‏.‏ فَمَا تَرَكْتُ أَحَدًا لَهُ عَلَى أَبِي دَيْنٌ إِلاَّ قَضَيْتُهُ، وَفَضَلَ ثَلاَثَةَ عَشَرَ وَسْقًا سَبْعَةٌ عَجْوَةٌ، وَسِتَّةٌ لَوْنٌ أَوْ سِتَّةٌ عَجْوَةٌ وَسَبْعَةٌ لَوْنٌ، فَوَافَيْتُ مَعَ رَسُولِ اللَّهِ صلى الله عليه وسلم الْمَغْرِبَ فَذَكَرْتُ ذَلِكَ لَهُ فَضَحِكَ فَقَالَ ‏""‏ ائْتِ أَبَا بَكْرٍ وَعُمَرَ فَأَخْبِرْهُمَا ‏""‏‏.‏ فَقَالاَ لَقَدْ عَلِمْنَا إِذْ صَنَعَ رَسُولُ اللَّهِ صلى الله عليه وسلم مَا صَنَعَ أَنْ سَيَكُونُ ذَلِكَ‏.‏ وَقَالَ هِشَامٌ عَنْ وَهْبٍ عَنْ جَابِرٍ صَلاَةَ الْعَصْرِ‏.‏ وَلَمْ يَذْكُرْ أَبَا بَكْرٍ وَلاَ ضَحِكَ، وَقَالَ وَتَرَكَ أَبِي عَلَيْهِ ثَلاَثِينَ وَسْقًا دَيْنًا‏.‏ وَقَالَ ابْنُ إِسْحَاقَ عَنْ وَهْبٍ عَنْ جَابِرٍ صَلاَةَ الظُّهْرِ‏.‏",حَدَّثَنِي مُحَمَّدُ بْنُ بَشَّارٍ، حَدَّثَنَا عَبْدُ الْوَهَّابِ، حَدَّثَنَا عُبَيْدُ اللَّهِ، عَنْ وَهْبِ بْنِ كَيْسَانَ، عَنْ جَابِرِ بْنِ عَبْدِ اللَّهِ ـ رضى الله عنهما ـ,"قَالَ تُوُفِّيَ أَبِي وَعَلَيْهِ دَيْنٌ، فَعَرَضْتُ عَلَى غُرَمَائِهِ أَنْ يَأْخُذُوا التَّمْرَ بِمَا عَلَيْهِ، فَأَبَوْا وَلَمْ يَرَوْا أَنَّ فِيهِ وَفَاءً، فَأَتَيْتُ النَّبِيَّ صلى الله عليه وسلم فَذَكَرْتُ ذَلِكَ لَهُ، فَقَالَ ‏""‏ إِذَا جَدَدْتَهُ فَوَضَعْتَهُ فِي الْمِرْبَدِ آذَنْتُ رَسُولَ اللَّهِ صلى الله عليه وسلم ‏""‏‏.‏ فَجَاءَ وَمَعَهُ أَبُو بَكْرٍ وَعُمَرُ فَجَلَسَ عَلَيْهِ، وَدَعَا بِالْبَرَكَةِ ثُمَّ قَالَ ‏""‏ ادْعُ غُرَمَاءَكَ، فَأَوْفِهِمْ ‏""‏‏.‏ فَمَا تَرَكْتُ أَحَدًا لَهُ عَلَى أَبِي دَيْنٌ إِلاَّ قَضَيْتُهُ، وَفَضَلَ ثَلاَثَةَ عَشَرَ وَسْقًا سَبْعَةٌ عَجْوَةٌ، وَسِتَّةٌ لَوْنٌ أَوْ سِتَّةٌ عَجْوَةٌ وَسَبْعَةٌ لَوْنٌ، فَوَافَيْتُ مَعَ رَسُولِ اللَّهِ صلى الله عليه وسلم الْمَغْرِبَ فَذَكَرْتُ ذَلِكَ لَهُ فَضَحِكَ فَقَالَ ‏""‏ ائْتِ أَبَا بَكْرٍ وَعُمَرَ فَأَخْبِرْهُمَا ‏""‏‏.‏ فَقَالاَ لَقَدْ عَلِمْنَا إِذْ صَنَعَ رَسُولُ اللَّهِ صلى الله عليه وسلم مَا صَنَعَ أَنْ سَيَكُونُ ذَلِكَ‏.‏ وَقَالَ هِشَامٌ عَنْ وَهْبٍ عَنْ جَابِرٍ صَلاَةَ الْعَصْرِ‏.‏ وَلَمْ يَذْكُرْ أَبَا بَكْرٍ وَلاَ ضَحِكَ، وَقَالَ وَتَرَكَ أَبِي عَلَيْهِ ثَلاَثِينَ وَسْقًا دَيْنًا‏.‏ وَقَالَ ابْنُ إِسْحَاقَ عَنْ وَهْبٍ عَنْ جَابِرٍ صَلاَةَ الظُّهْرِ‏.‏",nan,Sahih-Authentic,صحيح
