Chapter_Number,Chapter_English,Chapter_Arabic,Section_Number,Section_English,Section_Arabic,Hadith_number,English_Hadith,English_Isnad,English_Matn,Arabic_Hadith,Arabic_Isnad,Arabic_Matn,Arabic_Comment,English_Grade,Arabic_Grade
93.0,Judgments (Ahkaam),كتاب الأحكام,29.0,Whoever is given the right of his brother through a judicial decision,nan,7182,"Narrated `Aisha: (the wife of the Prophet) `Utba bin Abi Waqqas said to his brother Sa`d bin Abi Waqqas, ""The son ofthe slave girl of Zam`a is from me, so take him into your custody."" So in the year of Conquest ofMecca, Sa`d took him and said. (This is) my brother's son whom my brother has asked me to take intomy custody."" `Abd bin Zam`a got up before him and said, (He is) my brother and the son of the slavegirl of my father, and was born on my father's bed."" So they both submitted their case before Allah'sApostle. Sa`d said, ""O Allah's Messenger (ﷺ)! This boy is the son of my brother and he entrusted him to me.""`Abd bin Zam`a said, ""This boy is my brother and the son of the slave girl of my father, and was bornon the bed of my father."" Allah's Messenger (ﷺ) said, ""The boy is for you, O `Abd bin Zam`a!"" Then Allah'sApostle further said, ""The child is for the owner of the bed, and the stone is for the adulterer,"" He thensaid to Sauda bint Zam`a, ""Veil (screen) yourself before him,"" when he saw the child's resemblance to`Utba. The boy did not see her again till he met Allah.",Narrated `Aisha:,"(the wife of the Prophet) `Utba bin Abi Waqqas said to his brother Sa`d bin Abi Waqqas, ""The son ofthe slave girl of Zam`a is from me, so take him into your custody."" So in the year of Conquest ofMecca, Sa`d took him and said. (This is) my brother's son whom my brother has asked me to take intomy custody."" `Abd bin Zam`a got up before him and said, (He is) my brother and the son of the slavegirl of my father, and was born on my father's bed."" So they both submitted their case before Allah'sApostle. Sa`d said, ""O Allah's Messenger (ﷺ)! This boy is the son of my brother and he entrusted him to me.""`Abd bin Zam`a said, ""This boy is my brother and the son of the slave girl of my father, and was bornon the bed of my father."" Allah's Messenger (ﷺ) said, ""The boy is for you, O `Abd bin Zam`a!"" Then Allah'sApostle further said, ""The child is for the owner of the bed, and the stone is for the adulterer,"" He thensaid to Sauda bint Zam`a, ""Veil (screen) yourself before him,"" when he saw the child's resemblance to`Utba. The boy did not see her again till he met Allah.","حَدَّثَنَا إِسْمَاعِيلُ، قَالَ حَدَّثَنِي مَالِكٌ، عَنِ ابْنِ شِهَابٍ، عَنْ عُرْوَةَ بْنِ الزُّبَيْرِ، عَنْ عَائِشَةَ، زَوْجِ النَّبِيِّ صلى الله عليه وسلم أَنَّهَا قَالَتْ كَانَ عُتْبَةُ بْنُ أَبِي وَقَّاصٍ عَهِدَ إِلَى أَخِيهِ سَعْدِ بْنِ أَبِي وَقَّاصٍ أَنَّ ابْنَ وَلِيدَةِ زَمْعَةَ مِنِّي فَاقْبِضْهُ إِلَيْكَ‏.‏ فَلَمَّا كَانَ عَامُ الْفَتْحِ أَخَذَهُ سَعْدٌ فَقَالَ ابْنُ أَخِي، قَدْ كَانَ عَهِدَ إِلَىَّ فِيهِ، فَقَامَ إِلَيْهِ عَبْدُ بْنُ زَمْعَةَ فَقَالَ أَخِي وَابْنُ وَلِيدَةِ أَبِي، وُلِدَ عَلَى فِرَاشِهِ‏.‏ فَتَسَاوَقَا إِلَى رَسُولِ اللَّهِ صلى الله عليه وسلم فَقَالَ سَعْدٌ يَا رَسُولَ اللَّهِ ابْنُ أَخِي، كَانَ عَهِدَ إِلَىَّ فِيهِ‏.‏ وَقَالَ عَبْدُ بْنُ زَمْعَةَ أَخِي وَابْنُ وَلِيدَةِ أَبِي، وُلِدَ عَلَى فِرَاشِهِ‏.‏ فَقَالَ رَسُولُ اللَّهِ صلى الله عليه وسلم ‏""‏ هُوَ لَكَ يَا عَبْدُ بْنَ زَمْعَةَ ‏""‏‏.‏ ثُمَّ قَالَ رَسُولُ اللَّهِ صلى الله عليه وسلم ‏""‏ الْوَلَدُ لِلْفِرَاشِ، وَلِلْعَاهِرِ الْحَجَرُ ‏""‏‏.‏ ثُمَّ قَالَ لِسَوْدَةَ بِنْتِ زَمْعَةَ ‏""‏ احْتَجِبِي مِنْهُ ‏""‏، لِمَا رَأَى مِنْ شَبَهِهِ بِعُتْبَةَ، فَمَا رَآهَا حَتَّى لَقِيَ اللَّهَ تَعَالَى‏.‏",حَدَّثَنَا إِسْمَاعِيلُ، قَالَ حَدَّثَنِي مَالِكٌ، عَنِ ابْنِ شِهَابٍ، عَنْ عُرْوَةَ بْنِ الزُّبَيْرِ، عَنْ عَائِشَةَ، زَوْجِ النَّبِيِّ صلى الله عليه وسلم أَنَّهَا قَالَتْ,"كَانَ عُتْبَةُ بْنُ أَبِي وَقَّاصٍ عَهِدَ إِلَى أَخِيهِ سَعْدِ بْنِ أَبِي وَقَّاصٍ أَنَّ ابْنَ وَلِيدَةِ زَمْعَةَ مِنِّي فَاقْبِضْهُ إِلَيْكَ‏.‏ فَلَمَّا كَانَ عَامُ الْفَتْحِ أَخَذَهُ سَعْدٌ فَقَالَ ابْنُ أَخِي، قَدْ كَانَ عَهِدَ إِلَىَّ فِيهِ، فَقَامَ إِلَيْهِ عَبْدُ بْنُ زَمْعَةَ فَقَالَ أَخِي وَابْنُ وَلِيدَةِ أَبِي، وُلِدَ عَلَى فِرَاشِهِ‏.‏ فَتَسَاوَقَا إِلَى رَسُولِ اللَّهِ صلى الله عليه وسلم فَقَالَ سَعْدٌ يَا رَسُولَ اللَّهِ ابْنُ أَخِي، كَانَ عَهِدَ إِلَىَّ فِيهِ‏.‏ وَقَالَ عَبْدُ بْنُ زَمْعَةَ أَخِي وَابْنُ وَلِيدَةِ أَبِي، وُلِدَ عَلَى فِرَاشِهِ‏.‏ فَقَالَ رَسُولُ اللَّهِ صلى الله عليه وسلم ‏""‏ هُوَ لَكَ يَا عَبْدُ بْنَ زَمْعَةَ ‏""‏‏.‏ ثُمَّ قَالَ رَسُولُ اللَّهِ صلى الله عليه وسلم ‏""‏ الْوَلَدُ لِلْفِرَاشِ، وَلِلْعَاهِرِ الْحَجَرُ ‏""‏‏.‏ ثُمَّ قَالَ لِسَوْدَةَ بِنْتِ زَمْعَةَ ‏""‏ احْتَجِبِي مِنْهُ ‏""‏، لِمَا رَأَى مِنْ شَبَهِهِ بِعُتْبَةَ، فَمَا رَآهَا حَتَّى لَقِيَ اللَّهَ تَعَالَى‏.‏",nan,Sahih-Authentic,صحيح
93.0,Judgments (Ahkaam),كتاب الأحكام,30.0," Judgement regarding cases involving wells, etc.",الْحُكْمِ فِي الْبِئْرِ وَنَحْوِهَا,7183-7184,"Narrated `Abdullah: The Prophet (ﷺ) said, ""If somebody on the demand of a judge takes an oath to grab (a Muslim's) propertyand he is liar in it, he will meet Allah Who will be angry with him"". So Allah revealed,:--'Verily! those who purchase a small gain at the cost of Allah's Covenant and their oaths..' (3.77) 'Al-Ashath came while `Abdullah was narrating (this) to the people. Al-Ashath said, ""This verse wasrevealed regarding me and another man with whom I had a quarrel about a well. The Prophet (ﷺ) said (tome), ""Do you have any evidence?' I replied, 'No.' He said, 'Let your opponent take an oath.' I said: Iam sure he would take a (false) oath."" Thereupon it was revealed: 'Verily! those who purchase a smallgain at the cost of Allah's Covenant....' (3.77)",Narrated `Abdullah:,"The Prophet (ﷺ) said, ""If somebody on the demand of a judge takes an oath to grab (a Muslim's) propertyand he is liar in it, he will meet Allah Who will be angry with him"". So Allah revealed,:--'Verily! those who purchase a small gain at the cost of Allah's Covenant and their oaths..' (3.77) 'Al-Ashath came while `Abdullah was narrating (this) to the people. Al-Ashath said, ""This verse wasrevealed regarding me and another man with whom I had a quarrel about a well. The Prophet (ﷺ) said (tome), ""Do you have any evidence?' I replied, 'No.' He said, 'Let your opponent take an oath.' I said: Iam sure he would take a (false) oath."" Thereupon it was revealed: 'Verily! those who purchase a smallgain at the cost of Allah's Covenant....' (3.77)","حَدَّثَنَا إِسْحَاقُ بْنُ نَصْرٍ، حَدَّثَنَا عَبْدُ الرَّزَّاقِ، أَخْبَرَنَا سُفْيَانُ، عَنْ مَنْصُورٍ، وَالأَعْمَشِ، عَنْ أَبِي وَائِلٍ، قَالَ قَالَ عَبْدُ اللَّهِ قَالَ النَّبِيُّ صلى الله عليه وسلم ‏""‏ لاَ يَحْلِفُ عَلَى يَمِينِ صَبْرٍ، يَقْتَطِعُ مَالاً وَهْوَ فِيهَا فَاجِرٌ، إِلاَّ لَقِيَ اللَّهَ وَهْوَ عَلَيْهِ غَضْبَانُ ‏""‏‏.‏ فَأَنْزَلَ اللَّهُ ‏{‏إِنَّ الَّذِينَ يَشْتَرُونَ بِعَهْدِ اللَّهِ‏}‏ الآيَةَ‏.‏فَجَاءَ الأَشْعَثُ وَعَبْدُ اللَّهِ يُحَدِّثُهُمْ فَقَالَ فِيَّ نَزَلَتْ وَفِي رَجُلٍ خَاصَمْتُهُ فِي بِئْرٍ فَقَالَ النَّبِيُّ صلى الله عليه وسلم ‏""‏ أَلَكَ بَيِّنَةٌ ‏""‏‏.‏ قُلْتُ لاَ‏.‏ قَالَ ‏""‏ فَلْيَحْلِفْ ‏""‏‏.‏ قُلْتُ إِذًا يَحْلِفُ‏.‏ فَنَزَلَتْ ‏{‏إِنَّ الَّذِينَ يَشْتَرُونَ بِعَهْدِ اللَّهِ‏}‏ الآيَةَ‏.‏",حَدَّثَنَا إِسْحَاقُ بْنُ نَصْرٍ، حَدَّثَنَا عَبْدُ الرَّزَّاقِ، أَخْبَرَنَا سُفْيَانُ، عَنْ مَنْصُورٍ، وَالأَعْمَشِ، عَنْ أَبِي وَائِلٍ، قَالَ قَالَ عَبْدُ اللَّهِ قَالَ,"النَّبِيُّ صلى الله عليه وسلم ‏""‏ لاَ يَحْلِفُ عَلَى يَمِينِ صَبْرٍ، يَقْتَطِعُ مَالاً وَهْوَ فِيهَا فَاجِرٌ، إِلاَّ لَقِيَ اللَّهَ وَهْوَ عَلَيْهِ غَضْبَانُ ‏""‏‏.‏ فَأَنْزَلَ اللَّهُ ‏{‏إِنَّ الَّذِينَ يَشْتَرُونَ بِعَهْدِ اللَّهِ‏}‏ الآيَةَ‏.‏فَجَاءَ الأَشْعَثُ وَعَبْدُ اللَّهِ يُحَدِّثُهُمْ فَقَالَ فِيَّ نَزَلَتْ وَفِي رَجُلٍ خَاصَمْتُهُ فِي بِئْرٍ فَقَالَ النَّبِيُّ صلى الله عليه وسلم ‏""‏ أَلَكَ بَيِّنَةٌ ‏""‏‏.‏ قُلْتُ لاَ‏.‏ قَالَ ‏""‏ فَلْيَحْلِفْ ‏""‏‏.‏ قُلْتُ إِذًا يَحْلِفُ‏.‏ فَنَزَلَتْ ‏{‏إِنَّ الَّذِينَ يَشْتَرُونَ بِعَهْدِ اللَّهِ‏}‏ الآيَةَ‏.‏",nan,Sahih-Authentic,صحيح
93.0,Judgments (Ahkaam),كتاب الأحكام,31.0,To judge cases involving wealth,الْقَضَاءِ فِي كَثِيرِ الْمَالِ وَقَلِيلِهِ,7185,"Narrated Um Salama: The Prophet (ﷺ) heard the voices of some people quarreling near his gate, so he went to them and said, ""Iam only a human being and litigants with cases of disputes come to me, and maybe one of thempresents his case eloquently in a more convincing and impressive way than the other, and I give myverdict in his favor thinking he is truthful. So if I give a Muslim's right to another (by mistake), thenthat (property) is a piece of Fire, which is up to him to take it or leave it."" (See Hadith No. 281 )",Narrated Um Salama:,"The Prophet (ﷺ) heard the voices of some people quarreling near his gate, so he went to them and said, ""Iam only a human being and litigants with cases of disputes come to me, and maybe one of thempresents his case eloquently in a more convincing and impressive way than the other, and I give myverdict in his favor thinking he is truthful. So if I give a Muslim's right to another (by mistake), thenthat (property) is a piece of Fire, which is up to him to take it or leave it."" (See Hadith No. 281 )",حَدَّثَنَا أَبُو الْيَمَانِ، أَخْبَرَنَا شُعَيْبٌ، عَنِ الزُّهْرِيِّ، أَخْبَرَنِي عُرْوَةُ بْنُ الزُّبَيْرِ، أَنَّ زَيْنَبَ بِنْتَ أَبِي سَلَمَةَ، أَخْبَرَتْهُ عَنْ أُمِّهَا أُمِّ سَلَمَةَ، قَالَتْ سَمِعَ النَّبِيُّ صلى الله عليه وسلم جَلَبَةَ خِصَامٍ عِنْدَ بَابِهِ فَخَرَجَ عَلَيْهِمْ فَقَالَ ‏ ‏ إِنَّمَا أَنَا بَشَرٌ، وَإِنَّهُ يَأْتِينِي الْخَصْمُ، فَلَعَلَّ بَعْضًا أَنْ يَكُونَ أَبْلَغَ مِنْ بَعْضٍ، أَقْضِي لَهُ بِذَلِكَ وَأَحْسِبُ أَنَّهُ صَادِقٌ، فَمَنْ قَضَيْتُ لَهُ بِحَقِّ مُسْلِمٍ فَإِنَّمَا هِيَ قِطْعَةٌ مِنَ النَّارِ، فَلْيَأْخُذْهَا أَوْ لِيَدَعْهَا ‏‏‏.‏,حَدَّثَنَا أَبُو الْيَمَانِ، أَخْبَرَنَا شُعَيْبٌ، عَنِ الزُّهْرِيِّ، أَخْبَرَنِي عُرْوَةُ بْنُ الزُّبَيْرِ، أَنَّ زَيْنَبَ بِنْتَ أَبِي سَلَمَةَ، أَخْبَرَتْهُ عَنْ أُمِّهَا أُمِّ سَلَمَةَ،,قَالَتْ سَمِعَ النَّبِيُّ صلى الله عليه وسلم جَلَبَةَ خِصَامٍ عِنْدَ بَابِهِ فَخَرَجَ عَلَيْهِمْ فَقَالَ ‏ ‏ إِنَّمَا أَنَا بَشَرٌ، وَإِنَّهُ يَأْتِينِي الْخَصْمُ، فَلَعَلَّ بَعْضًا أَنْ يَكُونَ أَبْلَغَ مِنْ بَعْضٍ، أَقْضِي لَهُ بِذَلِكَ وَأَحْسِبُ أَنَّهُ صَادِقٌ، فَمَنْ قَضَيْتُ لَهُ بِحَقِّ مُسْلِمٍ فَإِنَّمَا هِيَ قِطْعَةٌ مِنَ النَّارِ، فَلْيَأْخُذْهَا أَوْ لِيَدَعْهَا ‏‏‏.‏,nan,Sahih-Authentic,صحيح
93.0,Judgments (Ahkaam),كتاب الأحكام,32.0,Selling people’s estates by the ruler on their behalf,بَيْعِ الإِمَامِ عَلَى النَّاسِ أَمْوَالَهُمْ وَضِيَاعَهُمْ,7186,"Narrated Jabir: The Prophet (ﷺ) came to know that one of his companions had given the promise of freeing his slave afterhis death, but as he had no other property than that slave, the Prophet (ﷺ) sold that slave for 800 dirhamsand sent the price to him.",Narrated Jabir:,"The Prophet (ﷺ) came to know that one of his companions had given the promise of freeing his slave afterhis death, but as he had no other property than that slave, the Prophet (ﷺ) sold that slave for 800 dirhamsand sent the price to him.",حَدَّثَنَا ابْنُ نُمَيْرٍ، حَدَّثَنَا مُحَمَّدُ بْنُ بِشْرٍ، حَدَّثَنَا إِسْمَاعِيلُ، حَدَّثَنَا سَلَمَةُ بْنُ كُهَيْلٍ، عَنْ عَطَاءٍ، عَنْ جَابِرٍ، قَالَ بَلَغَ النَّبِيَّ صلى الله عليه وسلم أَنَّ رَجُلاً مِنْ أَصْحَابِهِ أَعْتَقَ غُلاَمًا عَنْ دُبُرٍ، لَمْ يَكُنْ لَهُ مَالٌ غَيْرَهُ، فَبَاعَهُ بِثَمَانِمِائَةِ دِرْهَمٍ، ثُمَّ أَرْسَلَ بِثَمَنِهِ إِلَيْهِ‏.‏,حَدَّثَنَا ابْنُ نُمَيْرٍ، حَدَّثَنَا مُحَمَّدُ بْنُ بِشْرٍ، حَدَّثَنَا إِسْمَاعِيلُ، حَدَّثَنَا سَلَمَةُ بْنُ كُهَيْلٍ، عَنْ عَطَاءٍ، عَنْ جَابِرٍ، قَالَ بَلَغَ,النَّبِيَّ صلى الله عليه وسلم أَنَّ رَجُلاً مِنْ أَصْحَابِهِ أَعْتَقَ غُلاَمًا عَنْ دُبُرٍ، لَمْ يَكُنْ لَهُ مَالٌ غَيْرَهُ، فَبَاعَهُ بِثَمَانِمِائَةِ دِرْهَمٍ، ثُمَّ أَرْسَلَ بِثَمَنِهِ إِلَيْهِ‏.‏,nan,Sahih-Authentic,صحيح
93.0,Judgments (Ahkaam),كتاب الأحكام,33.0,Slanders made by ignorant people against the Amirs,مَنْ لَمْ يَكْتَرِثْ بِطَعْنِ مَنْ لاَ يَعْلَمُ فِي الأُمَرَاءِ حَدِيثًا,7187,"Narrated Ibn `Umar: Allah's Messenger (ﷺ) sent an army unit headed by Usama bin Zaid and the people criticized his leadership.The Prophet (ﷺ) said (to the people), ""If you are criticizing his leadership now, then you used to criticizehis father's leadership before. By Allah, he (Usama's father) deserved the leadership and used to beone of the most beloved persons to me, and now his son (Usama) is one of the most beloved personsto me after him. """,Narrated Ibn `Umar:,"Allah's Messenger (ﷺ) sent an army unit headed by Usama bin Zaid and the people criticized his leadership.The Prophet (ﷺ) said (to the people), ""If you are criticizing his leadership now, then you used to criticizehis father's leadership before. By Allah, he (Usama's father) deserved the leadership and used to beone of the most beloved persons to me, and now his son (Usama) is one of the most beloved personsto me after him. """,حَدَّثَنَا مُوسَى بْنُ إِسْمَاعِيلَ، حَدَّثَنَا عَبْدُ الْعَزِيزِ بْنُ مُسْلِمٍ، حَدَّثَنَا عَبْدُ اللَّهِ بْنُ دِينَارٍ، قَالَ سَمِعْتُ ابْنَ عُمَرَ ـ رضى الله عنهما ـ يَقُولُ بَعَثَ رَسُولُ اللَّهِ صلى الله عليه وسلم بَعْثًا وَأَمَّرَ عَلَيْهِمْ أُسَامَةَ بْنَ زَيْدٍ، فَطُعِنَ فِي إِمَارَتِهِ، وَقَالَ ‏ ‏ إِنْ تَطْعَنُوا فِي إِمَارَتِهِ فَقَدْ كُنْتُمْ تَطْعَنُونَ فِي إِمَارَةِ أَبِيهِ مِنْ قَبْلِهِ، وَايْمُ اللَّهِ إِنْ كَانَ لَخَلِيقًا لِلإِمْرَةِ، وَإِنْ كَانَ لَمِنْ أَحَبِّ النَّاسِ إِلَىَّ، وَإِنَّ هَذَا لَمِنْ أَحَبِّ النَّاسِ إِلَىَّ بَعْدَهُ ‏‏‏.‏,حَدَّثَنَا مُوسَى بْنُ إِسْمَاعِيلَ، حَدَّثَنَا عَبْدُ الْعَزِيزِ بْنُ مُسْلِمٍ، حَدَّثَنَا عَبْدُ اللَّهِ بْنُ دِينَارٍ، قَالَ سَمِعْتُ ابْنَ عُمَرَ ـ رضى الله عنهما ـ يَقُولُ,بَعَثَ رَسُولُ اللَّهِ صلى الله عليه وسلم بَعْثًا وَأَمَّرَ عَلَيْهِمْ أُسَامَةَ بْنَ زَيْدٍ، فَطُعِنَ فِي إِمَارَتِهِ، وَقَالَ ‏ ‏ إِنْ تَطْعَنُوا فِي إِمَارَتِهِ فَقَدْ كُنْتُمْ تَطْعَنُونَ فِي إِمَارَةِ أَبِيهِ مِنْ قَبْلِهِ، وَايْمُ اللَّهِ إِنْ كَانَ لَخَلِيقًا لِلإِمْرَةِ، وَإِنْ كَانَ لَمِنْ أَحَبِّ النَّاسِ إِلَىَّ، وَإِنَّ هَذَا لَمِنْ أَحَبِّ النَّاسِ إِلَىَّ بَعْدَهُ ‏‏‏.‏,nan,Sahih-Authentic,صحيح
93.0,Judgments (Ahkaam),كتاب الأحكام,34.0,The most quarrelsome person of the opponents,الأَلَدِّ الْخَصِمِ,7188,"Narrated `Aisha: Allah's Messenger (ﷺ) said, ""The most hated person in the sight of Allah, is the most quarrelsome person.""",Narrated `Aisha:,"Allah's Messenger (ﷺ) said, ""The most hated person in the sight of Allah, is the most quarrelsome person.""",حَدَّثَنَا مُسَدَّدٌ، حَدَّثَنَا يَحْيَى بْنُ سَعِيدٍ، عَنِ ابْنِ جُرَيْجٍ، سَمِعْتُ ابْنَ أَبِي مُلَيْكَةَ، عَنْ عَائِشَةَ ـ رضى الله عنها ـ قَالَتْ قَالَ رَسُولُ اللَّهِ صلى الله عليه وسلم ‏ ‏ أَبْغَضُ الرِّجَالِ إِلَى اللَّهِ الأَلَدُّ الْخَصِمُ ‏‏‏.‏,حَدَّثَنَا مُسَدَّدٌ، حَدَّثَنَا يَحْيَى بْنُ سَعِيدٍ، عَنِ ابْنِ جُرَيْجٍ، سَمِعْتُ ابْنَ أَبِي مُلَيْكَةَ، عَنْ عَائِشَةَ ـ رضى الله عنها ـ قَالَتْ قَالَ,رَسُولُ اللَّهِ صلى الله عليه وسلم ‏ ‏ أَبْغَضُ الرِّجَالِ إِلَى اللَّهِ الأَلَدُّ الْخَصِمُ ‏‏‏.‏,nan,Sahih-Authentic,صحيح
