Chapter_Number,Chapter_English,Chapter_Arabic,Section_Number,Section_English,Section_Arabic,Hadith_number,English_Hadith,English_Isnad,English_Matn,Arabic_Hadith,Arabic_Isnad,Arabic_Matn,Arabic_Comment,English_Grade,Arabic_Grade
53.0,Peacemaking,كتاب الصلح,1.0,What has been said regarding (re)conciliation between the people,مَا جَاءَ فِي الإِصْلاَحِ بَيْنَ النَّاسِ,2690,"Narrated Sahl bin Sa`d: There was a dispute amongst the people of the tribe of Bani `Amr bin `Auf. The Prophet (ﷺ) went to themalong with some of his companions in order to make peace between them. The time for the prayerbecame due but the Prophet (ﷺ) did not turn up; Bilal pronounced the Adhan (i.e. call) for the prayer butthe Prophet (ﷺ) did not turn up, so Bilal went to Abu Bakr and said, ""The time for the prayer is due andthe Prophet (ﷺ) i detained, would you lead the people in the prayer?"" Abu Bakr replied, ""Yes, you wish.""So, Bilal pronounced the Iqama of the prayer and Abu Bakr went ahead (to lead the prayer), but theProphet came walking among the rows till he joined the first row. The people started clapping andthey clapped too much, and Abu Bakr used not to look hither and thither in the prayer, but he turnedround and saw the Prophet (ﷺ) standing behind him. The Prophet (ﷺ) beckoned him with his hand to keep onpraying where he was. Abu Bakr raised his hand and praised Allah and then retreated till he came inthe (first) row, and the Prophet (ﷺ) went ahead and lead the people in the prayer. When the Prophet (ﷺ)finished the prayer, he turned towards the people and said, ""O people! When something happens toyou during the prayer, you start clapping. Really clapping is (permissible) for women only. Ifsomething happens to one of you in his prayer, he should say: 'Subhan Allah', (Glorified be Allah), forwhoever hears him (saying so) will direct his attention towards him. O Abu Bakr! What prevented youfrom leading the people in the prayer when I beckoned to you (to continue)?"" Abu Bakr replied, ""Itdid not befit the son of Abu Quhafa to lead the prayer in front of the Prophet.",Narrated Sahl bin Sa`d:,"There was a dispute amongst the people of the tribe of Bani `Amr bin `Auf. The Prophet (ﷺ) went to themalong with some of his companions in order to make peace between them. The time for the prayerbecame due but the Prophet (ﷺ) did not turn up; Bilal pronounced the Adhan (i.e. call) for the prayer butthe Prophet (ﷺ) did not turn up, so Bilal went to Abu Bakr and said, ""The time for the prayer is due andthe Prophet (ﷺ) i detained, would you lead the people in the prayer?"" Abu Bakr replied, ""Yes, you wish.""So, Bilal pronounced the Iqama of the prayer and Abu Bakr went ahead (to lead the prayer), but theProphet came walking among the rows till he joined the first row. The people started clapping andthey clapped too much, and Abu Bakr used not to look hither and thither in the prayer, but he turnedround and saw the Prophet (ﷺ) standing behind him. The Prophet (ﷺ) beckoned him with his hand to keep onpraying where he was. Abu Bakr raised his hand and praised Allah and then retreated till he came inthe (first) row, and the Prophet (ﷺ) went ahead and lead the people in the prayer. When the Prophet (ﷺ)finished the prayer, he turned towards the people and said, ""O people! When something happens toyou during the prayer, you start clapping. Really clapping is (permissible) for women only. Ifsomething happens to one of you in his prayer, he should say: 'Subhan Allah', (Glorified be Allah), forwhoever hears him (saying so) will direct his attention towards him. O Abu Bakr! What prevented youfrom leading the people in the prayer when I beckoned to you (to continue)?"" Abu Bakr replied, ""Itdid not befit the son of Abu Quhafa to lead the prayer in front of the Prophet.",حَدَّثَنَا سَعِيدُ بْنُ أَبِي مَرْيَمَ، حَدَّثَنَا أَبُو غَسَّانَ، قَالَ حَدَّثَنِي أَبُو حَازِمٍ، عَنْ سَهْلِ بْنِ سَعْدٍ ـ رضى الله عنه أَنَّ أُنَاسًا، مِنْ بَنِي عَمْرِو بْنِ عَوْفٍ كَانَ بَيْنَهُمْ شَىْءٌ، فَخَرَجَ إِلَيْهِمُ النَّبِيُّ صلى الله عليه وسلم فِي أُنَاسٍ مِنْ أَصْحَابِهِ يُصْلِحُ بَيْنَهُمْ، فَحَضَرَتِ الصَّلاَةُ، وَلَمْ يَأْتِ النَّبِيُّ صلى الله عليه وسلم، فَجَاءَ بِلاَلٌ، فَأَذَّنَ بِلاَلٌ بِالصَّلاَةِ، وَلَمْ يَأْتِ النَّبِيُّ صلى الله عليه وسلم فَجَاءَ إِلَى أَبِي بَكْرٍ فَقَالَ إِنَّ النَّبِيَّ صلى الله عليه وسلم حُبِسَ، وَقَدْ حَضَرَتِ الصَّلاَةُ فَهَلْ لَكَ أَنْ تَؤُمَّ النَّاسَ فَقَالَ نَعَمْ إِنْ شِئْتَ‏.‏ فَأَقَامَ الصَّلاَةَ فَتَقَدَّمَ أَبُو بَكْرٍ، ثُمَّ جَاءَ النَّبِيُّ صلى الله عليه وسلم يَمْشِي فِي الصُّفُوفِ، حَتَّى قَامَ فِي الصَّفِّ الأَوَّلِ، فَأَخَذَ النَّاسُ بِالتَّصْفِيحِ حَتَّى أَكْثَرُوا، وَكَانَ أَبُو بَكْرٍ لاَ يَكَادُ يَلْتَفِتُ فِي الصَّلاَةِ، فَالْتَفَتَ فَإِذَا هُوَ بِالنَّبِيِّ صلى الله عليه وسلم وَرَاءَهُ فَأَشَارَ إِلَيْهِ بِيَدِهِ، فَأَمَرَهُ يُصَلِّي كَمَا هُوَ، فَرَفَعَ أَبُو بَكْرٍ يَدَهُ، فَحَمِدَ اللَّهَ، ثُمَّ رَجَعَ الْقَهْقَرَى وَرَاءَهُ حَتَّى دَخَلَ فِي الصَّفِّ، وَتَقَدَّمَ النَّبِيُّ صلى الله عليه وسلم فَصَلَّى بِالنَّاسِ، فَلَمَّا فَرَغَ أَقْبَلَ عَلَى النَّاسِ فَقَالَ ‏ ‏ يَا أَيُّهَا النَّاسُ مَا لَكُمْ إِذَا نَابَكُمْ شَىْءٌ فِي صَلاَتِكُمْ أَخَذْتُمْ بِالتَّصْفِيحِ، إِنَّمَا التَّصْفِيحُ لِلنِّسَاءِ، مَنْ نَابَهُ شَىْءٌ فِي صَلاَتِهِ فَلْيَقُلْ سُبْحَانَ اللَّهِ، فَإِنَّهُ لا يَسْمَعُهُ أَحَدٌ إِلاَّ الْتَفَتَ، يَا أَبَا بَكْرٍ مَا مَنَعَكَ حِينَ أَشَرْتُ إِلَيْكَ لَمْ تُصَلِّ بِالنَّاسِ ‏‏‏.‏ فَقَالَ مَا كَانَ يَنْبَغِي لاِبْنِ أَبِي قُحَافَةَ أَنْ يُصَلِّيَ بَيْنَ يَدَىِ النَّبِيِّ صلى الله عليه وسلم‏.‏,حَدَّثَنَا سَعِيدُ بْنُ أَبِي مَرْيَمَ، حَدَّثَنَا أَبُو غَسَّانَ، قَالَ حَدَّثَنِي أَبُو حَازِمٍ، عَنْ سَهْلِ بْنِ سَعْدٍ ـ رضى الله عنه,أَنَّ أُنَاسًا، مِنْ بَنِي عَمْرِو بْنِ عَوْفٍ كَانَ بَيْنَهُمْ شَىْءٌ، فَخَرَجَ إِلَيْهِمُ النَّبِيُّ صلى الله عليه وسلم فِي أُنَاسٍ مِنْ أَصْحَابِهِ يُصْلِحُ بَيْنَهُمْ، فَحَضَرَتِ الصَّلاَةُ، وَلَمْ يَأْتِ النَّبِيُّ صلى الله عليه وسلم، فَجَاءَ بِلاَلٌ، فَأَذَّنَ بِلاَلٌ بِالصَّلاَةِ، وَلَمْ يَأْتِ النَّبِيُّ صلى الله عليه وسلم فَجَاءَ إِلَى أَبِي بَكْرٍ فَقَالَ إِنَّ النَّبِيَّ صلى الله عليه وسلم حُبِسَ، وَقَدْ حَضَرَتِ الصَّلاَةُ فَهَلْ لَكَ أَنْ تَؤُمَّ النَّاسَ فَقَالَ نَعَمْ إِنْ شِئْتَ‏.‏ فَأَقَامَ الصَّلاَةَ فَتَقَدَّمَ أَبُو بَكْرٍ، ثُمَّ جَاءَ النَّبِيُّ صلى الله عليه وسلم يَمْشِي فِي الصُّفُوفِ، حَتَّى قَامَ فِي الصَّفِّ الأَوَّلِ، فَأَخَذَ النَّاسُ بِالتَّصْفِيحِ حَتَّى أَكْثَرُوا، وَكَانَ أَبُو بَكْرٍ لاَ يَكَادُ يَلْتَفِتُ فِي الصَّلاَةِ، فَالْتَفَتَ فَإِذَا هُوَ بِالنَّبِيِّ صلى الله عليه وسلم وَرَاءَهُ فَأَشَارَ إِلَيْهِ بِيَدِهِ، فَأَمَرَهُ يُصَلِّي كَمَا هُوَ، فَرَفَعَ أَبُو بَكْرٍ يَدَهُ، فَحَمِدَ اللَّهَ، ثُمَّ رَجَعَ الْقَهْقَرَى وَرَاءَهُ حَتَّى دَخَلَ فِي الصَّفِّ، وَتَقَدَّمَ النَّبِيُّ صلى الله عليه وسلم فَصَلَّى بِالنَّاسِ، فَلَمَّا فَرَغَ أَقْبَلَ عَلَى النَّاسِ فَقَالَ ‏ ‏ يَا أَيُّهَا النَّاسُ مَا لَكُمْ إِذَا نَابَكُمْ شَىْءٌ فِي صَلاَتِكُمْ أَخَذْتُمْ بِالتَّصْفِيحِ، إِنَّمَا التَّصْفِيحُ لِلنِّسَاءِ، مَنْ نَابَهُ شَىْءٌ فِي صَلاَتِهِ فَلْيَقُلْ سُبْحَانَ اللَّهِ، فَإِنَّهُ لا يَسْمَعُهُ أَحَدٌ إِلاَّ الْتَفَتَ، يَا أَبَا بَكْرٍ مَا مَنَعَكَ حِينَ أَشَرْتُ إِلَيْكَ لَمْ تُصَلِّ بِالنَّاسِ ‏‏‏.‏ فَقَالَ مَا كَانَ يَنْبَغِي لاِبْنِ أَبِي قُحَافَةَ أَنْ يُصَلِّيَ بَيْنَ يَدَىِ النَّبِيِّ صلى الله عليه وسلم‏.‏,nan,Sahih-Authentic,صحيح
53.0,Peacemaking,كتاب الصلح,1.0,What has been said regarding (re)conciliation between the people,مَا جَاءَ فِي الإِصْلاَحِ بَيْنَ النَّاسِ,2691,"Narrated Anas: It was said to the Prophet (ﷺ) ""Would that you see `Abdullah bin Ubai."" So, the Prophet (ﷺ) went to him,riding a donkey, and the Muslims accompanied him, walking on salty barren land. When the Prophet (ﷺ)reached `Abdullah bin Ubai, the latter said, ""Keep away from me! By Allah, the bad smell of yourdonkey has harmed me."" On that an Ansari man said (to `Abdullah), ""By Allah! The smell of thedonkey of Allah's Messenger (ﷺ) is better than your smell."" On that a man from `Abdullah's tribe got angryfor `Abdullah's sake, and the two men abused each other which caused the friends of the two men toget angry, and the two groups started fighting with sticks, shoes and hands. We were informed that thefollowing Divine Verse was revealed (in this concern):-- ""And if two groups of Believers fall tofighting then, make peace between them."" (49.9)",Narrated Anas:,"It was said to the Prophet (ﷺ) ""Would that you see `Abdullah bin Ubai."" So, the Prophet (ﷺ) went to him,riding a donkey, and the Muslims accompanied him, walking on salty barren land. When the Prophet (ﷺ)reached `Abdullah bin Ubai, the latter said, ""Keep away from me! By Allah, the bad smell of yourdonkey has harmed me."" On that an Ansari man said (to `Abdullah), ""By Allah! The smell of thedonkey of Allah's Messenger (ﷺ) is better than your smell."" On that a man from `Abdullah's tribe got angryfor `Abdullah's sake, and the two men abused each other which caused the friends of the two men toget angry, and the two groups started fighting with sticks, shoes and hands. We were informed that thefollowing Divine Verse was revealed (in this concern):-- ""And if two groups of Believers fall tofighting then, make peace between them."" (49.9)",حَدَّثَنَا مُسَدَّدٌ، حَدَّثَنَا مُعْتَمِرٌ، قَالَ سَمِعْتُ أَبِي أَنَّ أَنَسًا ـ رضى الله عنه ـ قَالَ قِيلَ لِلنَّبِيِّ صلى الله عليه وسلم لَوْ أَتَيْتَ عَبْدَ اللَّهِ بْنَ أُبَىٍّ‏.‏ فَانْطَلَقَ إِلَيْهِ النَّبِيُّ صلى الله عليه وسلم وَرَكِبَ حِمَارًا، فَانْطَلَقَ الْمُسْلِمُونَ يَمْشُونَ مَعَهُ، وَهْىَ أَرْضٌ سَبِخَةٌ، فَلَمَّا أَتَاهُ النَّبِيُّ صلى الله عليه وسلم فَقَالَ إِلَيْكَ عَنِّي، وَاللَّهِ لَقَدْ آذَانِي نَتْنُ حِمَارِكَ‏.‏ فَقَالَ رَجُلٌ مِنَ الأَنْصَارِ مِنْهُمْ وَاللَّهِ لَحِمَارُ رَسُولِ اللَّهِ صلى الله عليه وسلم أَطْيَبُ رِيحًا مِنْكَ‏.‏ فَغَضِبَ لِعَبْدِ اللَّهِ رَجُلٌ مِنْ قَوْمِهِ فَشَتَمَا، فَغَضِبَ لِكُلِّ وَاحِدٍ مِنْهُمَا أَصْحَابُهُ، فَكَانَ بَيْنَهُمَا ضَرْبٌ بِالْجَرِيدِ وَالأَيْدِي وَالنِّعَالِ، فَبَلَغَنَا أَنَّهَا أُنْزِلَتْ ‏{‏وَإِنْ طَائِفَتَانِ مِنَ الْمُؤْمِنِينَ اقْتَتَلُوا فَأَصْلِحُوا بَيْنَهُمَا‏}‏‏.‏,حَدَّثَنَا مُسَدَّدٌ، حَدَّثَنَا مُعْتَمِرٌ، قَالَ سَمِعْتُ أَبِي أَنَّ أَنَسًا ـ رضى الله عنه ـ قَالَ,قِيلَ لِلنَّبِيِّ صلى الله عليه وسلم لَوْ أَتَيْتَ عَبْدَ اللَّهِ بْنَ أُبَىٍّ‏.‏ فَانْطَلَقَ إِلَيْهِ النَّبِيُّ صلى الله عليه وسلم وَرَكِبَ حِمَارًا، فَانْطَلَقَ الْمُسْلِمُونَ يَمْشُونَ مَعَهُ، وَهْىَ أَرْضٌ سَبِخَةٌ، فَلَمَّا أَتَاهُ النَّبِيُّ صلى الله عليه وسلم فَقَالَ إِلَيْكَ عَنِّي، وَاللَّهِ لَقَدْ آذَانِي نَتْنُ حِمَارِكَ‏.‏ فَقَالَ رَجُلٌ مِنَ الأَنْصَارِ مِنْهُمْ وَاللَّهِ لَحِمَارُ رَسُولِ اللَّهِ صلى الله عليه وسلم أَطْيَبُ رِيحًا مِنْكَ‏.‏ فَغَضِبَ لِعَبْدِ اللَّهِ رَجُلٌ مِنْ قَوْمِهِ فَشَتَمَا، فَغَضِبَ لِكُلِّ وَاحِدٍ مِنْهُمَا أَصْحَابُهُ، فَكَانَ بَيْنَهُمَا ضَرْبٌ بِالْجَرِيدِ وَالأَيْدِي وَالنِّعَالِ، فَبَلَغَنَا أَنَّهَا أُنْزِلَتْ ‏{‏وَإِنْ طَائِفَتَانِ مِنَ الْمُؤْمِنِينَ اقْتَتَلُوا فَأَصْلِحُوا بَيْنَهُمَا‏}‏‏.‏,nan,Sahih-Authentic,صحيح
53.0,Peacemaking,كتاب الصلح,2.0,He who makes peace between the people is not a liar,لَيْسَ الْكَاذِبُ الَّذِي يُصْلِحُ بَيْنَ النَّاسِ,2692,"Narrated Um Kulthum bint `Uqba: That she heard Allah's Messenger (ﷺ) saying, ""He who makes peace between the people by inventing goodinformation or saying good things, is not a liar.""",Narrated Um Kulthum bint `Uqba:,"That she heard Allah's Messenger (ﷺ) saying, ""He who makes peace between the people by inventing goodinformation or saying good things, is not a liar.""",حَدَّثَنَا عَبْدُ الْعَزِيزِ بْنُ عَبْدِ اللَّهِ، حَدَّثَنَا إِبْرَاهِيمُ بْنُ سَعْدٍ، عَنْ صَالِحٍ، عَنِ ابْنِ شِهَابٍ، أَنَّ حُمَيْدَ بْنَ عَبْدِ الرَّحْمَنِ، أَخْبَرَهُ أَنَّ أُمَّهُ أُمَّ كُلْثُومٍ بِنْتَ عُقْبَةَ أَخْبَرَتْهُ أَنَّهَا، سَمِعَتْ رَسُولَ اللَّهِ صلى الله عليه وسلم يَقُولُ ‏ ‏ لَيْسَ الْكَذَّابُ الَّذِي يُصْلِحُ بَيْنَ النَّاسِ، فَيَنْمِي خَيْرًا، أَوْ يَقُولُ خَيْرًا ‏‏‏.‏,حَدَّثَنَا عَبْدُ الْعَزِيزِ بْنُ عَبْدِ اللَّهِ، حَدَّثَنَا إِبْرَاهِيمُ بْنُ سَعْدٍ، عَنْ صَالِحٍ، عَنِ ابْنِ شِهَابٍ، أَنَّ حُمَيْدَ بْنَ عَبْدِ الرَّحْمَنِ، أَخْبَرَهُ أَنَّ أُمَّهُ أُمَّ كُلْثُومٍ بِنْتَ عُقْبَةَ أَخْبَرَتْهُ أَنَّهَا، سَمِعَتْ,رَسُولَ اللَّهِ صلى الله عليه وسلم يَقُولُ ‏ ‏ لَيْسَ الْكَذَّابُ الَّذِي يُصْلِحُ بَيْنَ النَّاسِ، فَيَنْمِي خَيْرًا، أَوْ يَقُولُ خَيْرًا ‏‏‏.‏,nan,Sahih-Authentic,صحيح
53.0,Peacemaking,كتاب الصلح,3.0," ""Let us go to bring about a (re)conciliation.""",قَوْلِ الإِمَامِ لأَصْحَابِهِ اذْهَبُوا بِنَا نُصْلِحُ,2693,"Narrated Sahl bin Sa`d: Once the people of Quba fought with each other till they threw stones on each other. When Allah'sApostle was informed about it, he said, ""Let us go to bring about a reconciliation between them.""",Narrated Sahl bin Sa`d:,"Once the people of Quba fought with each other till they threw stones on each other. When Allah'sApostle was informed about it, he said, ""Let us go to bring about a reconciliation between them.""",حَدَّثَنَا مُحَمَّدُ بْنُ عَبْدِ اللَّهِ، حَدَّثَنَا عَبْدُ الْعَزِيزِ بْنُ عَبْدِ اللَّهِ الأُوَيْسِيُّ، وَإِسْحَاقُ بْنُ مُحَمَّدٍ الْفَرْوِيُّ، قَالاَ حَدَّثَنَا مُحَمَّدُ بْنُ جَعْفَرٍ، عَنْ أَبِي حَازِمٍ، عَنْ سَهْلِ بْنِ سَعْدٍ ـ رضى الله عنه أَنَّ أَهْلَ، قُبَاءٍ اقْتَتَلُوا حَتَّى تَرَامَوْا بِالْحِجَارَةِ، فَأُخْبِرَ رَسُولُ اللَّهِ صلى الله عليه وسلم بِذَلِكَ فَقَالَ ‏ ‏ اذْهَبُوا بِنَا نُصْلِحُ بَيْنَهُمْ ‏‏‏.‏,حَدَّثَنَا مُحَمَّدُ بْنُ عَبْدِ اللَّهِ، حَدَّثَنَا عَبْدُ الْعَزِيزِ بْنُ عَبْدِ اللَّهِ الأُوَيْسِيُّ، وَإِسْحَاقُ بْنُ مُحَمَّدٍ الْفَرْوِيُّ، قَالاَ حَدَّثَنَا مُحَمَّدُ بْنُ جَعْفَرٍ، عَنْ أَبِي حَازِمٍ، عَنْ سَهْلِ بْنِ سَعْدٍ ـ رضى الله عنه,أَنَّ أَهْلَ، قُبَاءٍ اقْتَتَلُوا حَتَّى تَرَامَوْا بِالْحِجَارَةِ، فَأُخْبِرَ رَسُولُ اللَّهِ صلى الله عليه وسلم بِذَلِكَ فَقَالَ ‏ ‏ اذْهَبُوا بِنَا نُصْلِحُ بَيْنَهُمْ ‏‏‏.‏,nan,Sahih-Authentic,صحيح
53.0,Peacemaking,كتاب الصلح,4.0," The Statement of Allah azza'wajal: ""... If they make terms of peace between themselves; and making peace is better...""",قَوْلِ اللَّهِ تَعَالَى: {أَنْ يَصَّالَحَا بَيْنَهُمَا صُلْحًا وَالصُّلْحُ خَيْرٌ},2694,"Narrated Aisha: The following Verse: If a woman fears cruelty or desertion on her husband's part (i.e. the husbandnotices something unpleasant about his wife, such as old age or the like, and wants to divorce her, butshe asks him to keep her and provide for her as he wishes). (4.128) ""There is no blame on them ifthey reconcile on such basis.""",Narrated Aisha:,"The following Verse: If a woman fears cruelty or desertion on her husband's part (i.e. the husbandnotices something unpleasant about his wife, such as old age or the like, and wants to divorce her, butshe asks him to keep her and provide for her as he wishes). (4.128) ""There is no blame on them ifthey reconcile on such basis.""",حَدَّثَنَا قُتَيْبَةُ بْنُ سَعِيدٍ، حَدَّثَنَا سُفْيَانُ، عَنْ هِشَامِ بْنِ عُرْوَةَ، عَنْ أَبِيهِ، عَنْ عَائِشَةَ ـ رضى الله عنها – ‏{‏وَإِنِ امْرَأَةٌ خَافَتْ مِنْ بَعْلِهَا نُشُوزًا أَوْ إِعْرَاضًا‏}‏ قَالَتْ هُوَ الرَّجُلُ يَرَى مِنِ امْرَأَتِهِ مَا لاَ يُعْجِبُهُ، كِبَرًا أَوْ غَيْرَهُ، فَيُرِيدُ فِرَاقَهَا فَتَقُولُ أَمْسِكْنِي، وَاقْسِمْ لِي مَا شِئْتَ‏.‏ قَالَتْ فَلاَ بَأْسَ إِذَا تَرَاضَيَا‏.‏,حَدَّثَنَا قُتَيْبَةُ بْنُ سَعِيدٍ، حَدَّثَنَا سُفْيَانُ، عَنْ هِشَامِ بْنِ عُرْوَةَ، عَنْ أَبِيهِ، عَنْ عَائِشَةَ ـ رضى الله عنها –,‏{‏وَإِنِ امْرَأَةٌ خَافَتْ مِنْ بَعْلِهَا نُشُوزًا أَوْ إِعْرَاضًا‏}‏ قَالَتْ هُوَ الرَّجُلُ يَرَى مِنِ امْرَأَتِهِ مَا لاَ يُعْجِبُهُ، كِبَرًا أَوْ غَيْرَهُ، فَيُرِيدُ فِرَاقَهَا فَتَقُولُ أَمْسِكْنِي، وَاقْسِمْ لِي مَا شِئْتَ‏.‏ قَالَتْ فَلاَ بَأْسَ إِذَا تَرَاضَيَا‏.‏,nan,Sahih-Authentic,صحيح
