Chapter_Number,Chapter_English,Chapter_Arabic,Section_Number,Section_English,Section_Arabic,Hadith_number,English_Hadith,English_Isnad,English_Matn,Arabic_Hadith,Arabic_Isnad,Arabic_Matn,Arabic_Comment,English_Grade,Arabic_Grade
93.0,Judgments (Ahkaam),كتاب الأحكام,43.0,How do the people give the Bai'a to the Imam,كَيْفَ يُبَايِعُ الإِمَامُ النَّاسَ,7206,"Narrated Yazid: I said to Salama, ""For what did you give the Pledge of allegiance to the Prophet (ﷺ) on the Day ofHudaibiya?"" He replied, ""For death.""",Narrated Yazid:,"I said to Salama, ""For what did you give the Pledge of allegiance to the Prophet (ﷺ) on the Day ofHudaibiya?"" He replied, ""For death.""",حَدَّثَنَا عَبْدُ اللَّهِ بْنُ مَسْلَمَةَ، حَدَّثَنَا حَاتِمٌ، عَنْ يَزِيدَ، قَالَ قُلْتُ لِسَلَمَةَ عَلَى أَىِّ شَىْءٍ بَايَعْتُمُ النَّبِيَّ صلى الله عليه وسلم يَوْمَ الْحُدَيْبِيَةِ قَالَ عَلَى الْمَوْتِ‏.‏,حَدَّثَنَا عَبْدُ اللَّهِ بْنُ مَسْلَمَةَ، حَدَّثَنَا حَاتِمٌ، عَنْ يَزِيدَ، قَالَ,قُلْتُ لِسَلَمَةَ عَلَى أَىِّ شَىْءٍ بَايَعْتُمُ النَّبِيَّ صلى الله عليه وسلم يَوْمَ الْحُدَيْبِيَةِ قَالَ عَلَى الْمَوْتِ‏.‏,nan,Sahih-Authentic,صحيح
93.0,Judgments (Ahkaam),كتاب الأحكام,43.0,How do the people give the Bai'a to the Imam,كَيْفَ يُبَايِعُ الإِمَامُ النَّاسَ,7207,"Narrated Al-Miswar bin Makhrama: The group of people whom `Umar had selected as candidates for the Caliphate gathered and consultedeach other. `Abdur-Rahman said to them, ""I am not going to compete with you in this matter, but ifyou wish, I would select for you a caliph from among you.""So all of them agreed to let `Abdur-Rahman decide the case. So when the candidates placed the casein the hands of `Abdur-Rahman, the people went towards him and nobody followed the rest of thegroup nor obeyed any after him. So the people followed `Abdur-Rahman and consulted him all thosenights till there came the night we gave the oath of allegiance to `Uthman. Al-Miswar (bin Makhrama)added: `Abdur-Rahman called on me after a portion of the night had passed and knocked on my doortill I got up, and he said to me, ""I see you have been sleeping! By Allah, during the last three nights Ihave not slept enough. Go and call Az-Zubair and Sa`d.'So I called them for him and he consulted them and then called me saying, 'Call `Ali for me."" I called`Ali and he held a private talk with him till very late at night, and then 'Al, got up to leave having hadmuch hope (to be chosen as a Caliph) but `Abdur-Rahman was afraid of something concerning `Ali.`Abdur-Rahman then said to me, ""Call `Uthman for me."" I called him and he kept on speaking to himprivately till the Mu'adh-dhin put an end to their talk by announcing the Adhan for the Fajr prayer.When the people finished their morning prayer and that (six men) group gathered near the pulpit,`Abdur-Rahman sent for all the Muhajirin (emigrants) and the Ansar present there and sent for thearmy chief who had performed the Hajj with `Umar that year. When all of them had gathered, `Abdur-Rahman said, ""None has the right to be worshipped but Allah,"" and added, ""Now then, O `Ali, I havelooked at the people's tendencies and noticed that they do not consider anybody equal to `Uthman, soyou should not incur blame (by disagreeing)."" Then `Abdur-Rahman said (to `Uthman), ""I gave theoath of allegiance to you on condition that you will follow Allah's Laws and the traditions of Allah'sApostle and the traditions of the two Caliphs after him."" So `Abdur-Rahman gave the oath ofallegiance to him, and so did the people including the Muhajirin (emigrants) and the Ansar and thechiefs of the army staff and all the Muslims.",Narrated Al-Miswar bin Makhrama:,"The group of people whom `Umar had selected as candidates for the Caliphate gathered and consultedeach other. `Abdur-Rahman said to them, ""I am not going to compete with you in this matter, but ifyou wish, I would select for you a caliph from among you.""So all of them agreed to let `Abdur-Rahman decide the case. So when the candidates placed the casein the hands of `Abdur-Rahman, the people went towards him and nobody followed the rest of thegroup nor obeyed any after him. So the people followed `Abdur-Rahman and consulted him all thosenights till there came the night we gave the oath of allegiance to `Uthman. Al-Miswar (bin Makhrama)added: `Abdur-Rahman called on me after a portion of the night had passed and knocked on my doortill I got up, and he said to me, ""I see you have been sleeping! By Allah, during the last three nights Ihave not slept enough. Go and call Az-Zubair and Sa`d.'So I called them for him and he consulted them and then called me saying, 'Call `Ali for me."" I called`Ali and he held a private talk with him till very late at night, and then 'Al, got up to leave having hadmuch hope (to be chosen as a Caliph) but `Abdur-Rahman was afraid of something concerning `Ali.`Abdur-Rahman then said to me, ""Call `Uthman for me."" I called him and he kept on speaking to himprivately till the Mu'adh-dhin put an end to their talk by announcing the Adhan for the Fajr prayer.When the people finished their morning prayer and that (six men) group gathered near the pulpit,`Abdur-Rahman sent for all the Muhajirin (emigrants) and the Ansar present there and sent for thearmy chief who had performed the Hajj with `Umar that year. When all of them had gathered, `Abdur-Rahman said, ""None has the right to be worshipped but Allah,"" and added, ""Now then, O `Ali, I havelooked at the people's tendencies and noticed that they do not consider anybody equal to `Uthman, soyou should not incur blame (by disagreeing)."" Then `Abdur-Rahman said (to `Uthman), ""I gave theoath of allegiance to you on condition that you will follow Allah's Laws and the traditions of Allah'sApostle and the traditions of the two Caliphs after him."" So `Abdur-Rahman gave the oath ofallegiance to him, and so did the people including the Muhajirin (emigrants) and the Ansar and thechiefs of the army staff and all the Muslims.",حَدَّثَنَا عَبْدُ اللَّهِ بْنُ مُحَمَّدِ بْنِ أَسْمَاءَ، حَدَّثَنَا جُوَيْرِيَةُ، عَنْ مَالِكٍ، عَنِ الزُّهْرِيِّ، أَنَّ حُمَيْدَ بْنَ عَبْدِ الرَّحْمَنِ، أَخْبَرَهُ أَنَّ الْمِسْوَرَ بْنَ مَخْرَمَةَ أَخْبَرَهُ‏.‏ أَنَّ الرَّهْطَ الَّذِينَ وَلاَّهُمْ عُمَرُ اجْتَمَعُوا فَتَشَاوَرُوا، قَالَ لَهُمْ عَبْدُ الرَّحْمَنِ لَسْتُ بِالَّذِي أُنَافِسُكُمْ عَلَى هَذَا الأَمْرِ، وَلَكِنَّكُمْ إِنْ شِئْتُمُ اخْتَرْتُ لَكُمْ مِنْكُمْ‏.‏ فَجَعَلُوا ذَلِكَ إِلَى عَبْدِ الرَّحْمَنِ، فَلَمَّا وَلَّوْا عَبْدَ الرَّحْمَنِ أَمْرَهُمْ فَمَالَ النَّاسُ عَلَى عَبْدِ الرَّحْمَنِ، حَتَّى مَا أَرَى أَحَدًا مِنَ النَّاسِ يَتْبَعُ أُولَئِكَ الرَّهْطَ وَلاَ يَطَأُ عَقِبَهُ، وَمَالَ النَّاسُ عَلَى عَبْدِ الرَّحْمَنِ يُشَاوِرُونَهُ تِلْكَ اللَّيَالِيَ حَتَّى إِذَا كَانَتِ اللَّيْلَةُ الَّتِي أَصْبَحْنَا مِنْهَا، فَبَايَعْنَا عُثْمَانَ قَالَ الْمِسْوَرُ طَرَقَنِي عَبْدُ الرَّحْمَنِ بَعْدَ هَجْعٍ مِنَ اللَّيْلِ فَضَرَبَ الْبَابَ حَتَّى اسْتَيْقَظْتُ فَقَالَ أَرَاكَ نَائِمًا، فَوَاللَّهِ مَا اكْتَحَلْتُ هَذِهِ اللَّيْلَةَ بِكَبِيرِ نَوْمٍ، انْطَلِقْ فَادْعُ الزُّبَيْرَ وَسَعْدًا، فَدَعَوْتُهُمَا لَهُ فَشَاوَرَهُمَا ثُمَّ دَعَانِي فَقَالَ ادْعُ لِي عَلِيًّا‏.‏ فَدَعَوْتُهُ فَنَاجَاهُ حَتَّى ابْهَارَّ اللَّيْلُ، ثُمَّ قَامَ عَلِيٌّ مِنْ عِنْدِهِ، وَهْوَ عَلَى طَمَعٍ، وَقَدْ كَانَ عَبْدُ الرَّحْمَنِ يَخْشَى مِنْ عَلِيٍّ شَيْئًا، ثُمَّ قَالَ ادْعُ لِي عُثْمَانَ، فَدَعَوْتُهُ فَنَاجَاهُ حَتَّى فَرَّقَ بَيْنَهُمَا الْمُؤَذِّنُ بِالصُّبْحِ، فَلَمَّا صَلَّى لِلنَّاسِ الصُّبْحَ وَاجْتَمَعَ أُولَئِكَ الرَّهْطُ عِنْدَ الْمِنْبَرِ، فَأَرْسَلَ إِلَى مَنْ كَانَ حَاضِرًا مِنَ الْمُهَاجِرِينَ وَالأَنْصَارِ، وَأَرْسَلَ إِلَى أُمَرَاءِ الأَجْنَادِ وَكَانُوا وَافَوْا تِلْكَ الْحَجَّةَ مَعَ عُمَرَ، فَلَمَّا اجْتَمَعُوا تَشَهَّدَ عَبْدُ الرَّحْمَنِ ثُمَّ قَالَ أَمَّا بَعْدُ يَا عَلِيُّ، إِنِّي قَدْ نَظَرْتُ فِي أَمْرِ النَّاسِ فَلَمْ أَرَهُمْ يَعْدِلُونَ بِعُثْمَانَ، فَلاَ تَجْعَلَنَّ عَلَى نَفْسِكَ سَبِيلاً‏.‏ فَقَالَ أُبَايِعُكَ عَلَى سُنَّةِ اللَّهِ وَرَسُولِهِ وَالْخَلِيفَتَيْنِ مِنْ بَعْدِهِ‏.‏ فَبَايَعَهُ عَبْدُ الرَّحْمَنِ، وَبَايَعَهُ النَّاسُ الْمُهَاجِرُونَ وَالأَنْصَارُ وَأُمَرَاءُ الأَجْنَادِ وَالْمُسْلِمُونَ‏.‏,حَدَّثَنَا عَبْدُ اللَّهِ بْنُ مُحَمَّدِ بْنِ أَسْمَاءَ، حَدَّثَنَا جُوَيْرِيَةُ، عَنْ مَالِكٍ، عَنِ الزُّهْرِيِّ، أَنَّ حُمَيْدَ بْنَ عَبْدِ الرَّحْمَنِ، أَخْبَرَهُ أَنَّ الْمِسْوَرَ بْنَ مَخْرَمَةَ أَخْبَرَهُ‏.‏,أَنَّ الرَّهْطَ الَّذِينَ وَلاَّهُمْ عُمَرُ اجْتَمَعُوا فَتَشَاوَرُوا، قَالَ لَهُمْ عَبْدُ الرَّحْمَنِ لَسْتُ بِالَّذِي أُنَافِسُكُمْ عَلَى هَذَا الأَمْرِ، وَلَكِنَّكُمْ إِنْ شِئْتُمُ اخْتَرْتُ لَكُمْ مِنْكُمْ‏.‏ فَجَعَلُوا ذَلِكَ إِلَى عَبْدِ الرَّحْمَنِ، فَلَمَّا وَلَّوْا عَبْدَ الرَّحْمَنِ أَمْرَهُمْ فَمَالَ النَّاسُ عَلَى عَبْدِ الرَّحْمَنِ، حَتَّى مَا أَرَى أَحَدًا مِنَ النَّاسِ يَتْبَعُ أُولَئِكَ الرَّهْطَ وَلاَ يَطَأُ عَقِبَهُ، وَمَالَ النَّاسُ عَلَى عَبْدِ الرَّحْمَنِ يُشَاوِرُونَهُ تِلْكَ اللَّيَالِيَ حَتَّى إِذَا كَانَتِ اللَّيْلَةُ الَّتِي أَصْبَحْنَا مِنْهَا، فَبَايَعْنَا عُثْمَانَ قَالَ الْمِسْوَرُ طَرَقَنِي عَبْدُ الرَّحْمَنِ بَعْدَ هَجْعٍ مِنَ اللَّيْلِ فَضَرَبَ الْبَابَ حَتَّى اسْتَيْقَظْتُ فَقَالَ أَرَاكَ نَائِمًا، فَوَاللَّهِ مَا اكْتَحَلْتُ هَذِهِ اللَّيْلَةَ بِكَبِيرِ نَوْمٍ، انْطَلِقْ فَادْعُ الزُّبَيْرَ وَسَعْدًا، فَدَعَوْتُهُمَا لَهُ فَشَاوَرَهُمَا ثُمَّ دَعَانِي فَقَالَ ادْعُ لِي عَلِيًّا‏.‏ فَدَعَوْتُهُ فَنَاجَاهُ حَتَّى ابْهَارَّ اللَّيْلُ، ثُمَّ قَامَ عَلِيٌّ مِنْ عِنْدِهِ، وَهْوَ عَلَى طَمَعٍ، وَقَدْ كَانَ عَبْدُ الرَّحْمَنِ يَخْشَى مِنْ عَلِيٍّ شَيْئًا، ثُمَّ قَالَ ادْعُ لِي عُثْمَانَ، فَدَعَوْتُهُ فَنَاجَاهُ حَتَّى فَرَّقَ بَيْنَهُمَا الْمُؤَذِّنُ بِالصُّبْحِ، فَلَمَّا صَلَّى لِلنَّاسِ الصُّبْحَ وَاجْتَمَعَ أُولَئِكَ الرَّهْطُ عِنْدَ الْمِنْبَرِ، فَأَرْسَلَ إِلَى مَنْ كَانَ حَاضِرًا مِنَ الْمُهَاجِرِينَ وَالأَنْصَارِ، وَأَرْسَلَ إِلَى أُمَرَاءِ الأَجْنَادِ وَكَانُوا وَافَوْا تِلْكَ الْحَجَّةَ مَعَ عُمَرَ، فَلَمَّا اجْتَمَعُوا تَشَهَّدَ عَبْدُ الرَّحْمَنِ ثُمَّ قَالَ أَمَّا بَعْدُ يَا عَلِيُّ، إِنِّي قَدْ نَظَرْتُ فِي أَمْرِ النَّاسِ فَلَمْ أَرَهُمْ يَعْدِلُونَ بِعُثْمَانَ، فَلاَ تَجْعَلَنَّ عَلَى نَفْسِكَ سَبِيلاً‏.‏ فَقَالَ أُبَايِعُكَ عَلَى سُنَّةِ اللَّهِ وَرَسُولِهِ وَالْخَلِيفَتَيْنِ مِنْ بَعْدِهِ‏.‏ فَبَايَعَهُ عَبْدُ الرَّحْمَنِ، وَبَايَعَهُ النَّاسُ الْمُهَاجِرُونَ وَالأَنْصَارُ وَأُمَرَاءُ الأَجْنَادِ وَالْمُسْلِمُونَ‏.‏,nan,Sahih-Authentic,صحيح
93.0,Judgments (Ahkaam),كتاب الأحكام,44.0,Whosoever gave the Bai'a twice,مَنْ بَايَعَ مَرَّتَيْنِ,7208,"Narrated Salama: We gave the oath of allegiance to the Prophet (ﷺ) under the tree. He said to me, ""O Salama! Will you notgive the oath of allegiance?"" I replied, ""O Allah's Messenger (ﷺ)! I have already given the oath of allegiancefor the first time."" He said, (Give it again) for the second time.",Narrated Salama:,"We gave the oath of allegiance to the Prophet (ﷺ) under the tree. He said to me, ""O Salama! Will you notgive the oath of allegiance?"" I replied, ""O Allah's Messenger (ﷺ)! I have already given the oath of allegiancefor the first time."" He said, (Give it again) for the second time.","حَدَّثَنَا أَبُو عَاصِمٍ، عَنْ يَزِيدَ بْنِ أَبِي عُبَيْدٍ، عَنْ سَلَمَةَ، قَالَ بَايَعْنَا النَّبِيَّ صلى الله عليه وسلم تَحْتَ الشَّجَرَةِ فَقَالَ لِي ‏""‏ يَا سَلَمَةُ أَلاَ تُبَايِعُ ‏""‏‏.‏ قُلْتُ يَا رَسُولَ اللَّهِ قَدْ بَايَعْتُ فِي الأَوَّلِ‏.‏ قَالَ ‏""‏ وَفِي الثَّانِي ‏""‏‏.‏",حَدَّثَنَا أَبُو عَاصِمٍ، عَنْ يَزِيدَ بْنِ أَبِي عُبَيْدٍ، عَنْ سَلَمَةَ، قَالَ,"بَايَعْنَا النَّبِيَّ صلى الله عليه وسلم تَحْتَ الشَّجَرَةِ فَقَالَ لِي ‏""‏ يَا سَلَمَةُ أَلاَ تُبَايِعُ ‏""‏‏.‏ قُلْتُ يَا رَسُولَ اللَّهِ قَدْ بَايَعْتُ فِي الأَوَّلِ‏.‏ قَالَ ‏""‏ وَفِي الثَّانِي ‏""‏‏.‏",nan,Sahih-Authentic,صحيح
93.0,Judgments (Ahkaam),كتاب الأحكام,45.0,The giving of the Bai'a by the bedouins,بَيْعَةِ الأَعْرَابِ,7209,"Narrated Jabir bin `Abdullah: A bedouin gave the Pledge of allegiance to Allah's Messenger (ﷺ) for Islam and the bedouin got a feverwhere upon he said to the Prophet (ﷺ) ""Cancel my Pledge."" But the Prophet (ﷺ) refused. He came to him(again) saying, ""Cancel my Pledge.' But the Prophet (ﷺ) refused. Then (the bedouin) left (Medina). Allah'sApostle said: ""Medina is like a pair of bellows (furnace): It expels its impurities and brightens andclears its good.""",Narrated Jabir bin `Abdullah:,"A bedouin gave the Pledge of allegiance to Allah's Messenger (ﷺ) for Islam and the bedouin got a feverwhere upon he said to the Prophet (ﷺ) ""Cancel my Pledge."" But the Prophet (ﷺ) refused. He came to him(again) saying, ""Cancel my Pledge.' But the Prophet (ﷺ) refused. Then (the bedouin) left (Medina). Allah'sApostle said: ""Medina is like a pair of bellows (furnace): It expels its impurities and brightens andclears its good.""",حَدَّثَنَا عَبْدُ اللَّهِ بْنُ مَسْلَمَةَ، عَنْ مَالِكٍ، عَنْ مُحَمَّدِ بْنِ الْمُنْكَدِرِ، عَنْ جَابِرِ بْنِ عَبْدِ اللَّهِ ـ رضى الله عنهما ـ أَنَّ أَعْرَابِيًّا بَايَعَ رَسُولَ اللَّهِ صلى الله عليه وسلم عَلَى الإِسْلاَمِ، فَأَصَابَهُ وَعْكٌ فَقَالَ أَقِلْنِي بَيْعَتِي‏.‏ فَأَبَى، ثُمَّ جَاءَهُ فَقَالَ أَقِلْنِي بَيْعَتِي‏.‏ فَأَبَى، فَخَرَجَ‏.‏ فَقَالَ رَسُولُ اللَّهِ صلى الله عليه وسلم ‏ ‏ الْمَدِينَةُ كَالْكِيرِ، تَنْفِي خَبَثَهَا، وَيَنْصَعُ طِيبُهَا ‏‏‏.‏,حَدَّثَنَا عَبْدُ اللَّهِ بْنُ مَسْلَمَةَ، عَنْ مَالِكٍ، عَنْ مُحَمَّدِ بْنِ الْمُنْكَدِرِ، عَنْ جَابِرِ بْنِ عَبْدِ اللَّهِ ـ رضى الله عنهما ـ,أَنَّ أَعْرَابِيًّا بَايَعَ رَسُولَ اللَّهِ صلى الله عليه وسلم عَلَى الإِسْلاَمِ، فَأَصَابَهُ وَعْكٌ فَقَالَ أَقِلْنِي بَيْعَتِي‏.‏ فَأَبَى، ثُمَّ جَاءَهُ فَقَالَ أَقِلْنِي بَيْعَتِي‏.‏ فَأَبَى، فَخَرَجَ‏.‏ فَقَالَ رَسُولُ اللَّهِ صلى الله عليه وسلم ‏ ‏ الْمَدِينَةُ كَالْكِيرِ، تَنْفِي خَبَثَهَا، وَيَنْصَعُ طِيبُهَا ‏‏‏.‏,nan,Sahih-Authentic,صحيح
93.0,Judgments (Ahkaam),كتاب الأحكام,46.0,The Bai'a of a child,بَيْعَةِ الصَّغِيرِ,7210,"Narrated `Abdullah bin Hisham: who was born during the lifetime of the Prophet (ﷺ) that his mother, Zainab bint Humaid had taken him toAllah's Messenger (ﷺ) and said, ""O Allah's Messenger (ﷺ)! Take his Pledge of allegiance (for Islam)."" The Prophet (ﷺ)said, ""He (`Abdullah bin Hisham) is a little child,"" and passed his hand over his head and invokedAllah for him. `Abdullah bin Hisham used to slaughter one sheep as a sacrifice on behalf of all of hisfamily.",Narrated `Abdullah bin Hisham:,"who was born during the lifetime of the Prophet (ﷺ) that his mother, Zainab bint Humaid had taken him toAllah's Messenger (ﷺ) and said, ""O Allah's Messenger (ﷺ)! Take his Pledge of allegiance (for Islam)."" The Prophet (ﷺ)said, ""He (`Abdullah bin Hisham) is a little child,"" and passed his hand over his head and invokedAllah for him. `Abdullah bin Hisham used to slaughter one sheep as a sacrifice on behalf of all of hisfamily.",حَدَّثَنَا عَلِيُّ بْنُ عَبْدِ اللَّهِ، حَدَّثَنَا عَبْدُ اللَّهِ بْنُ يَزِيدَ، حَدَّثَنَا سَعِيدٌ ـ هُوَ ابْنُ أَبِي أَيُّوبَ ـ قَالَ حَدَّثَنِي أَبُو عَقِيلٍ، زُهْرَةُ بْنُ مَعْبَدٍ عَنْ جَدِّهِ عَبْدِ اللَّهِ بْنِ هِشَامٍ، وَكَانَ، قَدْ أَدْرَكَ النَّبِيَّ صلى الله عليه وسلم وَذَهَبَتْ بِهِ أُمُّهُ زَيْنَبُ ابْنَةُ حُمَيْدٍ إِلَى رَسُولِ اللَّهِ صلى الله عليه وسلم فَقَالَتْ يَا رَسُولَ اللَّهِ بَايِعْهُ‏.‏ فَقَالَ النَّبِيُّ صلى الله عليه وسلم ‏ ‏ هُوَ صَغِيرٌ ‏‏ فَمَسَحَ رَأْسَهُ وَدَعَا لَهُ، وَكَانَ يُضَحِّي بِالشَّاةِ الْوَاحِدَةِ عَنْ جَمِيعِ أَهْلِهِ‏.‏,حَدَّثَنَا عَلِيُّ بْنُ عَبْدِ اللَّهِ، حَدَّثَنَا عَبْدُ اللَّهِ بْنُ يَزِيدَ، حَدَّثَنَا سَعِيدٌ ـ هُوَ ابْنُ أَبِي أَيُّوبَ ـ قَالَ حَدَّثَنِي أَبُو عَقِيلٍ، زُهْرَةُ بْنُ مَعْبَدٍ عَنْ جَدِّهِ عَبْدِ اللَّهِ بْنِ هِشَامٍ،,وَكَانَ، قَدْ أَدْرَكَ النَّبِيَّ صلى الله عليه وسلم وَذَهَبَتْ بِهِ أُمُّهُ زَيْنَبُ ابْنَةُ حُمَيْدٍ إِلَى رَسُولِ اللَّهِ صلى الله عليه وسلم فَقَالَتْ يَا رَسُولَ اللَّهِ بَايِعْهُ‏.‏ فَقَالَ النَّبِيُّ صلى الله عليه وسلم ‏ ‏ هُوَ صَغِيرٌ ‏‏ فَمَسَحَ رَأْسَهُ وَدَعَا لَهُ، وَكَانَ يُضَحِّي بِالشَّاةِ الْوَاحِدَةِ عَنْ جَمِيعِ أَهْلِهِ‏.‏,nan,Sahih-Authentic,صحيح
