Chapter_Number,Chapter_English,Chapter_Arabic,Section_Number,Section_English,Section_Arabic,Hadith_number,English_Hadith,English_Isnad,English_Matn,Arabic_Hadith,Arabic_Isnad,Arabic_Matn,Arabic_Comment,English_Grade,Arabic_Grade
22.0,Forgetfulness in Prayer,كتاب السهو,1.0,What is said regarding the Sahw,مَا جَاءَ فِي السَّهْوِ إِذَا قَامَ مِنْ رَكْعَتَىِ الْفَرِيضَةِ,1224.0,"Narrated `Abdullah bin Buhaina: Allah's Messenger (ﷺ) once led us in a prayer and offered two rak`at and got up (for the third rak`a) withoutsitting (after the second rak`a). The people also got up with him, and when he was about to finish hisprayer, we waited for him to finish the prayer with Taslim but he said Takbir before Taslim andperformed two prostrations while sitting and then finished the prayer with Taslim.",Narrated `Abdullah bin Buhaina:,"Allah's Messenger (ﷺ) once led us in a prayer and offered two rak`at and got up (for the third rak`a) withoutsitting (after the second rak`a). The people also got up with him, and when he was about to finish hisprayer, we waited for him to finish the prayer with Taslim but he said Takbir before Taslim andperformed two prostrations while sitting and then finished the prayer with Taslim.",حَدَّثَنَا عَبْدُ اللَّهِ بْنُ يُوسُفَ، أَخْبَرَنَا مَالِكُ بْنُ أَنَسٍ، عَنِ ابْنِ شِهَابٍ، عَنْ عَبْدِ الرَّحْمَنِ الأَعْرَجِ، عَنْ عَبْدِ اللَّهِ ابْنِ بُحَيْنَةَ ـ رضى الله عنه ـ أَنَّهُ قَالَ صَلَّى لَنَا رَسُولُ اللَّهِ صلى الله عليه وسلم رَكْعَتَيْنِ مِنْ بَعْضِ الصَّلَوَاتِ ثُمَّ قَامَ فَلَمْ يَجْلِسْ، فَقَامَ النَّاسُ مَعَهُ، فَلَمَّا قَضَى صَلاَتَهُ وَنَظَرْنَا تَسْلِيمَهُ كَبَّرَ قَبْلَ التَّسْلِيمِ فَسَجَدَ سَجْدَتَيْنِ وَهُوَ جَالِسٌ ثُمَّ سَلَّمَ‏.‏,حَدَّثَنَا عَبْدُ اللَّهِ بْنُ يُوسُفَ، أَخْبَرَنَا مَالِكُ بْنُ أَنَسٍ، عَنِ ابْنِ شِهَابٍ، عَنْ عَبْدِ الرَّحْمَنِ الأَعْرَجِ، عَنْ عَبْدِ اللَّهِ ابْنِ بُحَيْنَةَ ـ رضى الله عنه ـ أَنَّهُ قَالَ,صَلَّى لَنَا رَسُولُ اللَّهِ صلى الله عليه وسلم رَكْعَتَيْنِ مِنْ بَعْضِ الصَّلَوَاتِ ثُمَّ قَامَ فَلَمْ يَجْلِسْ، فَقَامَ النَّاسُ مَعَهُ، فَلَمَّا قَضَى صَلاَتَهُ وَنَظَرْنَا تَسْلِيمَهُ كَبَّرَ قَبْلَ التَّسْلِيمِ فَسَجَدَ سَجْدَتَيْنِ وَهُوَ جَالِسٌ ثُمَّ سَلَّمَ‏.‏,nan,Sahih-Authentic,صحيح
22.0,Forgetfulness in Prayer,كتاب السهو,1.0,What is said regarding the Sahw,مَا جَاءَ فِي السَّهْوِ إِذَا قَامَ مِنْ رَكْعَتَىِ الْفَرِيضَةِ,1225.0,Narrated `Abdullah bin Buhaina: Allah's Messenger (ﷺ) got up after the second rak`a of the Zuhr prayer without sitting in between (the secondand the third rak`at). When he finished the prayer he performed two prostrations (of Sahu) and thenfinished the prayer with Taslim.,Narrated `Abdullah bin Buhaina:,Allah's Messenger (ﷺ) got up after the second rak`a of the Zuhr prayer without sitting in between (the secondand the third rak`at). When he finished the prayer he performed two prostrations (of Sahu) and thenfinished the prayer with Taslim.,حَدَّثَنَا عَبْدُ اللَّهِ بْنُ يُوسُفَ، أَخْبَرَنَا مَالِكٌ، عَنْ يَحْيَى بْنِ سَعِيدٍ، عَنْ عَبْدِ الرَّحْمَنِ الأَعْرَجِ، عَنْ عَبْدِ اللَّهِ ابْنِ بُحَيْنَةَ ـ رضى الله عنه ـ أَنَّهُ قَالَ إِنَّ رَسُولَ اللَّهِ صلى الله عليه وسلم قَامَ مِنِ اثْنَتَيْنِ مِنَ الظُّهْرِ لَمْ يَجْلِسْ بَيْنَهُمَا، فَلَمَّا قَضَى صَلاَتَهُ سَجَدَ سَجْدَتَيْنِ ثُمَّ سَلَّمَ بَعْدَ ذَلِكَ‏.‏,حَدَّثَنَا عَبْدُ اللَّهِ بْنُ يُوسُفَ، أَخْبَرَنَا مَالِكٌ، عَنْ يَحْيَى بْنِ سَعِيدٍ، عَنْ عَبْدِ الرَّحْمَنِ الأَعْرَجِ، عَنْ عَبْدِ اللَّهِ ابْنِ بُحَيْنَةَ ـ رضى الله عنه ـ أَنَّهُ قَالَ,إِنَّ رَسُولَ اللَّهِ صلى الله عليه وسلم قَامَ مِنِ اثْنَتَيْنِ مِنَ الظُّهْرِ لَمْ يَجْلِسْ بَيْنَهُمَا، فَلَمَّا قَضَى صَلاَتَهُ سَجَدَ سَجْدَتَيْنِ ثُمَّ سَلَّمَ بَعْدَ ذَلِكَ‏.‏,nan,Sahih-Authentic,صحيح
22.0,Forgetfulness in Prayer,كتاب السهو,2.0,If one offers five Rak'a (instead of four),إِذَا صَلَّى خَمْسًا,1226.0,"Narrated' `Abdullah: Once Allah's Messenger (ﷺ) offered five rak`at in the Zuhr prayer, and somebody asked him whether therewas some increase in the prayer. Allah's Messenger (ﷺ) said, ""What is that?"" He said, ""You have offered fiverak`at."" So Allah's Messenger (ﷺ) performed two prostrations of Sahu after Taslim.",Narrated' `Abdullah:,"Once Allah's Messenger (ﷺ) offered five rak`at in the Zuhr prayer, and somebody asked him whether therewas some increase in the prayer. Allah's Messenger (ﷺ) said, ""What is that?"" He said, ""You have offered fiverak`at."" So Allah's Messenger (ﷺ) performed two prostrations of Sahu after Taslim.",حَدَّثَنَا أَبُو الْوَلِيدِ، حَدَّثَنَا شُعْبَةُ، عَنِ الْحَكَمِ، عَنْ إِبْرَاهِيمَ، عَنْ عَلْقَمَةَ، عَنْ عَبْدِ اللَّهِ ـ رضى الله عنه ـ أَنَّ رَسُولَ اللَّهِ صلى الله عليه وسلم صَلَّى الظُّهْرَ خَمْسًا فَقِيلَ لَهُ أَزِيدَ فِي الصَّلاَةِ فَقَالَ ‏ ‏ وَمَا ذَاكَ ‏‏‏.‏ قَالَ صَلَّيْتَ خَمْسًا‏.‏ فَسَجَدَ سَجْدَتَيْنِ بَعْدَ مَا سَلَّمَ‏.‏,حَدَّثَنَا أَبُو الْوَلِيدِ، حَدَّثَنَا شُعْبَةُ، عَنِ الْحَكَمِ، عَنْ إِبْرَاهِيمَ، عَنْ عَلْقَمَةَ، عَنْ عَبْدِ اللَّهِ ـ رضى الله عنه ـ,أَنَّ رَسُولَ اللَّهِ صلى الله عليه وسلم صَلَّى الظُّهْرَ خَمْسًا فَقِيلَ لَهُ أَزِيدَ فِي الصَّلاَةِ فَقَالَ ‏ ‏ وَمَا ذَاكَ ‏‏‏.‏ قَالَ صَلَّيْتَ خَمْسًا‏.‏ فَسَجَدَ سَجْدَتَيْنِ بَعْدَ مَا سَلَّمَ‏.‏,nan,Sahih-Authentic,صحيح
22.0,Forgetfulness in Prayer,كتاب السهو,3.0,If one finishes his Salat wit Taslim after offering two or three Rak'a (by mistake),إِذَا سَلَّمَ فِي رَكْعَتَيْنِ أَوْ ثَلاَثٍ فَسَجَدَ سَجْدَتَيْنِ مِثْلَ سُجُودِ الصَّلاَةِ أَوْ أَطْوَلَ,1227.0,"Narrated Abu Huraira: The Prophet (ﷺ) led us in the `Asr or the Zuhr prayer and finished it with Taslim. Dhul-Yadain said tohim, ""O Allah's Messenger (ﷺ)! Has the prayer been reduced?"" The Prophet (ﷺ) asked his companions in theaffirmative. So Allah's Messenger (ﷺ) I offered two more rak`at and then performed two prostrations (ofSahu). Sa`d said, ""I saw that 'Urwa bin Az-Zubair had offered two rak`at in the Maghrib prayer andfinished it with Taslim. He then talked (and when he was informed about it) he completed the rest ofhis prayer and performed two prostrations, and said, 'The Prophet (ﷺ) prayed like this.' """,Narrated Abu Huraira:,"The Prophet (ﷺ) led us in the `Asr or the Zuhr prayer and finished it with Taslim. Dhul-Yadain said tohim, ""O Allah's Messenger (ﷺ)! Has the prayer been reduced?"" The Prophet (ﷺ) asked his companions in theaffirmative. So Allah's Messenger (ﷺ) I offered two more rak`at and then performed two prostrations (ofSahu). Sa`d said, ""I saw that 'Urwa bin Az-Zubair had offered two rak`at in the Maghrib prayer andfinished it with Taslim. He then talked (and when he was informed about it) he completed the rest ofhis prayer and performed two prostrations, and said, 'The Prophet (ﷺ) prayed like this.' """,حَدَّثَنَا آدَمُ، حَدَّثَنَا شُعْبَةُ، عَنْ سَعْدِ بْنِ إِبْرَاهِيمَ، عَنْ أَبِي سَلَمَةَ، عَنْ أَبِي هُرَيْرَةَ ـ رضى الله عنه ـ قَالَ صَلَّى بِنَا النَّبِيُّ صلى الله عليه وسلم الظُّهْرَ أَوِ الْعَصْرَ فَسَلَّمَ، فَقَالَ لَهُ ذُو الْيَدَيْنِ الصَّلاَةُ يَا رَسُولَ اللَّهَ أَنَقَصَتْ فَقَالَ النَّبِيُّ صلى الله عليه وسلم لأَصْحَابِهِ ‏ ‏ أَحَقٌّ مَا يَقُولُ ‏‏‏.‏ قَالُوا نَعَمْ‏.‏ فَصَلَّى رَكْعَتَيْنِ أُخْرَيَيْنِ ثُمَّ سَجَدَ سَجْدَتَيْنِ‏.‏ قَالَ سَعْدٌ وَرَأَيْتُ عُرْوَةَ بْنَ الزُّبَيْرِ صَلَّى مِنَ الْمَغْرِبِ رَكْعَتَيْنِ فَسَلَّمَ وَتَكَلَّمَ ثُمَّ صَلَّى مَا بَقِيَ وَسَجَدَ سَجْدَتَيْنِ وَقَالَ هَكَذَا فَعَلَ النَّبِيُّ صلى الله عليه وسلم‏.‏,حَدَّثَنَا آدَمُ، حَدَّثَنَا شُعْبَةُ، عَنْ سَعْدِ بْنِ إِبْرَاهِيمَ، عَنْ أَبِي سَلَمَةَ، عَنْ أَبِي هُرَيْرَةَ ـ رضى الله عنه ـ قَالَ,صَلَّى بِنَا النَّبِيُّ صلى الله عليه وسلم الظُّهْرَ أَوِ الْعَصْرَ فَسَلَّمَ، فَقَالَ لَهُ ذُو الْيَدَيْنِ الصَّلاَةُ يَا رَسُولَ اللَّهَ أَنَقَصَتْ فَقَالَ النَّبِيُّ صلى الله عليه وسلم لأَصْحَابِهِ ‏ ‏ أَحَقٌّ مَا يَقُولُ ‏‏‏.‏ قَالُوا نَعَمْ‏.‏ فَصَلَّى رَكْعَتَيْنِ أُخْرَيَيْنِ ثُمَّ سَجَدَ سَجْدَتَيْنِ‏.‏ قَالَ سَعْدٌ وَرَأَيْتُ عُرْوَةَ بْنَ الزُّبَيْرِ صَلَّى مِنَ الْمَغْرِبِ رَكْعَتَيْنِ فَسَلَّمَ وَتَكَلَّمَ ثُمَّ صَلَّى مَا بَقِيَ وَسَجَدَ سَجْدَتَيْنِ وَقَالَ هَكَذَا فَعَلَ النَّبِيُّ صلى الله عليه وسلم‏.‏,nan,Sahih-Authentic,صحيح
22.0,Forgetfulness in Prayer,كتاب السهو,4.0,Whoever did not recite Tashah-dud (At-Tahiyyat) after the two prostrations of Sahw,مَنْ لَمْ يَتَشَهَّدْ فِي سَجْدَتَىِ السَّهْوِ,1228.0,"Narrated Abu Huraira.: Once Allah's Messenger (ﷺ) offered two rak`at and finished his prayer. So Dhul-Yadain asked him, ""Has theprayer been reduced or have you forgotten?"" Allah's Messenger (ﷺ) said, ""Has Dhul-Yadain spoken thetruth?"" The people replied in the affirmative. Then Allah's Messenger (ﷺ) stood up and offered the remainingtwo rak`at and performed Taslim, and then said Takbir and performed two prostrations like his usualprostrations, or a bit longer, and then got up.",Narrated Abu Huraira.:,"Once Allah's Messenger (ﷺ) offered two rak`at and finished his prayer. So Dhul-Yadain asked him, ""Has theprayer been reduced or have you forgotten?"" Allah's Messenger (ﷺ) said, ""Has Dhul-Yadain spoken thetruth?"" The people replied in the affirmative. Then Allah's Messenger (ﷺ) stood up and offered the remainingtwo rak`at and performed Taslim, and then said Takbir and performed two prostrations like his usualprostrations, or a bit longer, and then got up.",حَدَّثَنَا عَبْدُ اللَّهِ بْنُ يُوسُفَ، أَخْبَرَنَا مَالِكُ بْنُ أَنَسٍ، عَنْ أَيُّوبَ بْنِ أَبِي تَمِيمَةَ السَّخْتِيَانِيِّ، عَنْ مُحَمَّدِ بْنِ سِيرِينَ، عَنْ أَبِي هُرَيْرَةَ ـ رضى الله عنه ـ‏.‏ أَنَّ رَسُولَ اللَّهِ صلى الله عليه وسلم انْصَرَفَ مِنِ اثْنَتَيْنِ فَقَالَ لَهُ ذُو الْيَدَيْنِ أَقُصِرَتِ الصَّلاَةُ أَمْ نَسِيتَ يَا رَسُولَ اللَّهِ فَقَالَ رَسُولُ اللَّهِ صلى الله عليه وسلم ‏ ‏ أَصَدَقَ ذُو الْيَدَيْنِ ‏‏‏.‏ فَقَالَ النَّاسُ نَعَمْ‏.‏ فَقَامَ رَسُولُ اللَّهِ صلى الله عليه وسلم فَصَلَّى اثْنَتَيْنِ أُخْرَيَيْنِ ثُمَّ سَلَّمَ ثُمَّ كَبَّرَ فَسَجَدَ مِثْلَ سُجُودِهِ أَوْ أَطْوَلَ ثُمَّ رَفَعَ‏.‏,حَدَّثَنَا عَبْدُ اللَّهِ بْنُ يُوسُفَ، أَخْبَرَنَا مَالِكُ بْنُ أَنَسٍ، عَنْ أَيُّوبَ بْنِ أَبِي تَمِيمَةَ السَّخْتِيَانِيِّ، عَنْ مُحَمَّدِ بْنِ سِيرِينَ، عَنْ أَبِي هُرَيْرَةَ ـ رضى الله عنه ـ‏.‏,أَنَّ رَسُولَ اللَّهِ صلى الله عليه وسلم انْصَرَفَ مِنِ اثْنَتَيْنِ فَقَالَ لَهُ ذُو الْيَدَيْنِ أَقُصِرَتِ الصَّلاَةُ أَمْ نَسِيتَ يَا رَسُولَ اللَّهِ فَقَالَ رَسُولُ اللَّهِ صلى الله عليه وسلم ‏ ‏ أَصَدَقَ ذُو الْيَدَيْنِ ‏‏‏.‏ فَقَالَ النَّاسُ نَعَمْ‏.‏ فَقَامَ رَسُولُ اللَّهِ صلى الله عليه وسلم فَصَلَّى اثْنَتَيْنِ أُخْرَيَيْنِ ثُمَّ سَلَّمَ ثُمَّ كَبَّرَ فَسَجَدَ مِثْلَ سُجُودِهِ أَوْ أَطْوَلَ ثُمَّ رَفَعَ‏.‏,nan,Sahih-Authentic,صحيح
22.0,Forgetfulness in Prayer,كتاب السهو,4.0,Whoever did not recite Tashah-dud (At-Tahiyyat) after the two prostrations of Sahw,مَنْ لَمْ يَتَشَهَّدْ فِي سَجْدَتَىِ السَّهْوِ,1228.0,"Narrated Salama bin 'Alqama: I asked Muhammad (bin Seereen) whether Tashah-hud should be recited after the two prostrations ofSahu. He replied, ""It is not (mentioned) in Abu Huraira's narration . """,Narrated Salama bin 'Alqama:,"I asked Muhammad (bin Seereen) whether Tashah-hud should be recited after the two prostrations ofSahu. He replied, ""It is not (mentioned) in Abu Huraira's narration . """,حَدَّثَنَا سُلَيْمَانُ بْنُ حَرْبٍ، حَدَّثَنَا حَمَّادٌ، عَنْ سَلَمَةَ بْنِ عَلْقَمَةَ، قَالَ قُلْتُ لِمُحَمَّدٍ فِي سَجْدَتَىِ السَّهْوِ تَشَهُّدٌ قَالَ لَيْسَ فِي حَدِيثِ أَبِي هُرَيْرَةَ‏.‏,حَدَّثَنَا سُلَيْمَانُ بْنُ حَرْبٍ، حَدَّثَنَا حَمَّادٌ، عَنْ سَلَمَةَ بْنِ عَلْقَمَةَ، قَالَ,قُلْتُ لِمُحَمَّدٍ فِي سَجْدَتَىِ السَّهْوِ تَشَهُّدٌ قَالَ لَيْسَ فِي حَدِيثِ أَبِي هُرَيْرَةَ‏.‏,nan,Sahih-Authentic,صحيح
22.0,Forgetfulness in Prayer,كتاب السهو,5.0,To say Takbir in the prostrations of Sahw,مَنْ يُكَبِّرُ فِي سَجْدَتَىِ السَّهْوِ,1229.0,"Narrated Abu Huraira: The Prophet (ﷺ) offered one of the evening prayers (the sub-narrator Muhammad said, ""I think that it wasmost probably the `Asr prayer"") and he finished it after offering two rak`at only. He then stood near aprice of wood in front of the Mosque and put his hand over it. Abu Bakr and `Umar were amongstthose who were present, but they dared not talk to him about that (because of excessive respect forhim), and those who were in a hurry went out. They said, ""Has the prayer been reduced?"" A man whowas called Dhul-Yadain by the Prophet (ﷺ) said (to the Prophet), ""Has the prayer been reduced or haveyou forgotten?"" He said, ""Neither have I forgotten, nor has the prayer been reduced."" He said,""Certainly you have forgotten."" So the Prophet (ﷺ) offered two more rak`at and performed Taslim andthen said Takbir and performed a prostration of Sahu like his ordinary prostration or a bit longer andthen raised his head and said Takbir and then put his head down and performed a prostration like hisordinary prostration or a bit longer, and then raised his head and said Takbir.",Narrated Abu Huraira:,"The Prophet (ﷺ) offered one of the evening prayers (the sub-narrator Muhammad said, ""I think that it wasmost probably the `Asr prayer"") and he finished it after offering two rak`at only. He then stood near aprice of wood in front of the Mosque and put his hand over it. Abu Bakr and `Umar were amongstthose who were present, but they dared not talk to him about that (because of excessive respect forhim), and those who were in a hurry went out. They said, ""Has the prayer been reduced?"" A man whowas called Dhul-Yadain by the Prophet (ﷺ) said (to the Prophet), ""Has the prayer been reduced or haveyou forgotten?"" He said, ""Neither have I forgotten, nor has the prayer been reduced."" He said,""Certainly you have forgotten."" So the Prophet (ﷺ) offered two more rak`at and performed Taslim andthen said Takbir and performed a prostration of Sahu like his ordinary prostration or a bit longer andthen raised his head and said Takbir and then put his head down and performed a prostration like hisordinary prostration or a bit longer, and then raised his head and said Takbir.",حَدَّثَنَا حَفْصُ بْنُ عُمَرَ، حَدَّثَنَا يَزِيدُ بْنُ إِبْرَاهِيمَ، عَنْ مُحَمَّدٍ، عَنْ أَبِي هُرَيْرَةَ ـ رضى الله عنه ـ قَالَ صَلَّى النَّبِيُّ صلى الله عليه وسلم إِحْدَى صَلاَتَىِ الْعَشِيِّ ـ قَالَ مُحَمَّدٌ وَأَكْثَرُ ظَنِّي الْعَصْرَ ـ رَكْعَتَيْنِ ثُمَّ سَلَّمَ ثُمَّ قَامَ إِلَى خَشَبَةٍ فِي مُقَدَّمِ الْمَسْجِدِ فَوَضَعَ يَدَهُ عَلَيْهَا وَفِيهِمْ أَبُو بَكْرٍ وَعُمَرُ ـ رضى الله عنهما ـ فَهَابَا أَنْ يُكَلِّمَاهُ وَخَرَجَ سَرَعَانُ النَّاسِ فَقَالُوا أَقَصُرَتِ الصَّلاَةُ وَرَجُلٌ يَدْعُوهُ النَّبِيُّ صلى الله عليه وسلم ذُو الْيَدَيْنِ فَقَالَ أَنَسِيتَ أَمْ قَصُرَتْ فَقَالَ ‏ ‏ لَمْ أَنْسَ وَلَمْ تُقْصَرْ ‏‏‏.‏ قَالَ بَلَى قَدْ نَسِيتَ‏.‏ فَصَلَّى رَكْعَتَيْنِ ثُمَّ سَلَّمَ ثُمَّ كَبَّرَ فَسَجَدَ مِثْلَ سُجُودِهِ أَوْ أَطْوَلَ، ثُمَّ رَفَعَ رَأْسَهُ فَكَبَّرَ، ثُمَّ وَضَعَ رَأْسَهُ فَكَبَّرَ فَسَجَدَ مِثْلَ سُجُودِهِ أَوْ أَطْوَلَ، ثُمَّ رَفَعَ رَأْسَهُ وَكَبَّرَ‏.‏,حَدَّثَنَا حَفْصُ بْنُ عُمَرَ، حَدَّثَنَا يَزِيدُ بْنُ إِبْرَاهِيمَ، عَنْ مُحَمَّدٍ، عَنْ أَبِي هُرَيْرَةَ ـ رضى الله عنه ـ قَالَ,صَلَّى النَّبِيُّ صلى الله عليه وسلم إِحْدَى صَلاَتَىِ الْعَشِيِّ ـ قَالَ مُحَمَّدٌ وَأَكْثَرُ ظَنِّي الْعَصْرَ ـ رَكْعَتَيْنِ ثُمَّ سَلَّمَ ثُمَّ قَامَ إِلَى خَشَبَةٍ فِي مُقَدَّمِ الْمَسْجِدِ فَوَضَعَ يَدَهُ عَلَيْهَا وَفِيهِمْ أَبُو بَكْرٍ وَعُمَرُ ـ رضى الله عنهما ـ فَهَابَا أَنْ يُكَلِّمَاهُ وَخَرَجَ سَرَعَانُ النَّاسِ فَقَالُوا أَقَصُرَتِ الصَّلاَةُ وَرَجُلٌ يَدْعُوهُ النَّبِيُّ صلى الله عليه وسلم ذُو الْيَدَيْنِ فَقَالَ أَنَسِيتَ أَمْ قَصُرَتْ فَقَالَ ‏ ‏ لَمْ أَنْسَ وَلَمْ تُقْصَرْ ‏‏‏.‏ قَالَ بَلَى قَدْ نَسِيتَ‏.‏ فَصَلَّى رَكْعَتَيْنِ ثُمَّ سَلَّمَ ثُمَّ كَبَّرَ فَسَجَدَ مِثْلَ سُجُودِهِ أَوْ أَطْوَلَ، ثُمَّ رَفَعَ رَأْسَهُ فَكَبَّرَ، ثُمَّ وَضَعَ رَأْسَهُ فَكَبَّرَ فَسَجَدَ مِثْلَ سُجُودِهِ أَوْ أَطْوَلَ، ثُمَّ رَفَعَ رَأْسَهُ وَكَبَّرَ‏.‏,nan,Sahih-Authentic,صحيح
22.0,Forgetfulness in Prayer,كتاب السهو,5.0,To say Takbir in the prostrations of Sahw,مَنْ يُكَبِّرُ فِي سَجْدَتَىِ السَّهْوِ,1230.0,"Narrated `Abdullah bin Buhaina Al-Asdi: (the ally of Bani `Abdul Muttalib) Allah's Messenger (ﷺ) stood up for the Zuhr prayer and he should have sat(after the second rak`a but he stood up for the third rak`a without sitting for Tashah-hud) and when hefinished the prayer he performed two prostrations and said Takbir on each prostration while sitting,before ending (the prayer) with Taslim; and the people too performed the two prostrations with himinstead of the sitting he forgot.",Narrated `Abdullah bin Buhaina Al-Asdi:,"(the ally of Bani `Abdul Muttalib) Allah's Messenger (ﷺ) stood up for the Zuhr prayer and he should have sat(after the second rak`a but he stood up for the third rak`a without sitting for Tashah-hud) and when hefinished the prayer he performed two prostrations and said Takbir on each prostration while sitting,before ending (the prayer) with Taslim; and the people too performed the two prostrations with himinstead of the sitting he forgot.",حَدَّثَنَا قُتَيْبَةُ بْنُ سَعِيدٍ، حَدَّثَنَا لَيْثٌ، عَنِ ابْنِ شِهَابٍ، عَنِ الأَعْرَجِ، عَنْ عَبْدِ اللَّهِ ابْنِ بُحَيْنَةَ الأَسْدِيِّ، حَلِيفِ بَنِي عَبْدِ الْمُطَّلِبِ أَنَّ رَسُولَ اللَّهِ صلى الله عليه وسلم قَامَ فِي صَلاَةِ الظُّهْرِ وَعَلَيْهِ جُلُوسٌ، فَلَمَّا أَتَمَّ صَلاَتَهُ سَجَدَ سَجْدَتَيْنِ فَكَبَّرَ فِي كُلِّ سَجْدَةٍ وَهُوَ جَالِسٌ قَبْلَ أَنْ يُسَلِّمَ، وَسَجَدَهُمَا النَّاسُ مَعَهُ مَكَانَ مَا نَسِيَ مِنَ الْجُلُوسِ‏.‏,حَدَّثَنَا قُتَيْبَةُ بْنُ سَعِيدٍ، حَدَّثَنَا لَيْثٌ، عَنِ ابْنِ شِهَابٍ، عَنِ الأَعْرَجِ، عَنْ عَبْدِ اللَّهِ ابْنِ بُحَيْنَةَ الأَسْدِيِّ، حَلِيفِ بَنِي عَبْدِ الْمُطَّلِبِ,أَنَّ رَسُولَ اللَّهِ صلى الله عليه وسلم قَامَ فِي صَلاَةِ الظُّهْرِ وَعَلَيْهِ جُلُوسٌ، فَلَمَّا أَتَمَّ صَلاَتَهُ سَجَدَ سَجْدَتَيْنِ فَكَبَّرَ فِي كُلِّ سَجْدَةٍ وَهُوَ جَالِسٌ قَبْلَ أَنْ يُسَلِّمَ، وَسَجَدَهُمَا النَّاسُ مَعَهُ مَكَانَ مَا نَسِيَ مِنَ الْجُلُوسِ‏.‏, تَابَعَهُ ابْنُ جُرَيْجٍ عَنِ ابْنِ شِهَابٍ فِي التَّكْبِيرِ‏.‏,Sahih-Authentic,صحيح
