Chapter_Number,Chapter_English,Chapter_Arabic,Section_Number,Section_English,Section_Arabic,Hadith_number,English_Hadith,English_Isnad,English_Matn,Arabic_Hadith,Arabic_Isnad,Arabic_Matn,Arabic_Comment,English_Grade,Arabic_Grade
93.0,Judgments (Ahkaam),كتاب الأحكام,14.0,A judge can give judgements for the people according to his knowledge,مَنْ رَأَى لِلْقَاضِي أَنْ يَحْكُمَ بِعِلْمِهِ فِي أَمْرِ النَّاسِ إِذَا لَمْ يَخَفِ الظُّنُونَ وَالتُّهَمَةَ,7161,"Narrated `Aisha: Hind bint `Utba bin Rabi`a came and said. ""O Allah's Messenger (ﷺ)! By Allah, there was no family on thesurface of the earth, I like to see in degradation more than I did your family, but today there is nofamily on the surface of the earth whom I like to see honored more than yours."" Hind added, ""AbuSufyan is a miser. Is it sinful of me to feed our children from his property?"" The Prophet (ﷺ) said, ""Thereis no blame on you if you feed them (thereof) in a just and reasonable manner.",Narrated `Aisha:,"Hind bint `Utba bin Rabi`a came and said. ""O Allah's Messenger (ﷺ)! By Allah, there was no family on thesurface of the earth, I like to see in degradation more than I did your family, but today there is nofamily on the surface of the earth whom I like to see honored more than yours."" Hind added, ""AbuSufyan is a miser. Is it sinful of me to feed our children from his property?"" The Prophet (ﷺ) said, ""Thereis no blame on you if you feed them (thereof) in a just and reasonable manner.",حَدَّثَنَا أَبُو الْيَمَانِ، أَخْبَرَنَا شُعَيْبٌ، عَنِ الزُّهْرِيِّ، حَدَّثَنِي عُرْوَةُ، أَنَّ عَائِشَةَ ـ رضى الله عنها ـ قَالَتْ جَاءَتْ هِنْدٌ بِنْتُ عُتْبَةَ بْنِ رَبِيعَةَ فَقَالَتْ يَا رَسُولَ اللَّهِ، وَاللَّهِ مَا كَانَ عَلَى ظَهْرِ الأَرْضِ أَهْلُ خِبَاءٍ أَحَبَّ إِلَىَّ أَنْ يَذِلُّوا مِنْ أَهْلِ خِبَائِكَ، وَمَا أَصْبَحَ الْيَوْمَ عَلَى ظَهْرِ الأَرْضِ أَهْلُ خِبَاءٍ أَحَبَّ إِلَىَّ أَنْ يَعِزُّوا مِنْ أَهْلِ خِبَائِكَ‏.‏ ثُمَّ قَالَتْ إِنَّ أَبَا سُفْيَانَ رَجُلٌ مِسِّيكٌ، فَهَلْ عَلَىَّ مِنْ حَرَجٍ أَنْ أُطْعِمَ الَّذِي لَهُ عِيَالَنَا قَالَ لَهَا ‏ ‏ لاَ حَرَجَ عَلَيْكِ أَنْ تُطْعِمِيهِمْ مِنْ مَعْرُوفٍ ‏‏‏.‏,حَدَّثَنَا أَبُو الْيَمَانِ، أَخْبَرَنَا شُعَيْبٌ، عَنِ الزُّهْرِيِّ، حَدَّثَنِي عُرْوَةُ، أَنَّ عَائِشَةَ ـ رضى الله عنها ـ قَالَتْ,جَاءَتْ هِنْدٌ بِنْتُ عُتْبَةَ بْنِ رَبِيعَةَ فَقَالَتْ يَا رَسُولَ اللَّهِ، وَاللَّهِ مَا كَانَ عَلَى ظَهْرِ الأَرْضِ أَهْلُ خِبَاءٍ أَحَبَّ إِلَىَّ أَنْ يَذِلُّوا مِنْ أَهْلِ خِبَائِكَ، وَمَا أَصْبَحَ الْيَوْمَ عَلَى ظَهْرِ الأَرْضِ أَهْلُ خِبَاءٍ أَحَبَّ إِلَىَّ أَنْ يَعِزُّوا مِنْ أَهْلِ خِبَائِكَ‏.‏ ثُمَّ قَالَتْ إِنَّ أَبَا سُفْيَانَ رَجُلٌ مِسِّيكٌ، فَهَلْ عَلَىَّ مِنْ حَرَجٍ أَنْ أُطْعِمَ الَّذِي لَهُ عِيَالَنَا قَالَ لَهَا ‏ ‏ لاَ حَرَجَ عَلَيْكِ أَنْ تُطْعِمِيهِمْ مِنْ مَعْرُوفٍ ‏‏‏.‏,nan,Sahih-Authentic,صحيح
93.0,Judgments (Ahkaam),كتاب الأحكام,15.0," To bear witness as to the writer of a stamped letter; and the letter of a ruler to a governor, and of a judge to a judge",الشَّهَادَةِ عَلَى الْخَطِّ الْمَخْتُومِ,7162,"Narrated Anas bin Malik: When the Prophet (ﷺ) intended to write to the Byzantines, the people said, ""They do not read a letterunless it is sealed (stamped)."" Therefore the Prophet (ﷺ) took a silver ring----as if I am looking at itsglitter now----and its engraving was: 'Muhammad, Apostle of Allah'.",Narrated Anas bin Malik:,"When the Prophet (ﷺ) intended to write to the Byzantines, the people said, ""They do not read a letterunless it is sealed (stamped)."" Therefore the Prophet (ﷺ) took a silver ring----as if I am looking at itsglitter now----and its engraving was: 'Muhammad, Apostle of Allah'.",حَدَّثَنِي مُحَمَّدُ بْنُ بَشَّارٍ، حَدَّثَنَا غُنْدَرٌ، حَدَّثَنَا شُعْبَةُ، قَالَ سَمِعْتُ قَتَادَةَ، عَنْ أَنَسِ بْنِ مَالِكٍ، قَالَ لَمَّا أَرَادَ النَّبِيُّ صلى الله عليه وسلم أَنْ يَكْتُبَ إِلَى الرُّومِ قَالُوا إِنَّهُمْ لاَ يَقْرَءُونَ كِتَابًا إِلاَّ مَخْتُومًا‏.‏ فَاتَّخَذَ النَّبِيُّ صلى الله عليه وسلم خَاتَمًا مِنْ فِضَّةٍ، كَأَنِّي أَنْظُرُ إِلَى وَبِيصِهِ، وَنَقْشُهُ مُحَمَّدٌ رَسُولُ اللَّهِ‏.‏,حَدَّثَنِي مُحَمَّدُ بْنُ بَشَّارٍ، حَدَّثَنَا غُنْدَرٌ، حَدَّثَنَا شُعْبَةُ، قَالَ سَمِعْتُ قَتَادَةَ، عَنْ أَنَسِ بْنِ مَالِكٍ، قَالَ,لَمَّا أَرَادَ النَّبِيُّ صلى الله عليه وسلم أَنْ يَكْتُبَ إِلَى الرُّومِ قَالُوا إِنَّهُمْ لاَ يَقْرَءُونَ كِتَابًا إِلاَّ مَخْتُومًا‏.‏ فَاتَّخَذَ النَّبِيُّ صلى الله عليه وسلم خَاتَمًا مِنْ فِضَّةٍ، كَأَنِّي أَنْظُرُ إِلَى وَبِيصِهِ، وَنَقْشُهُ مُحَمَّدٌ رَسُولُ اللَّهِ‏.‏,nan,Sahih-Authentic,صحيح
93.0,Judgments (Ahkaam),كتاب الأحكام,17.0,The salaries of rulers and those employed to administer the funds,رِزْقِ الْحُكَّامِ وَالْعَامِلِينِ عَلَيْهَا,7163,"Narrated 'Abdullah bin As-Sa'di: That when he went to 'Umar during his Caliphate. 'Umar said to him,""Haven't I been told that you do certain jobs for the people but whenyou are given payment you refuse to take it?"" 'Abdullah added: I said,""Yes."" 'Umar said, ""Why do you do so?"" I said, ""I have horses andslaves and I am living in prosperity and I wish that my payment shouldbe kept as a charitable gift for the Muslims."" 'Umar said, ""Do not doso, for I intended to do the same as you do. Allah's Messenger (ﷺ)s used togive me gifts and I used to say to him, 'Give it to a more needy onethan me.' Once he gave me some money and I said, 'Give it to a moreneedy person than me,' whereupon the Prophet (ﷺ) said, 'Take it and keepit in your possession and then give it in charity. Take what evercomes to you of this money if you are not keen to have it and notasking for it; otherwise (i.e., if it does not come to you) do notseek to have it yourself.' """,Narrated 'Abdullah bin As-Sa'di:,"That when he went to 'Umar during his Caliphate. 'Umar said to him,""Haven't I been told that you do certain jobs for the people but whenyou are given payment you refuse to take it?"" 'Abdullah added: I said,""Yes."" 'Umar said, ""Why do you do so?"" I said, ""I have horses andslaves and I am living in prosperity and I wish that my payment shouldbe kept as a charitable gift for the Muslims."" 'Umar said, ""Do not doso, for I intended to do the same as you do. Allah's Messenger (ﷺ)s used togive me gifts and I used to say to him, 'Give it to a more needy onethan me.' Once he gave me some money and I said, 'Give it to a moreneedy person than me,' whereupon the Prophet (ﷺ) said, 'Take it and keepit in your possession and then give it in charity. Take what evercomes to you of this money if you are not keen to have it and notasking for it; otherwise (i.e., if it does not come to you) do notseek to have it yourself.' """,حَدَّثَنَا أَبُو الْيَمَانِ، أَخْبَرَنَا شُعَيْبٌ، عَنِ الزُّهْرِيِّ، أَخْبَرَنِي السَّائِبُ بْنُ يَزِيدَ ابْنُ أُخْتِ، نَمِرٍ أَنَّ حُوَيْطِبَ بْنَ عَبْدِ الْعُزَّى، أَخْبَرَهُ أَنَّ عَبْدَ اللَّهِ بْنَ السَّعْدِيِّ أَخْبَرَهُ أَنَّهُ، قَدِمَ عَلَى عُمَرَ فِي خِلاَفَتِهِ فَقَالَ لَهُ عُمَرُ أَلَمْ أُحَدَّثْ أَنَّكَ تَلِي مِنْ أَعْمَالِ النَّاسِ أَعْمَالاً، فَإِذَا أُعْطِيتَ الْعُمَالَةَ كَرِهْتَهَا‏.‏ فَقُلْتُ بَلَى‏.‏ فَقَالَ عُمَرُ مَا تُرِيدُ إِلَى ذَلِكَ قُلْتُ إِنَّ لِي أَفْرَاسًا وَأَعْبُدًا، وَأَنَا بِخَيْرٍ، وَأَرِيدُ أَنْ تَكُونَ عُمَالَتِي صَدَقَةً عَلَى الْمُسْلِمِينَ‏.‏ قَالَ عُمَرُ لاَ تَفْعَلْ فَإِنِّي كُنْتُ أَرَدْتُ الَّذِي أَرَدْتَ فَكَانَ رَسُولُ اللَّهِ صلى الله عليه وسلم يُعْطِينِي الْعَطَاءَ فَأَقُولُ أَعْطِهِ أَفْقَرَ إِلَيْهِ مِنِّي‏.‏ حَتَّى أَعْطَانِي مَرَّةً مَالاً فَقُلْتُ أَعْطِهِ أَفْقَرَ إِلَيْهِ مِنِّي‏.‏ فَقَالَ النَّبِيُّ صلى الله عليه وسلم ‏ ‏ خُذْهُ فَتَمَوَّلْهُ وَتَصَدَّقْ بِهِ، فَمَا جَاءَكَ مِنْ هَذَا الْمَالِ وَأَنْتَ غَيْرُ مُشْرِفٍ وَلاَ سَائِلٍ فَخُذْهُ، وَإِلاَّ فَلاَ تُتْبِعْهُ نَفْسَكَ ‏‏,حَدَّثَنَا أَبُو الْيَمَانِ، أَخْبَرَنَا شُعَيْبٌ، عَنِ الزُّهْرِيِّ، أَخْبَرَنِي السَّائِبُ بْنُ يَزِيدَ ابْنُ أُخْتِ، نَمِرٍ أَنَّ حُوَيْطِبَ بْنَ عَبْدِ الْعُزَّى، أَخْبَرَهُ أَنَّ عَبْدَ اللَّهِ بْنَ السَّعْدِيِّ أَخْبَرَهُ,أَنَّهُ، قَدِمَ عَلَى عُمَرَ فِي خِلاَفَتِهِ فَقَالَ لَهُ عُمَرُ أَلَمْ أُحَدَّثْ أَنَّكَ تَلِي مِنْ أَعْمَالِ النَّاسِ أَعْمَالاً، فَإِذَا أُعْطِيتَ الْعُمَالَةَ كَرِهْتَهَا‏.‏ فَقُلْتُ بَلَى‏.‏ فَقَالَ عُمَرُ مَا تُرِيدُ إِلَى ذَلِكَ قُلْتُ إِنَّ لِي أَفْرَاسًا وَأَعْبُدًا، وَأَنَا بِخَيْرٍ، وَأَرِيدُ أَنْ تَكُونَ عُمَالَتِي صَدَقَةً عَلَى الْمُسْلِمِينَ‏.‏ قَالَ عُمَرُ لاَ تَفْعَلْ فَإِنِّي كُنْتُ أَرَدْتُ الَّذِي أَرَدْتَ فَكَانَ رَسُولُ اللَّهِ صلى الله عليه وسلم يُعْطِينِي الْعَطَاءَ فَأَقُولُ أَعْطِهِ أَفْقَرَ إِلَيْهِ مِنِّي‏.‏ حَتَّى أَعْطَانِي مَرَّةً مَالاً فَقُلْتُ أَعْطِهِ أَفْقَرَ إِلَيْهِ مِنِّي‏.‏ فَقَالَ النَّبِيُّ صلى الله عليه وسلم ‏ ‏ خُذْهُ فَتَمَوَّلْهُ وَتَصَدَّقْ بِهِ، فَمَا جَاءَكَ مِنْ هَذَا الْمَالِ وَأَنْتَ غَيْرُ مُشْرِفٍ وَلاَ سَائِلٍ فَخُذْهُ، وَإِلاَّ فَلاَ تُتْبِعْهُ نَفْسَكَ ‏‏,nan,Sahih-Authentic,صحيح
93.0,Judgments (Ahkaam),كتاب الأحكام,17.0,The salaries of rulers and those employed to administer the funds,رِزْقِ الْحُكَّامِ وَالْعَامِلِينِ عَلَيْهَا,7164,"Narrated 'Abdullah bin 'Umar: I have heard 'Umar saying, ""The Prophet (ﷺ)used to give me some money (grant) and I would say (to him), 'Give itto a more needy one than me.' Once he gave me some money and I said,'Give it to a more needy one than me.' The Prophet (ﷺ) said (to me), 'Takeit and keep it in your possession and then give it in charity. Takewhatever comes to you of this money while you are not keen to have itand not asking for it; take it, but you should not seek to have whatyou are not given. ' """,Narrated 'Abdullah bin 'Umar:,"I have heard 'Umar saying, ""The Prophet (ﷺ)used to give me some money (grant) and I would say (to him), 'Give itto a more needy one than me.' Once he gave me some money and I said,'Give it to a more needy one than me.' The Prophet (ﷺ) said (to me), 'Takeit and keep it in your possession and then give it in charity. Takewhatever comes to you of this money while you are not keen to have itand not asking for it; take it, but you should not seek to have whatyou are not given. ' """,وَعَنِ الزُّهْرِيِّ، قَالَ حَدَّثَنِي سَالِمُ بْنُ عَبْدِ اللَّهِ، أَنْ عَبْدَ اللَّهِ بْنَ عُمَرَ، قَالَ سَمِعْتُ عُمَرَ، يَقُولُ كَانَ النَّبِيُّ صلى الله عليه وسلم يُعْطِينِي الْعَطَاءَ فَأَقُولُ أَعْطِهِ أَفْقَرَ إِلَيْهِ مِنِّي‏.‏ حَتَّى أَعْطَانِي مَرَّةً مَالاً فَقُلْتُ أَعْطِهِ مَنْ هُوَ أَفْقَرُ إِلَيْهِ مِنِّي‏.‏ فَقَالَ النَّبِيُّ صلى الله عليه وسلم ‏ ‏ خُذْهُ فَتَمَوَّلْهُ وَتَصَدَّقْ بِهِ، فَمَا جَاءَكَ مِنْ هَذَا الْمَالِ وَأَنْتَ غَيْرُ مُشْرِفٍ وَلاَ سَائِلٍ فَخُذْهُ، وَمَا لاَ فَلاَ تُتْبِعْهُ نَفْسَكَ ‏‏‏.‏,وَعَنِ الزُّهْرِيِّ، قَالَ حَدَّثَنِي سَالِمُ بْنُ عَبْدِ اللَّهِ، أَنْ عَبْدَ اللَّهِ بْنَ عُمَرَ، قَالَ سَمِعْتُ عُمَرَ، يَقُولُ,كَانَ النَّبِيُّ صلى الله عليه وسلم يُعْطِينِي الْعَطَاءَ فَأَقُولُ أَعْطِهِ أَفْقَرَ إِلَيْهِ مِنِّي‏.‏ حَتَّى أَعْطَانِي مَرَّةً مَالاً فَقُلْتُ أَعْطِهِ مَنْ هُوَ أَفْقَرُ إِلَيْهِ مِنِّي‏.‏ فَقَالَ النَّبِيُّ صلى الله عليه وسلم ‏ ‏ خُذْهُ فَتَمَوَّلْهُ وَتَصَدَّقْ بِهِ، فَمَا جَاءَكَ مِنْ هَذَا الْمَالِ وَأَنْتَ غَيْرُ مُشْرِفٍ وَلاَ سَائِلٍ فَخُذْهُ، وَمَا لاَ فَلاَ تُتْبِعْهُ نَفْسَكَ ‏‏‏.‏,nan,Sahih-Authentic,صحيح
93.0,Judgments (Ahkaam),كتاب الأحكام,18.0,Whoever gave judgements of Li'an in the mosque,مَنْ قَضَى وَلاَعَنَ فِي الْمَسْجِدِ,7165,"Narrated Sahl bin Sa`d: I witnessed a husband and a wife who were involved in a case of Lian. Then (the judgment of) divorcewas passed. I was fifteen years of age, at that time.",Narrated Sahl bin Sa`d:,"I witnessed a husband and a wife who were involved in a case of Lian. Then (the judgment of) divorcewas passed. I was fifteen years of age, at that time.",حَدَّثَنَا عَلِيُّ بْنُ عَبْدِ اللَّهِ، حَدَّثَنَا سُفْيَانُ، قَالَ الزُّهْرِيُّ عَنْ سَهْلِ بْنِ سَعْدٍ، قَالَ شَهِدْتُ الْمُتَلاَعِنَيْنِ وَأَنَا ابْنُ خَمْسَ، عَشْرَةَ فُرِّقَ بَيْنَهُمَا‏.‏,حَدَّثَنَا عَلِيُّ بْنُ عَبْدِ اللَّهِ، حَدَّثَنَا سُفْيَانُ، قَالَ الزُّهْرِيُّ عَنْ سَهْلِ بْنِ سَعْدٍ، قَالَ,شَهِدْتُ الْمُتَلاَعِنَيْنِ وَأَنَا ابْنُ خَمْسَ، عَشْرَةَ فُرِّقَ بَيْنَهُمَا‏.‏,nan,Sahih-Authentic,صحيح
93.0,Judgments (Ahkaam),كتاب الأحكام,18.0,Whoever gave judgements of Li'an in the mosque,مَنْ قَضَى وَلاَعَنَ فِي الْمَسْجِدِ,7166,"Narrated Sahl: (the brother of Bani Sa`ida) A man from the Ansar came to the Prophet (ﷺ) and said, ""If a man findsanother man sleeping with his wife, should he kill him?"" That man and his wife then did Lian in themosque while I was present.",Narrated Sahl:,"(the brother of Bani Sa`ida) A man from the Ansar came to the Prophet (ﷺ) and said, ""If a man findsanother man sleeping with his wife, should he kill him?"" That man and his wife then did Lian in themosque while I was present.",حَدَّثَنَا يَحْيَى، حَدَّثَنَا عَبْدُ الرَّزَّاقِ، أَخْبَرَنَا ابْنُ جُرَيْجٍ، أَخْبَرَنِي ابْنُ شِهَابٍ، عَنْ سَهْلٍ، أَخِي بَنِي سَاعِدَةَ أَنَّ رَجُلاً، مِنَ الأَنْصَارِ جَاءَ إِلَى النَّبِيِّ صلى الله عليه وسلم فَقَالَ أَرَأَيْتَ رَجُلاً وَجَدَ مَعَ امْرَأَتِهِ رَجُلاً، أَيَقْتُلُهُ فَتَلاَعَنَا فِي الْمَسْجِدِ وَأَنَا شَاهِدٌ‏.‏,حَدَّثَنَا يَحْيَى، حَدَّثَنَا عَبْدُ الرَّزَّاقِ، أَخْبَرَنَا ابْنُ جُرَيْجٍ، أَخْبَرَنِي ابْنُ شِهَابٍ، عَنْ سَهْلٍ، أَخِي بَنِي سَاعِدَةَ,أَنَّ رَجُلاً، مِنَ الأَنْصَارِ جَاءَ إِلَى النَّبِيِّ صلى الله عليه وسلم فَقَالَ أَرَأَيْتَ رَجُلاً وَجَدَ مَعَ امْرَأَتِهِ رَجُلاً، أَيَقْتُلُهُ فَتَلاَعَنَا فِي الْمَسْجِدِ وَأَنَا شَاهِدٌ‏.‏,nan,Sahih-Authentic,صحيح
93.0,Judgments (Ahkaam),كتاب الأحكام,19.0,Passing judgement in the mosque and ordering the punishment outside the  Mosque,مَنْ حَكَمَ فِي الْمَسْجِدِ حَتَّى إِذَا أَتَى عَلَى حَدٍّ أَمَرَ أَنْ يُخْرَجَ مِنَ الْمَسْجِدِ فَيُقَامَ,7167,"Narrated Abu Huraira: A man came to Allah's Messenger (ﷺ) while he was in the mosque, and called him, saying, ""O Allah'sApostle! I have committed illegal sexual intercourse."" The Prophet (ﷺ) turned his face to the other side,but when the man gave four witnesses against himself, the Prophet (ﷺ) said to him, ""Are you mad?"" Theman said, ""No."" So the Prophet (ﷺ) said (to his companions), ""Take him away and stone him to death. """,Narrated Abu Huraira:,"A man came to Allah's Messenger (ﷺ) while he was in the mosque, and called him, saying, ""O Allah'sApostle! I have committed illegal sexual intercourse."" The Prophet (ﷺ) turned his face to the other side,but when the man gave four witnesses against himself, the Prophet (ﷺ) said to him, ""Are you mad?"" Theman said, ""No."" So the Prophet (ﷺ) said (to his companions), ""Take him away and stone him to death. ""","حَدَّثَنَا يَحْيَى بْنُ بُكَيْرٍ، حَدَّثَنِي اللَّيْثُ، عَنْ عُقَيْلٍ، عَنِ ابْنِ شِهَابٍ، عَنْ أَبِي سَلَمَةَ، وَسَعِيدِ بْنِ الْمُسَيَّبِ، عَنْ أَبِي هُرَيْرَةَ، قَالَ أَتَى رَجُلٌ رَسُولَ اللَّهِ صلى الله عليه وسلم وَهْوَ فِي الْمَسْجِدِ فَنَادَاهُ فَقَالَ يَا رَسُولَ اللَّهِ إِنِّي زَنَيْتُ‏.‏ فَأَعْرَضَ عَنْهُ‏.‏ فَلَمَّا شَهِدَ عَلَى نَفْسِهِ أَرْبَعًا قَالَ ‏""‏ أَبِكَ جُنُونٌ ‏""‏‏.‏ قَالَ لاَ‏.‏ قَالَ ‏""‏ اذْهَبُوا بِهِ فَارْجُمُوهُ ‏""‏‏.‏",حَدَّثَنَا يَحْيَى بْنُ بُكَيْرٍ، حَدَّثَنِي اللَّيْثُ، عَنْ عُقَيْلٍ، عَنِ ابْنِ شِهَابٍ، عَنْ أَبِي سَلَمَةَ، وَسَعِيدِ بْنِ الْمُسَيَّبِ، عَنْ أَبِي هُرَيْرَةَ، قَالَ,"أَتَى رَجُلٌ رَسُولَ اللَّهِ صلى الله عليه وسلم وَهْوَ فِي الْمَسْجِدِ فَنَادَاهُ فَقَالَ يَا رَسُولَ اللَّهِ إِنِّي زَنَيْتُ‏.‏ فَأَعْرَضَ عَنْهُ‏.‏ فَلَمَّا شَهِدَ عَلَى نَفْسِهِ أَرْبَعًا قَالَ ‏""‏ أَبِكَ جُنُونٌ ‏""‏‏.‏ قَالَ لاَ‏.‏ قَالَ ‏""‏ اذْهَبُوا بِهِ فَارْجُمُوهُ ‏""‏‏.‏",nan,Sahih-Authentic,صحيح
93.0,Judgments (Ahkaam),كتاب الأحكام,19.0,Passing judgement in the mosque and ordering the punishment outside the  Mosque,مَنْ حَكَمَ فِي الْمَسْجِدِ حَتَّى إِذَا أَتَى عَلَى حَدٍّ أَمَرَ أَنْ يُخْرَجَ مِنَ الْمَسْجِدِ فَيُقَامَ,7168,(continued from above) Narrated Jabir bin Abdullah: I was one of those who stoned him at the Musalla in Al-Madina (See Hadith 5272).,(continued from above) Narrated Jabir bin Abdullah:,I was one of those who stoned him at the Musalla in Al-Madina (See Hadith 5272).,قَالَ ابْنُ شِهَابٍ فَأَخْبَرَنِي مَنْ، سَمِعَ جَابِرَ بْنَ عَبْدِ اللَّهِ، قَالَ كُنْتُ فِيمَنْ رَجَمَهُ بِالْمُصَلَّى‏.‏,قَالَ ابْنُ شِهَابٍ فَأَخْبَرَنِي مَنْ، سَمِعَ جَابِرَ بْنَ عَبْدِ اللَّهِ، قَالَ,كُنْتُ فِيمَنْ رَجَمَهُ بِالْمُصَلَّى‏.‏,رَوَاهُ يُونُسُ وَمَعْمَرٌ وَابْنُ جُرَيْجٍ عَنِ الزُّهْرِيِّ عَنْ أَبِي سَلَمَةَ عَنْ جَابِرٍ عَنِ النَّبِيِّ صلى الله عليه وسلم فِي الرَّجْمِ‏.‏,Sahih-Authentic,صحيح
