Chapter_Number,Chapter_English,Chapter_Arabic,Section_Number,Section_English,Section_Arabic,Hadith_number,English_Hadith,English_Isnad,English_Matn,Arabic_Hadith,Arabic_Isnad,Arabic_Matn,Arabic_Comment,English_Grade,Arabic_Grade
1.0,Revelation,كتاب بدء الوحى,1.0,How the Divine Revelation started being revealed to Allah's Messenger,كَيْفَ كَانَ بَدْءُ الْوَحْىِ إِلَى رَسُولِ اللَّهِ صلى الله عليه وسلم,1.0,"Narrated 'Umar bin Al-Khattab: I heard Allah's Messenger (ﷺ) saying, ""The reward of deeds depends upon theintentions and every person will get the reward according to what hehas intended. So whoever emigrated for worldly benefits or for a womanto marry, his emigration was for what he emigrated for.""",Narrated 'Umar bin Al-Khattab:,"I heard Allah's Messenger (ﷺ) saying, ""The reward of deeds depends upon theintentions and every person will get the reward according to what hehas intended. So whoever emigrated for worldly benefits or for a womanto marry, his emigration was for what he emigrated for.""",حَدَّثَنَا الْحُمَيْدِيُّ عَبْدُاللَّهِ بْنُ الزُّبَيْرِ، قَالَ حَدَّثَنَا سُفْيَانُ، قَالَ حَدَّثَنَا يَحْيَى بْنُ سَعِيدٍ الأَنْصَارِيُّ، قَالَ أَخْبَرَنِي مُحَمَّدُ بْنُ إِبْرَاهِيمَ التَّيْمِيُّ، أَنَّهُ سَمِعَ عَلْقَمَةَ بْنَ وَقَّاصٍ اللَّيْثِيَّ، يَقُولُ سَمِعْتُ عُمَرَ بْنَ الْخَطَّابِ ـ رضى الله عنه ـ عَلَى الْمِنْبَرِ قَالَ سَمِعْتُ رَسُولَ اللَّهِ صلى الله عليه وسلم يَقُولُ ‏ ‏ إِنَّمَا الأَعْمَالُ بِالنِّيَّاتِ، وَإِنَّمَا لِكُلِّ امْرِئٍ مَا نَوَى، فَمَنْ كَانَتْ هِجْرَتُهُ إِلَى دُنْيَا يُصِيبُهَا أَوْ إِلَى امْرَأَةٍ يَنْكِحُهَا فَهِجْرَتُهُ إِلَى مَا هَاجَرَ إِلَيْهِ ‏,حَدَّثَنَا الْحُمَيْدِيُّ عَبْدُاللَّهِ بْنُ الزُّبَيْرِ، قَالَ حَدَّثَنَا سُفْيَانُ، قَالَ حَدَّثَنَا يَحْيَى بْنُ سَعِيدٍ الأَنْصَارِيُّ، قَالَ أَخْبَرَنِي مُحَمَّدُ بْنُ إِبْرَاهِيمَ التَّيْمِيُّ، أَنَّهُ سَمِعَ عَلْقَمَةَ بْنَ وَقَّاصٍ اللَّيْثِيَّ، يَقُولُ سَمِعْتُ عُمَرَ بْنَ الْخَطَّابِ ـ رضى الله عنه ـ عَلَى الْمِنْبَرِ قَالَ,سَمِعْتُ رَسُولَ اللَّهِ صلى الله عليه وسلم يَقُولُ ‏ ‏ إِنَّمَا الأَعْمَالُ بِالنِّيَّاتِ، وَإِنَّمَا لِكُلِّ امْرِئٍ مَا نَوَى، فَمَنْ كَانَتْ هِجْرَتُهُ إِلَى دُنْيَا يُصِيبُهَا أَوْ إِلَى امْرَأَةٍ يَنْكِحُهَا فَهِجْرَتُهُ إِلَى مَا هَاجَرَ إِلَيْهِ ‏,nan,Sahih-Authentic,صحيح
1.0,Revelation,كتاب بدء الوحى,2.0,nan,nan,2.0,"Narrated 'Aisha: (the mother of the faithful believers) Al-Harith bin Hisham asked Allah's Messenger (ﷺ) ""O Allah's Messenger (ﷺ)! How is the Divine Inspiration revealed to you?"" Allah's Messenger (ﷺ) replied, ""Sometimes it is (revealed) like the ringing of a bell, this form of Inspiration is the hardest of all and then this state passes off after I have grasped what is inspired. Sometimes the Angel comes in the form of a man and talks to me and I grasp whatever he says."" 'Aisha added: Verily I saw the Prophet (ﷺ) being inspired divinely on a very cold day and noticed the sweat dropping from his forehead (as the Inspiration was over).",Narrated 'Aisha:,"(the mother of the faithful believers) Al-Harith bin Hisham asked Allah's Messenger (ﷺ) ""O Allah's Messenger (ﷺ)! How is the Divine Inspiration revealed to you?"" Allah's Messenger (ﷺ) replied, ""Sometimes it is (revealed) like the ringing of a bell, this form of Inspiration is the hardest of all and then this state passes off after I have grasped what is inspired. Sometimes the Angel comes in the form of a man and talks to me and I grasp whatever he says."" 'Aisha added: Verily I saw the Prophet (ﷺ) being inspired divinely on a very cold day and noticed the sweat dropping from his forehead (as the Inspiration was over).",حَدَّثَنَا عَبْدُ اللَّهِ بْنُ يُوسُفَ، قَالَ أَخْبَرَنَا مَالِكٌ، عَنْ هِشَامِ بْنِ عُرْوَةَ، عَنْ أَبِيهِ، عَنْ عَائِشَةَ أُمِّ الْمُؤْمِنِينَ ـ رضى الله عنها ـ أَنَّ الْحَارِثَ بْنَ هِشَامٍ ـ رضى الله عنه ـ سَأَلَ رَسُولَ اللَّهِ صلى الله عليه وسلم فَقَالَ يَا رَسُولَ اللَّهِ كَيْفَ يَأْتِيكَ الْوَحْىُ فَقَالَ رَسُولُ اللَّهِ صلى الله عليه وسلم ‏ ‏ أَحْيَانًا يَأْتِينِي مِثْلَ صَلْصَلَةِ الْجَرَسِ ـ وَهُوَ أَشَدُّهُ عَلَىَّ ـ فَيُفْصَمُ عَنِّي وَقَدْ وَعَيْتُ عَنْهُ مَا قَالَ، وَأَحْيَانًا يَتَمَثَّلُ لِيَ الْمَلَكُ رَجُلاً فَيُكَلِّمُنِي فَأَعِي مَا يَقُولُ ‏,حَدَّثَنَا عَبْدُ اللَّهِ بْنُ يُوسُفَ، قَالَ أَخْبَرَنَا مَالِكٌ، عَنْ هِشَامِ بْنِ عُرْوَةَ، عَنْ أَبِيهِ، عَنْ عَائِشَةَ أُمِّ الْمُؤْمِنِينَ ـ رضى الله عنها ـ,أَنَّ الْحَارِثَ بْنَ هِشَامٍ ـ رضى الله عنه ـ سَأَلَ رَسُولَ اللَّهِ صلى الله عليه وسلم فَقَالَ يَا رَسُولَ اللَّهِ كَيْفَ يَأْتِيكَ الْوَحْىُ فَقَالَ رَسُولُ اللَّهِ صلى الله عليه وسلم ‏ ‏ أَحْيَانًا يَأْتِينِي مِثْلَ صَلْصَلَةِ الْجَرَسِ ـ وَهُوَ أَشَدُّهُ عَلَىَّ ـ فَيُفْصَمُ عَنِّي وَقَدْ وَعَيْتُ عَنْهُ مَا قَالَ، وَأَحْيَانًا يَتَمَثَّلُ لِيَ الْمَلَكُ رَجُلاً فَيُكَلِّمُنِي فَأَعِي مَا يَقُولُ ‏,nan,Sahih-Authentic,صحيح
1.0,Revelation,كتاب بدء الوحى,3.0,nan,nan,3.0,"Narrated 'Aisha: (the mother of the faithful believers) The commencement of the Divine Inspiration to Allah's Messenger (ﷺ) was in the form of good dreams which came true like bright daylight, and then the love of seclusion was bestowed upon him. He used to go in seclusion in the cave of Hira where he used to worship (Allah alone) continuously for many days before his desire to see his family. He used to take with him the journey food for the stay and then come back to (his wife) Khadija to take his food likewise again till suddenly the Truth descended upon him while he was in the cave of Hira. The angel came to him and asked him to read. The Prophet (ﷺ) replied, ""I do not know how to read."" The Prophet (ﷺ) added, ""The angel caught me (forcefully) and pressed me so hard that I could not bear it any more. He then released me and again asked me to read and I replied, 'I do not know how to read.' Thereupon he caught me again and pressed me a second time till I could not bear it any more. He then released me and again asked me to read but again I replied, 'I do not know how to read (or what shall I read)?' Thereupon he caught me for the third time and pressed me, and then released me and said, 'Read in the name of your Lord, who has created (all that exists), created man from a clot. Read! And your Lord is the Most Generous."" (96.1, 96.2, 96.3) Then Allah's Messenger (ﷺ) returned with the Inspiration and with his heart beating severely. Then he went to Khadija bint Khuwailid and said, ""Cover me! Cover me!"" They covered him till his fear was over and after that he told her everything that had happened and said, ""I fear that something may happen to me."" Khadija replied, ""Never! By Allah, Allah will never disgrace you. You keep good relations with your kith and kin, help the poor and the destitute, serve your guests generously and assist the deserving calamity-afflicted ones.""Khadija then accompanied him to her cousin Waraqa bin Naufal bin Asad bin 'Abdul 'Uzza, who, during the pre-Islamic Period became a Christian and used to write the writing with Hebrew letters. He would write from the Gospel in Hebrew as much as Allah wished him to write. He was an old man and had lost his eyesight. Khadija said to Waraqa, ""Listen to the story of your nephew, O my cousin!"" Waraqa asked, ""O my nephew! What have you seen?"" Allah's Messenger (ﷺ) described whatever he had seen. Waraqa said, ""This is the same one who keeps the secrets (angel Gabriel) whom Allah had sent to Moses. I wish I were young and could live up to the time when your people would turn you out."" Allah's Messenger (ﷺ) asked, ""Will they drive me out?"" Waraqa replied in the affirmative and said, ""Anyone (man) who came with something similar to what you have brought was treated with hostility; and if I should remain alive till the day when you will be turned out then I would support you strongly."" But after a few days Waraqa died and the Divine Inspiration was also paused for a while.",Narrated 'Aisha:,"(the mother of the faithful believers) The commencement of the Divine Inspiration to Allah's Messenger (ﷺ) was in the form of good dreams which came true like bright daylight, and then the love of seclusion was bestowed upon him. He used to go in seclusion in the cave of Hira where he used to worship (Allah alone) continuously for many days before his desire to see his family. He used to take with him the journey food for the stay and then come back to (his wife) Khadija to take his food likewise again till suddenly the Truth descended upon him while he was in the cave of Hira. The angel came to him and asked him to read. The Prophet (ﷺ) replied, ""I do not know how to read."" The Prophet (ﷺ) added, ""The angel caught me (forcefully) and pressed me so hard that I could not bear it any more. He then released me and again asked me to read and I replied, 'I do not know how to read.' Thereupon he caught me again and pressed me a second time till I could not bear it any more. He then released me and again asked me to read but again I replied, 'I do not know how to read (or what shall I read)?' Thereupon he caught me for the third time and pressed me, and then released me and said, 'Read in the name of your Lord, who has created (all that exists), created man from a clot. Read! And your Lord is the Most Generous."" (96.1, 96.2, 96.3) Then Allah's Messenger (ﷺ) returned with the Inspiration and with his heart beating severely. Then he went to Khadija bint Khuwailid and said, ""Cover me! Cover me!"" They covered him till his fear was over and after that he told her everything that had happened and said, ""I fear that something may happen to me."" Khadija replied, ""Never! By Allah, Allah will never disgrace you. You keep good relations with your kith and kin, help the poor and the destitute, serve your guests generously and assist the deserving calamity-afflicted ones.""Khadija then accompanied him to her cousin Waraqa bin Naufal bin Asad bin 'Abdul 'Uzza, who, during the pre-Islamic Period became a Christian and used to write the writing with Hebrew letters. He would write from the Gospel in Hebrew as much as Allah wished him to write. He was an old man and had lost his eyesight. Khadija said to Waraqa, ""Listen to the story of your nephew, O my cousin!"" Waraqa asked, ""O my nephew! What have you seen?"" Allah's Messenger (ﷺ) described whatever he had seen. Waraqa said, ""This is the same one who keeps the secrets (angel Gabriel) whom Allah had sent to Moses. I wish I were young and could live up to the time when your people would turn you out."" Allah's Messenger (ﷺ) asked, ""Will they drive me out?"" Waraqa replied in the affirmative and said, ""Anyone (man) who came with something similar to what you have brought was treated with hostility; and if I should remain alive till the day when you will be turned out then I would support you strongly."" But after a few days Waraqa died and the Divine Inspiration was also paused for a while.","حَدَّثَنَا يَحْيَى بْنُ بُكَيْرٍ، قَالَ حَدَّثَنَا اللَّيْثُ، عَنْ عُقَيْلٍ، عَنِ ابْنِ شِهَابٍ، عَنْ عُرْوَةَ بْنِ الزُّبَيْرِ، عَنْ عَائِشَةَ أُمِّ الْمُؤْمِنِينَ، أَنَّهَا قَالَتْ أَوَّلُ مَا بُدِئَ بِهِ رَسُولُ اللَّهِ صلى الله عليه وسلم مِنَ الْوَحْىِ الرُّؤْيَا الصَّالِحَةُ فِي النَّوْمِ، فَكَانَ لاَ يَرَى رُؤْيَا إِلاَّ جَاءَتْ مِثْلَ فَلَقِ الصُّبْحِ، ثُمَّ حُبِّبَ إِلَيْهِ الْخَلاَءُ، وَكَانَ يَخْلُو بِغَارِ حِرَاءٍ فَيَتَحَنَّثُ فِيهِ ـ وَهُوَ التَّعَبُّدُ ـ اللَّيَالِيَ ذَوَاتِ الْعَدَدِ قَبْلَ أَنْ يَنْزِعَ إِلَى أَهْلِهِ، وَيَتَزَوَّدُ لِذَلِكَ، ثُمَّ يَرْجِعُ إِلَى خَدِيجَةَ، فَيَتَزَوَّدُ لِمِثْلِهَا، حَتَّى جَاءَهُ الْحَقُّ وَهُوَ فِي غَارِ حِرَاءٍ، فَجَاءَهُ الْمَلَكُ فَقَالَ اقْرَأْ‏.‏ قَالَ ‏""‏ مَا أَنَا بِقَارِئٍ ‏""‏‏.‏ قَالَ ‏""‏ فَأَخَذَنِي فَغَطَّنِي حَتَّى بَلَغَ مِنِّي الْجَهْدَ، ثُمَّ أَرْسَلَنِي فَقَالَ اقْرَأْ‏.‏ قُلْتُ مَا أَنَا بِقَارِئٍ‏.‏ فَأَخَذَنِي فَغَطَّنِي الثَّانِيَةَ حَتَّى بَلَغَ مِنِّي الْجَهْدَ، ثُمَّ أَرْسَلَنِي فَقَالَ اقْرَأْ‏.‏ فَقُلْتُ مَا أَنَا بِقَارِئٍ‏.‏ فَأَخَذَنِي فَغَطَّنِي الثَّالِثَةَ، ثُمَّ أَرْسَلَنِي فَقَالَ ‏{‏اقْرَأْ بِاسْمِ رَبِّكَ الَّذِي خَلَقَ * خَلَقَ الإِنْسَانَ مِنْ عَلَقٍ * اقْرَأْ وَرَبُّكَ الأَكْرَمُ‏}‏ ‏""‏‏.‏ فَرَجَعَ بِهَا رَسُولُ اللَّهِ صلى الله عليه وسلم يَرْجُفُ فُؤَادُهُ، فَدَخَلَ عَلَى خَدِيجَةَ بِنْتِ خُوَيْلِدٍ رضى الله عنها فَقَالَ ‏""‏ زَمِّلُونِي زَمِّلُونِي ‏""‏‏.‏ فَزَمَّلُوهُ حَتَّى ذَهَبَ عَنْهُ الرَّوْعُ، فَقَالَ لِخَدِيجَةَ وَأَخْبَرَهَا الْخَبَرَ ‏""‏ لَقَدْ خَشِيتُ عَلَى نَفْسِي ‏""‏‏.‏ فَقَالَتْ خَدِيجَةُ كَلاَّ وَاللَّهِ مَا يُخْزِيكَ اللَّهُ أَبَدًا، إِنَّكَ لَتَصِلُ الرَّحِمَ، وَتَحْمِلُ الْكَلَّ، وَتَكْسِبُ الْمَعْدُومَ، وَتَقْرِي الضَّيْفَ، وَتُعِينُ عَلَى نَوَائِبِ الْحَقِّ‏.‏ فَانْطَلَقَتْ بِهِ خَدِيجَةُ حَتَّى أَتَتْ بِهِ وَرَقَةَ بْنَ نَوْفَلِ بْنِ أَسَدِ بْنِ عَبْدِ الْعُزَّى ابْنَ عَمِّ خَدِيجَةَ ـ وَكَانَ امْرَأً تَنَصَّرَ فِي الْجَاهِلِيَّةِ، وَكَانَ يَكْتُبُ الْكِتَابَ الْعِبْرَانِيَّ، فَيَكْتُبُ مِنَ الإِنْجِيلِ بِالْعِبْرَانِيَّةِ مَا شَاءَ اللَّهُ أَنْ يَكْتُبَ، وَكَانَ شَيْخًا كَبِيرًا قَدْ عَمِيَ ـ فَقَالَتْ لَهُ خَدِيجَةُ يَا ابْنَ عَمِّ اسْمَعْ مِنَ ابْنِ أَخِيكَ‏.‏ فَقَالَ لَهُ وَرَقَةُ يَا ابْنَ أَخِي مَاذَا تَرَى فَأَخْبَرَهُ رَسُولُ اللَّهِ صلى الله عليه وسلم خَبَرَ مَا رَأَى‏.‏ فَقَالَ لَهُ وَرَقَةُ هَذَا النَّامُوسُ الَّذِي نَزَّلَ اللَّهُ عَلَى مُوسَى صلى الله عليه وسلم يَا لَيْتَنِي فِيهَا جَذَعًا، لَيْتَنِي أَكُونُ حَيًّا إِذْ يُخْرِجُكَ قَوْمُكَ‏.‏ فَقَالَ رَسُولُ اللَّهِ صلى الله عليه وسلم ‏""‏ أَوَمُخْرِجِيَّ هُمْ ‏""‏‏.‏ قَالَ نَعَمْ، لَمْ يَأْتِ رَجُلٌ قَطُّ بِمِثْلِ مَا جِئْتَ بِهِ إِلاَّ عُودِيَ، وَإِنْ يُدْرِكْنِي يَوْمُكَ أَنْصُرْكَ نَصْرًا مُؤَزَّرًا‏.‏ ثُمَّ لَمْ يَنْشَبْ وَرَقَةُ أَنْ تُوُفِّيَ وَفَتَرَ الْوَحْىُ‏.‏",حَدَّثَنَا يَحْيَى بْنُ بُكَيْرٍ، قَالَ حَدَّثَنَا اللَّيْثُ، عَنْ عُقَيْلٍ، عَنِ ابْنِ شِهَابٍ، عَنْ عُرْوَةَ بْنِ الزُّبَيْرِ، عَنْ عَائِشَةَ أُمِّ الْمُؤْمِنِينَ، أَنَّهَا قَالَتْ,"أَوَّلُ مَا بُدِئَ بِهِ رَسُولُ اللَّهِ صلى الله عليه وسلم مِنَ الْوَحْىِ الرُّؤْيَا الصَّالِحَةُ فِي النَّوْمِ، فَكَانَ لاَ يَرَى رُؤْيَا إِلاَّ جَاءَتْ مِثْلَ فَلَقِ الصُّبْحِ، ثُمَّ حُبِّبَ إِلَيْهِ الْخَلاَءُ، وَكَانَ يَخْلُو بِغَارِ حِرَاءٍ فَيَتَحَنَّثُ فِيهِ ـ وَهُوَ التَّعَبُّدُ ـ اللَّيَالِيَ ذَوَاتِ الْعَدَدِ قَبْلَ أَنْ يَنْزِعَ إِلَى أَهْلِهِ، وَيَتَزَوَّدُ لِذَلِكَ، ثُمَّ يَرْجِعُ إِلَى خَدِيجَةَ، فَيَتَزَوَّدُ لِمِثْلِهَا، حَتَّى جَاءَهُ الْحَقُّ وَهُوَ فِي غَارِ حِرَاءٍ، فَجَاءَهُ الْمَلَكُ فَقَالَ اقْرَأْ‏.‏ قَالَ ‏""‏ مَا أَنَا بِقَارِئٍ ‏""‏‏.‏ قَالَ ‏""‏ فَأَخَذَنِي فَغَطَّنِي حَتَّى بَلَغَ مِنِّي الْجَهْدَ، ثُمَّ أَرْسَلَنِي فَقَالَ اقْرَأْ‏.‏ قُلْتُ مَا أَنَا بِقَارِئٍ‏.‏ فَأَخَذَنِي فَغَطَّنِي الثَّانِيَةَ حَتَّى بَلَغَ مِنِّي الْجَهْدَ، ثُمَّ أَرْسَلَنِي فَقَالَ اقْرَأْ‏.‏ فَقُلْتُ مَا أَنَا بِقَارِئٍ‏.‏ فَأَخَذَنِي فَغَطَّنِي الثَّالِثَةَ، ثُمَّ أَرْسَلَنِي فَقَالَ ‏{‏اقْرَأْ بِاسْمِ رَبِّكَ الَّذِي خَلَقَ * خَلَقَ الإِنْسَانَ مِنْ عَلَقٍ * اقْرَأْ وَرَبُّكَ الأَكْرَمُ‏}‏ ‏""‏‏.‏ فَرَجَعَ بِهَا رَسُولُ اللَّهِ صلى الله عليه وسلم يَرْجُفُ فُؤَادُهُ، فَدَخَلَ عَلَى خَدِيجَةَ بِنْتِ خُوَيْلِدٍ رضى الله عنها فَقَالَ ‏""‏ زَمِّلُونِي زَمِّلُونِي ‏""‏‏.‏ فَزَمَّلُوهُ حَتَّى ذَهَبَ عَنْهُ الرَّوْعُ، فَقَالَ لِخَدِيجَةَ وَأَخْبَرَهَا الْخَبَرَ ‏""‏ لَقَدْ خَشِيتُ عَلَى نَفْسِي ‏""‏‏.‏ فَقَالَتْ خَدِيجَةُ كَلاَّ وَاللَّهِ مَا يُخْزِيكَ اللَّهُ أَبَدًا، إِنَّكَ لَتَصِلُ الرَّحِمَ، وَتَحْمِلُ الْكَلَّ، وَتَكْسِبُ الْمَعْدُومَ، وَتَقْرِي الضَّيْفَ، وَتُعِينُ عَلَى نَوَائِبِ الْحَقِّ‏.‏ فَانْطَلَقَتْ بِهِ خَدِيجَةُ حَتَّى أَتَتْ بِهِ وَرَقَةَ بْنَ نَوْفَلِ بْنِ أَسَدِ بْنِ عَبْدِ الْعُزَّى ابْنَ عَمِّ خَدِيجَةَ ـ وَكَانَ امْرَأً تَنَصَّرَ فِي الْجَاهِلِيَّةِ، وَكَانَ يَكْتُبُ الْكِتَابَ الْعِبْرَانِيَّ، فَيَكْتُبُ مِنَ الإِنْجِيلِ بِالْعِبْرَانِيَّةِ مَا شَاءَ اللَّهُ أَنْ يَكْتُبَ، وَكَانَ شَيْخًا كَبِيرًا قَدْ عَمِيَ ـ فَقَالَتْ لَهُ خَدِيجَةُ يَا ابْنَ عَمِّ اسْمَعْ مِنَ ابْنِ أَخِيكَ‏.‏ فَقَالَ لَهُ وَرَقَةُ يَا ابْنَ أَخِي مَاذَا تَرَى فَأَخْبَرَهُ رَسُولُ اللَّهِ صلى الله عليه وسلم خَبَرَ مَا رَأَى‏.‏ فَقَالَ لَهُ وَرَقَةُ هَذَا النَّامُوسُ الَّذِي نَزَّلَ اللَّهُ عَلَى مُوسَى صلى الله عليه وسلم يَا لَيْتَنِي فِيهَا جَذَعًا، لَيْتَنِي أَكُونُ حَيًّا إِذْ يُخْرِجُكَ قَوْمُكَ‏.‏ فَقَالَ رَسُولُ اللَّهِ صلى الله عليه وسلم ‏""‏ أَوَمُخْرِجِيَّ هُمْ ‏""‏‏.‏ قَالَ نَعَمْ، لَمْ يَأْتِ رَجُلٌ قَطُّ بِمِثْلِ مَا جِئْتَ بِهِ إِلاَّ عُودِيَ، وَإِنْ يُدْرِكْنِي يَوْمُكَ أَنْصُرْكَ نَصْرًا مُؤَزَّرًا‏.‏ ثُمَّ لَمْ يَنْشَبْ وَرَقَةُ أَنْ تُوُفِّيَ وَفَتَرَ الْوَحْىُ‏.‏",nan,Sahih-Authentic,صحيح
