Chapter_Number,Chapter_English,Chapter_Arabic,Section_Number,Section_English,Section_Arabic,Hadith_number,English_Hadith,English_Isnad,English_Matn,Arabic_Hadith,Arabic_Isnad,Arabic_Matn,Arabic_Comment,English_Grade,Arabic_Grade
29.0,Virtues of Madinah,كتاب فضائل المدينة,10.0,Al-Madina expels all the evil and bad persons,الْمَدِينَةُ تَنْفِي الْخَبَثَ,1884.0,"Narrated Zaid bin Thabit: When the Prophet (ﷺ) went out for (the battle of) Uhud, some of his companions (hypocrites) returned(home). A party of the believers remarked that they would kill those (hypocrites) who had returned,but another party said that they would not kill them. So, this Divine Inspiration was revealed: ""Thenwhat is the matter with you that you are divided into two parties concerning the hypocrites."" (4.88)The Prophet (ﷺ) said, ""Medina expels the bad persons from it, as fire expels the impurities of iron.""",Narrated Zaid bin Thabit:,"When the Prophet (ﷺ) went out for (the battle of) Uhud, some of his companions (hypocrites) returned(home). A party of the believers remarked that they would kill those (hypocrites) who had returned,but another party said that they would not kill them. So, this Divine Inspiration was revealed: ""Thenwhat is the matter with you that you are divided into two parties concerning the hypocrites."" (4.88)The Prophet (ﷺ) said, ""Medina expels the bad persons from it, as fire expels the impurities of iron.""","حَدَّثَنَا سُلَيْمَانُ بْنُ حَرْبٍ، حَدَّثَنَا شُعْبَةُ، عَنْ عَدِيِّ بْنِ ثَابِتٍ، عَنْ عَبْدِ اللَّهِ بْنِ يَزِيدَ، قَالَ سَمِعْتُ زَيْدَ بْنَ ثَابِتٍ ـ رضى الله عنه ـ يَقُولُ لَمَّا خَرَجَ النَّبِيُّ صلى الله عليه وسلم إِلَى أُحُدٍ رَجَعَ نَاسٌ مِنْ أَصْحَابِهِ فَقَالَتْ فِرْقَةٌ نَقْتُلُهُمْ‏.‏ وَقَالَتْ فِرْقَةٌ لاَ نَقْتُلُهُمْ‏.‏ فَنَزَلَتْ ‏{‏فَمَا لَكُمْ فِي الْمُنَافِقِينِ فِئَتَيْنِ‏}‏ وَقَالَ النَّبِيُّ صلى الله عليه وسلم ‏""‏ إِنَّهَا تَنْفِي الرِّجَالَ كَمَا تَنْفِي النَّارُ خَبَثَ الْحَدِيدِ ‏""‏‏.‏",حَدَّثَنَا سُلَيْمَانُ بْنُ حَرْبٍ، حَدَّثَنَا شُعْبَةُ، عَنْ عَدِيِّ بْنِ ثَابِتٍ، عَنْ عَبْدِ اللَّهِ بْنِ يَزِيدَ، قَالَ سَمِعْتُ زَيْدَ بْنَ ثَابِتٍ ـ رضى الله عنه ـ يَقُولُ,"لَمَّا خَرَجَ النَّبِيُّ صلى الله عليه وسلم إِلَى أُحُدٍ رَجَعَ نَاسٌ مِنْ أَصْحَابِهِ فَقَالَتْ فِرْقَةٌ نَقْتُلُهُمْ‏.‏ وَقَالَتْ فِرْقَةٌ لاَ نَقْتُلُهُمْ‏.‏ فَنَزَلَتْ ‏{‏فَمَا لَكُمْ فِي الْمُنَافِقِينِ فِئَتَيْنِ‏}‏ وَقَالَ النَّبِيُّ صلى الله عليه وسلم ‏""‏ إِنَّهَا تَنْفِي الرِّجَالَ كَمَا تَنْفِي النَّارُ خَبَثَ الْحَدِيدِ ‏""‏‏.‏",nan,Sahih-Authentic,صحيح
29.0,Virtues of Madinah,كتاب فضائل المدينة,10.0,nan,nan,1885.0,"Narrated Anas: The Prophet (ﷺ) said, ""O Allah! Bestow on Medina twice the blessings You bestowed on Mecca.""",Narrated Anas:,"The Prophet (ﷺ) said, ""O Allah! Bestow on Medina twice the blessings You bestowed on Mecca.""",حَدَّثَنَا عَبْدُ اللَّهِ بْنُ مُحَمَّدٍ، حَدَّثَنَا وَهْبُ بْنُ جَرِيرٍ، حَدَّثَنَا أَبِي، سَمِعْتُ يُونُسَ، عَنِ ابْنِ شِهَابٍ، عَنْ أَنَسٍ ـ رضى الله عنه ـ عَنِ النَّبِيِّ صلى الله عليه وسلم قَالَ ‏ ‏ اللَّهُمَّ اجْعَلْ بِالْمَدِينَةِ ضِعْفَىْ مَا جَعَلْتَ بِمَكَّةَ مِنَ الْبَرَكَةِ ‏‏‏.‏,حَدَّثَنَا عَبْدُ اللَّهِ بْنُ مُحَمَّدٍ، حَدَّثَنَا وَهْبُ بْنُ جَرِيرٍ، حَدَّثَنَا أَبِي، سَمِعْتُ يُونُسَ، عَنِ ابْنِ شِهَابٍ، عَنْ أَنَسٍ ـ رضى الله عنه ـ عَنِ,النَّبِيِّ صلى الله عليه وسلم قَالَ ‏ ‏ اللَّهُمَّ اجْعَلْ بِالْمَدِينَةِ ضِعْفَىْ مَا جَعَلْتَ بِمَكَّةَ مِنَ الْبَرَكَةِ ‏‏‏.‏,تَابَعَهُ عُثْمَانُ بْنُ عُمَرَ عَنْ يُونُسَ‏.‏,Sahih-Authentic,صحيح
29.0,Virtues of Madinah,كتاب فضائل المدينة,10.0,nan,nan,1886.0,"Narrated Anas: Whenever the Prophet (ﷺ) returned from a journey and observed the walls of Medina, he would make hisMount go fast, and if he was on an animal (i.e. a horse), he would make it gallop because of his lovefor Medina.",Narrated Anas:,"Whenever the Prophet (ﷺ) returned from a journey and observed the walls of Medina, he would make hisMount go fast, and if he was on an animal (i.e. a horse), he would make it gallop because of his lovefor Medina.",حَدَّثَنَا قُتَيْبَةُ، حَدَّثَنَا إِسْمَاعِيلُ بْنُ جَعْفَرٍ، عَنْ حُمَيْدٍ، عَنْ أَنَسٍ ـ رضى الله عنه ـ أَنَّ النَّبِيَّ صلى الله عليه وسلم كَانَ إِذَا قَدِمَ مِنْ سَفَرٍ، فَنَظَرَ إِلَى جُدُرَاتِ الْمَدِينَةِ أَوْضَعَ رَاحِلَتَهُ، وَإِنْ كَانَ عَلَى دَابَّةٍ، حَرَّكَهَا مِنْ حُبِّهَا‏.‏,حَدَّثَنَا قُتَيْبَةُ، حَدَّثَنَا إِسْمَاعِيلُ بْنُ جَعْفَرٍ، عَنْ حُمَيْدٍ، عَنْ أَنَسٍ ـ رضى الله عنه ـ,أَنَّ النَّبِيَّ صلى الله عليه وسلم كَانَ إِذَا قَدِمَ مِنْ سَفَرٍ، فَنَظَرَ إِلَى جُدُرَاتِ الْمَدِينَةِ أَوْضَعَ رَاحِلَتَهُ، وَإِنْ كَانَ عَلَى دَابَّةٍ، حَرَّكَهَا مِنْ حُبِّهَا‏.‏,nan,Sahih-Authentic,صحيح
29.0,Virtues of Madinah,كتاب فضائل المدينة,11.0,The dislike of the Prophet (saws) that Al-Madina should be vacated,كَرَاهِيَةِ النَّبِيِّ صلى الله عليه وسلم أَنْ تُعْرَى الْمَدِينَةُ,1887.0,"Narrated Anas: (The people of) Bani Salama intended to shift near the mosque (of the Prophet) but Allah's Messenger (ﷺ)disliked to see Medina vacated and said, ""O the people of Bani Salama! Don't you think that you willbe rewarded for your footsteps which you take towards the mosque?"" So, they stayed at their oldplaces.",Narrated Anas:,"(The people of) Bani Salama intended to shift near the mosque (of the Prophet) but Allah's Messenger (ﷺ)disliked to see Medina vacated and said, ""O the people of Bani Salama! Don't you think that you willbe rewarded for your footsteps which you take towards the mosque?"" So, they stayed at their oldplaces.",حَدَّثَنَا ابْنُ سَلاَمٍ، أَخْبَرَنَا الْفَزَارِيُّ، عَنْ حُمَيْدٍ الطَّوِيلِ، عَنْ أَنَسٍ ـ رضى الله عنه ـ قَالَ أَرَادَ بَنُو سَلِمَةَ أَنْ يَتَحَوَّلُوا، إِلَى قُرْبِ الْمَسْجِدِ، فَكَرِهَ رَسُولُ اللَّهِ صلى الله عليه وسلم أَنْ تُعْرَى الْمَدِينَةُ، وَقَالَ ‏ ‏ يَا بَنِي سَلِمَةَ‏.‏ أَلاَ تَحْتَسِبُونَ آثَارَكُمْ ‏‏‏.‏ فَأَقَامُوا‏.‏,حَدَّثَنَا ابْنُ سَلاَمٍ، أَخْبَرَنَا الْفَزَارِيُّ، عَنْ حُمَيْدٍ الطَّوِيلِ، عَنْ أَنَسٍ ـ رضى الله عنه ـ قَالَ,أَرَادَ بَنُو سَلِمَةَ أَنْ يَتَحَوَّلُوا، إِلَى قُرْبِ الْمَسْجِدِ، فَكَرِهَ رَسُولُ اللَّهِ صلى الله عليه وسلم أَنْ تُعْرَى الْمَدِينَةُ، وَقَالَ ‏ ‏ يَا بَنِي سَلِمَةَ‏.‏ أَلاَ تَحْتَسِبُونَ آثَارَكُمْ ‏‏‏.‏ فَأَقَامُوا‏.‏,nan,Sahih-Authentic,صحيح
29.0,Virtues of Madinah,كتاب فضائل المدينة,12.0,nan,nan,1888.0,"Narrated Abu Huraira: The Prophet (ﷺ) said, ""There is a garden from the gardens of Paradise between my house and my pulpit,and my pulpit is on my Lake Fount (Al-Kauthar).",Narrated Abu Huraira:,"The Prophet (ﷺ) said, ""There is a garden from the gardens of Paradise between my house and my pulpit,and my pulpit is on my Lake Fount (Al-Kauthar).",حَدَّثَنَا مُسَدَّدٌ، عَنْ يَحْيَى، عَنْ عُبَيْدِ اللَّهِ بْنِ عُمَرَ، قَالَ حَدَّثَنِي خُبَيْبُ بْنُ عَبْدِ الرَّحْمَنِ، عَنْ حَفْصِ بْنِ عَاصِمٍ، عَنْ أَبِي هُرَيْرَةَ ـ رضى الله عنه ـ عَنِ النَّبِيِّ صلى الله عليه وسلم قَالَ ‏ ‏ مَا بَيْنَ بَيْتِي وَمِنْبَرِي رَوْضَةٌ مِنْ رِيَاضِ الْجَنَّةِ، وَمِنْبَرِي عَلَى حَوْضِي ‏‏‏.‏,حَدَّثَنَا مُسَدَّدٌ، عَنْ يَحْيَى، عَنْ عُبَيْدِ اللَّهِ بْنِ عُمَرَ، قَالَ حَدَّثَنِي خُبَيْبُ بْنُ عَبْدِ الرَّحْمَنِ، عَنْ حَفْصِ بْنِ عَاصِمٍ، عَنْ أَبِي هُرَيْرَةَ ـ رضى الله عنه ـ عَنِ,النَّبِيِّ صلى الله عليه وسلم قَالَ ‏ ‏ مَا بَيْنَ بَيْتِي وَمِنْبَرِي رَوْضَةٌ مِنْ رِيَاضِ الْجَنَّةِ، وَمِنْبَرِي عَلَى حَوْضِي ‏‏‏.‏,nan,Sahih-Authentic,صحيح
29.0,Virtues of Madinah,كتاب فضائل المدينة,12.0,nan,nan,1889.0,"Narrated `Aisha: When Allah's Messenger (ﷺ) reached Medina, Abu Bakr and Bilal became ill. When Abu Bakr's fever gotworse, he would recite (this poetic verse): ""Everybody is staying alive with his People, yet Death isnearer to him than His shoe laces."" And Bilal, when his fever deserted him, would recite: ""Would thatI could stay overnight in A valley wherein I would be Surrounded by Idhkhir and Jalil (kinds of goodsmellinggrass). Would that one day I could Drink the water of the Majanna, and Would that (The twomountains) Shama and Tafil would appear to me!"" The Prophet (ﷺ) said, ""O Allah! Curse Shaiba binRabi`a and `Utba bin Rabi`a and Umaiya bin Khalaf as they turned us out of our land to the land ofepidemics."" Allah's Messenger (ﷺ) then said, ""O Allah! Make us love Medina as we love Mecca or evenmore than that. O Allah! Give blessings in our Sa and our Mudd (measures symbolizing food) andmake the climate of Medina suitable for us, and divert its fever towards Aljuhfa."" Aisha added: Whenwe reached Medina, it was the most unhealthy of Allah's lands, and the valley of Bathan (the valley ofMedina) used to flow with impure colored water.",Narrated `Aisha:,"When Allah's Messenger (ﷺ) reached Medina, Abu Bakr and Bilal became ill. When Abu Bakr's fever gotworse, he would recite (this poetic verse): ""Everybody is staying alive with his People, yet Death isnearer to him than His shoe laces."" And Bilal, when his fever deserted him, would recite: ""Would thatI could stay overnight in A valley wherein I would be Surrounded by Idhkhir and Jalil (kinds of goodsmellinggrass). Would that one day I could Drink the water of the Majanna, and Would that (The twomountains) Shama and Tafil would appear to me!"" The Prophet (ﷺ) said, ""O Allah! Curse Shaiba binRabi`a and `Utba bin Rabi`a and Umaiya bin Khalaf as they turned us out of our land to the land ofepidemics."" Allah's Messenger (ﷺ) then said, ""O Allah! Make us love Medina as we love Mecca or evenmore than that. O Allah! Give blessings in our Sa and our Mudd (measures symbolizing food) andmake the climate of Medina suitable for us, and divert its fever towards Aljuhfa."" Aisha added: Whenwe reached Medina, it was the most unhealthy of Allah's lands, and the valley of Bathan (the valley ofMedina) used to flow with impure colored water.",حَدَّثَنَا عُبَيْدُ بْنُ إِسْمَاعِيلَ، حَدَّثَنَا أَبُو أُسَامَةَ، عَنْ هِشَامٍ، عَنْ أَبِيهِ، عَنْ عَائِشَةَ ـ رضى الله عنها ـ قَالَتْ لَمَّا قَدِمَ رَسُولُ اللَّهِ صلى الله عليه وسلم الْمَدِينَةَ وُعِكَ أَبُو بَكْرٍ وَبِلاَلٌ، فَكَانَ أَبُو بَكْرٍ إِذَا أَخَذَتْهُ الْحُمَّى يَقُولُ كُلُّ امْرِئٍ مُصَبَّحٌ فِي أَهْلِهِ وَالْمَوْتُ أَدْنَى مِنْ شِرَاكِ نَعْلِهِ وَكَانَ بِلاَلٌ إِذَا أُقْلِعَ عَنْهُ الْحُمَّى يَرْفَعُ عَقِيرَتَهُ يَقُولُ أَلاَ لَيْتَ شِعْرِي هَلْ أَبِيتَنَّ لَيْلَةً بِوَادٍ وَحَوْلِي إِذْخِرٌ وَجَلِيلُ وَهَلْ أَرِدَنْ يَوْمًا مِيَاهَ مَجَنَّةٍ وَهَلْ يَبْدُوَنْ لِي شَامَةٌ وَطَفِيلُ قَالَ اللَّهُمَّ الْعَنْ شَيْبَةَ بْنَ رَبِيعَةَ، وَعُتْبَةَ بْنَ رَبِيعَةَ، وَأُمَيَّةَ بْنَ خَلَفٍ، كَمَا أَخْرَجُونَا مِنْ أَرْضِنَا إِلَى أَرْضِ الْوَبَاءِ ثُمَّ قَالَ رَسُولُ اللَّهِ صلى الله عليه وسلم ‏ ‏ اللَّهُمَّ حَبِّبْ إِلَيْنَا الْمَدِينَةَ كَحُبِّنَا مَكَّةَ أَوْ أَشَدَّ، اللَّهُمَّ بَارِكْ لَنَا فِي صَاعِنَا، وَفِي مُدِّنَا، وَصَحِّحْهَا لَنَا وَانْقُلْ حُمَّاهَا إِلَى الْجُحْفَةِ ‏‏‏.‏ قَالَتْ وَقَدِمْنَا الْمَدِينَةَ، وَهْىَ أَوْبَأُ أَرْضِ اللَّهِ‏.‏ قَالَتْ فَكَانَ بُطْحَانُ يَجْرِي نَجْلاً‏.‏ تَعْنِي مَاءً آجِنًا‏.‏,حَدَّثَنَا عُبَيْدُ بْنُ إِسْمَاعِيلَ، حَدَّثَنَا أَبُو أُسَامَةَ، عَنْ هِشَامٍ، عَنْ أَبِيهِ، عَنْ عَائِشَةَ ـ رضى الله عنها ـ قَالَتْ,لَمَّا قَدِمَ رَسُولُ اللَّهِ صلى الله عليه وسلم الْمَدِينَةَ وُعِكَ أَبُو بَكْرٍ وَبِلاَلٌ، فَكَانَ أَبُو بَكْرٍ إِذَا أَخَذَتْهُ الْحُمَّى يَقُولُ كُلُّ امْرِئٍ مُصَبَّحٌ فِي أَهْلِهِ وَالْمَوْتُ أَدْنَى مِنْ شِرَاكِ نَعْلِهِ وَكَانَ بِلاَلٌ إِذَا أُقْلِعَ عَنْهُ الْحُمَّى يَرْفَعُ عَقِيرَتَهُ يَقُولُ أَلاَ لَيْتَ شِعْرِي هَلْ أَبِيتَنَّ لَيْلَةً بِوَادٍ وَحَوْلِي إِذْخِرٌ وَجَلِيلُ وَهَلْ أَرِدَنْ يَوْمًا مِيَاهَ مَجَنَّةٍ وَهَلْ يَبْدُوَنْ لِي شَامَةٌ وَطَفِيلُ قَالَ اللَّهُمَّ الْعَنْ شَيْبَةَ بْنَ رَبِيعَةَ، وَعُتْبَةَ بْنَ رَبِيعَةَ، وَأُمَيَّةَ بْنَ خَلَفٍ، كَمَا أَخْرَجُونَا مِنْ أَرْضِنَا إِلَى أَرْضِ الْوَبَاءِ ثُمَّ قَالَ رَسُولُ اللَّهِ صلى الله عليه وسلم ‏ ‏ اللَّهُمَّ حَبِّبْ إِلَيْنَا الْمَدِينَةَ كَحُبِّنَا مَكَّةَ أَوْ أَشَدَّ، اللَّهُمَّ بَارِكْ لَنَا فِي صَاعِنَا، وَفِي مُدِّنَا، وَصَحِّحْهَا لَنَا وَانْقُلْ حُمَّاهَا إِلَى الْجُحْفَةِ ‏‏‏.‏ قَالَتْ وَقَدِمْنَا الْمَدِينَةَ، وَهْىَ أَوْبَأُ أَرْضِ اللَّهِ‏.‏ قَالَتْ فَكَانَ بُطْحَانُ يَجْرِي نَجْلاً‏.‏ تَعْنِي مَاءً آجِنًا‏.‏,nan,Sahih-Authentic,صحيح
29.0,Virtues of Madinah,كتاب فضائل المدينة,12.0,nan,nan,1890.0,"Narrated Zaid bin Aslam from his father: `Umar said, O Allah! Grant me martyrdom in Your cause, and let my death be in the city of YourApostle.""",Narrated Zaid bin Aslam from his father:,"`Umar said, O Allah! Grant me martyrdom in Your cause, and let my death be in the city of YourApostle.""",حَدَّثَنَا يَحْيَى بْنُ بُكَيْرٍ، حَدَّثَنَا اللَّيْثُ، عَنْ خَالِدِ بْنِ يَزِيدَ، عَنْ سَعِيدِ بْنِ أَبِي هِلاَلٍ، عَنْ زَيْدِ بْنِ أَسْلَمَ، عَنْ أَبِيهِ، عَنْ عُمَرَ ـ رضى الله عنه ـ قَالَ اللَّهُمَّ ارْزُقْنِي شَهَادَةً فِي سَبِيلِكَ، وَاجْعَلْ مَوْتِي فِي بَلَدِ رَسُولِكَ صلى الله عليه وسلم‏.‏,حَدَّثَنَا يَحْيَى بْنُ بُكَيْرٍ، حَدَّثَنَا اللَّيْثُ، عَنْ خَالِدِ بْنِ يَزِيدَ، عَنْ سَعِيدِ بْنِ أَبِي هِلاَلٍ، عَنْ زَيْدِ بْنِ أَسْلَمَ، عَنْ أَبِيهِ، عَنْ عُمَرَ ـ رضى الله عنه ـ قَالَ,اللَّهُمَّ ارْزُقْنِي شَهَادَةً فِي سَبِيلِكَ، وَاجْعَلْ مَوْتِي فِي بَلَدِ رَسُولِكَ صلى الله عليه وسلم‏.‏,وَقَالَ ابْنُ زُرَيْعٍ عَنْ رَوْحِ بْنِ الْقَاسِمِ، عَنْ زَيْدِ بْنِ أَسْلَمَ، عَنْ أُمِّهِ، عَنْ حَفْصَةَ بِنْتِ عُمَرَ ـ رضى الله عنهما ـ قَالَتْ سَمِعْتُ عُمَرَ، نَحْوَهُ‏.‏ وَقَالَ هِشَامٌ عَنْ زَيْدٍ، عَنْ أَبِيهِ، عَنْ حَفْصَةَ، سَمِعْتُ عُمَرَ، رضى الله عنه‏.‏,Sahih-Authentic,صحيح
