Chapter_Number,Chapter_English,Chapter_Arabic,Section_Number,Section_English,Section_Arabic,Hadith_number,English_Hadith,English_Isnad,English_Matn,Arabic_Hadith,Arabic_Isnad,Arabic_Matn,Arabic_Comment,English_Grade,Arabic_Grade
89.0,(Statements made under) Coercion,كتاب الإكراه,nan,nan,nan,6940.0,"Narrated Abi Huraira The Prophet (ﷺ) used to invoke Allah in his prayer, ""O Allah! Save `Aiyash bin Abi Rabi`a and Salama bin Hisham and Al-Walid bin Al-Walid; O Allah! Save the weak among the believers; O Allah! Be hard upon the tribe of Mudar and inflict years (of famine) upon them like the (famine) years of Joseph.""",Narrated Abi Huraira,"The Prophet (ﷺ) used to invoke Allah in his prayer, ""O Allah! Save `Aiyash bin Abi Rabi`a and Salama bin Hisham and Al-Walid bin Al-Walid; O Allah! Save the weak among the believers; O Allah! Be hard upon the tribe of Mudar and inflict years (of famine) upon them like the (famine) years of Joseph.""","حَدَّثَنَا يَحْيَى بْنُ بُكَيْرٍ، حَدَّثَنَا اللَّيْثُ، عَنْ خَالِدِ بْنِ يَزِيدَ، عَنْ سَعِيدِ بْنِ أَبِي هِلاَلٍ، عَنْ هِلاَلِ بْنِ أُسَامَةَ، أَنَّ أَبَا سَلَمَةَ بْنَ عَبْدِ الرَّحْمَنِ، أَخْبَرَهُ عَنْ أَبِي هُرَيْرَةَ، أَنَّ النَّبِيَّ صلى الله عليه وسلم كَانَ يَدْعُو فِي الصَّلاَةِ ‏ ""‏ اللَّهُمَّ أَنْجِ عَيَّاشَ بْنَ أَبِي رَبِيعَةَ، وَسَلَمَةَ بْنَ هِشَامٍ، وَالْوَلِيدَ بْنَ الْوَلِيدِ، اللَّهُمَّ أَنْجِ الْمُسْتَضْعَفِينَ مِنَ الْمُؤْمِنِينَ، اللَّهُمَّ اشْدُدْ وَطْأَتَكَ عَلَى مُضَرَ، وَابْعَثْ عَلَيْهِمْ سِنِينَ كَسِنِي يُوسُفَ ‏""‏‏.‏",حَدَّثَنَا يَحْيَى بْنُ بُكَيْرٍ، حَدَّثَنَا اللَّيْثُ، عَنْ خَالِدِ بْنِ يَزِيدَ، عَنْ سَعِيدِ بْنِ أَبِي هِلاَلٍ، عَنْ هِلاَلِ بْنِ أُسَامَةَ، أَنَّ أَبَا سَلَمَةَ بْنَ عَبْدِ الرَّحْمَنِ، أَخْبَرَهُ عَنْ أَبِي هُرَيْرَةَ،,"أَنَّ النَّبِيَّ صلى الله عليه وسلم كَانَ يَدْعُو فِي الصَّلاَةِ ‏ ""‏ اللَّهُمَّ أَنْجِ عَيَّاشَ بْنَ أَبِي رَبِيعَةَ، وَسَلَمَةَ بْنَ هِشَامٍ، وَالْوَلِيدَ بْنَ الْوَلِيدِ، اللَّهُمَّ أَنْجِ الْمُسْتَضْعَفِينَ مِنَ الْمُؤْمِنِينَ، اللَّهُمَّ اشْدُدْ وَطْأَتَكَ عَلَى مُضَرَ، وَابْعَثْ عَلَيْهِمْ سِنِينَ كَسِنِي يُوسُفَ ‏""‏‏.‏",nan,Sahih-Authentic,صحيح
89.0,(Statements made under) Coercion,كتاب الإكراه,1.0,Whoever preferred to be beaten killed and humiliated rather than to revert to Kufr,مَنِ اخْتَارَ الضَّرْبَ وَالْقَتْلَ وَالْهَوَانَ عَلَى الْكُفْرِ,6941.0,"Narrated Anas: Allah's Messenger (ﷺ) said, ""Whoever possesses the (following) three qualities will have the sweetness offaith (1): The one to whom Allah and His Apostle becomes dearer than anything else; (2) Who loves aperson and he loves him only for Allah's Sake; (3) who hates to revert to atheism (disbelief) as hehates to be thrown into the Fire.""",Narrated Anas:,"Allah's Messenger (ﷺ) said, ""Whoever possesses the (following) three qualities will have the sweetness offaith (1): The one to whom Allah and His Apostle becomes dearer than anything else; (2) Who loves aperson and he loves him only for Allah's Sake; (3) who hates to revert to atheism (disbelief) as hehates to be thrown into the Fire.""",حَدَّثَنَا مُحَمَّدُ بْنُ عَبْدِ اللَّهِ بْنِ حَوْشَبٍ الطَّائِفِيُّ، حَدَّثَنَا عَبْدُ الْوَهَّابِ، حَدَّثَنَا أَيُّوبُ، عَنْ أَبِي قِلاَبَةَ، عَنْ أَنَسٍ ـ رضى الله عنه ـ قَالَ قَالَ رَسُولُ اللَّهِ صلى الله عليه وسلم ‏ ‏ ثَلاَثٌ مَنْ كُنَّ فِيهِ وَجَدَ حَلاَوَةَ الإِيمَانِ أَنْ يَكُونَ اللَّهُ وَ رَسُولُهُ أَحَبَّ إِلَيْهِ مِمَّا سِوَاهُمَا، وَأَنْ يُحِبَّ الْمَرْءَ لاَ يُحِبُّهُ إِلاَّ لِلَّهِ، وَأَنْ يَكْرَهَ أَنْ يَعُودَ فِي الْكُفْرِ، كَمَا يَكْرَهُ أَنْ يُقْذَفَ فِي النَّارِ ‏‏‏.‏,حَدَّثَنَا مُحَمَّدُ بْنُ عَبْدِ اللَّهِ بْنِ حَوْشَبٍ الطَّائِفِيُّ، حَدَّثَنَا عَبْدُ الْوَهَّابِ، حَدَّثَنَا أَيُّوبُ، عَنْ أَبِي قِلاَبَةَ، عَنْ أَنَسٍ ـ رضى الله عنه ـ قَالَ,قَالَ رَسُولُ اللَّهِ صلى الله عليه وسلم ‏ ‏ ثَلاَثٌ مَنْ كُنَّ فِيهِ وَجَدَ حَلاَوَةَ الإِيمَانِ أَنْ يَكُونَ اللَّهُ وَ رَسُولُهُ أَحَبَّ إِلَيْهِ مِمَّا سِوَاهُمَا، وَأَنْ يُحِبَّ الْمَرْءَ لاَ يُحِبُّهُ إِلاَّ لِلَّهِ، وَأَنْ يَكْرَهَ أَنْ يَعُودَ فِي الْكُفْرِ، كَمَا يَكْرَهُ أَنْ يُقْذَفَ فِي النَّارِ ‏‏‏.‏,nan,Sahih-Authentic,صحيح
89.0,(Statements made under) Coercion,كتاب الإكراه,1.0,Whoever preferred to be beaten killed and humiliated rather than to revert to Kufr,مَنِ اخْتَارَ الضَّرْبَ وَالْقَتْلَ وَالْهَوَانَ عَلَى الْكُفْرِ,6942.0,"Narrated Qais: I heard Sa`id bin Zaid saying, ""I have seen myself tied and forced by `Umar to leave Islam (Before`Umar himself embraced Islam). And if the mountain of Uhud were to collapse for the evil which youpeople had done to `Uthman, then Uhud would have the right to do so."" (See Hadith No. 202, Vol. 5)",Narrated Qais:,"I heard Sa`id bin Zaid saying, ""I have seen myself tied and forced by `Umar to leave Islam (Before`Umar himself embraced Islam). And if the mountain of Uhud were to collapse for the evil which youpeople had done to `Uthman, then Uhud would have the right to do so."" (See Hadith No. 202, Vol. 5)",حَدَّثَنَا سَعِيدُ بْنُ سُلَيْمَانَ، حَدَّثَنَا عَبَّادٌ، عَنْ إِسْمَاعِيلَ، سَمِعْتُ قَيْسًا، سَمِعْتُ سَعِيدَ بْنَ زَيْدٍ، يَقُولُ لَقَدْ رَأَيْتُنِي وَإِنَّ عُمَرَ مُوثِقِي عَلَى الإِسْلاَمِ، وَلَوِ انْقَضَّ أُحُدٌ مِمَّا فَعَلْتُمْ بِعُثْمَانَ كَانَ مَحْقُوقًا أَنْ يَنْقَضَّ‏.‏,حَدَّثَنَا سَعِيدُ بْنُ سُلَيْمَانَ، حَدَّثَنَا عَبَّادٌ، عَنْ إِسْمَاعِيلَ، سَمِعْتُ قَيْسًا، سَمِعْتُ سَعِيدَ بْنَ زَيْدٍ، يَقُولُ,لَقَدْ رَأَيْتُنِي وَإِنَّ عُمَرَ مُوثِقِي عَلَى الإِسْلاَمِ، وَلَوِ انْقَضَّ أُحُدٌ مِمَّا فَعَلْتُمْ بِعُثْمَانَ كَانَ مَحْقُوقًا أَنْ يَنْقَضَّ‏.‏,nan,Sahih-Authentic,صحيح
89.0,(Statements made under) Coercion,كتاب الإكراه,1.0,Whoever preferred to be beaten killed and humiliated rather than to revert to Kufr,مَنِ اخْتَارَ الضَّرْبَ وَالْقَتْلَ وَالْهَوَانَ عَلَى الْكُفْرِ,6943.0,"Narrated Khabbab bin Al-Art: We complained to Allah's Messenger (ﷺ) (about our state) while he was leaning against his sheet cloak in theshade of the Ka`ba. We said, ""Will you ask Allah to help us? Will you invoke Allah for us?"" He said,""Among those who were before you a (believer) used to be seized and, a pit used to be dug for himand then he used to be placed in it. Then a saw used to be brought and put on his head which would besplit into two halves. His flesh might be combed with iron combs and removed from his bones, yet, allthat did not cause him to revert from his religion. By Allah! This religion (Islam) will be completed(and triumph) till a rider (traveler) goes from San`a' (the capital of Yemen) to Hadramout fearingnobody except Allah and the wolf lest it should trouble his sheep, but you are impatient.""",Narrated Khabbab bin Al-Art:,"We complained to Allah's Messenger (ﷺ) (about our state) while he was leaning against his sheet cloak in theshade of the Ka`ba. We said, ""Will you ask Allah to help us? Will you invoke Allah for us?"" He said,""Among those who were before you a (believer) used to be seized and, a pit used to be dug for himand then he used to be placed in it. Then a saw used to be brought and put on his head which would besplit into two halves. His flesh might be combed with iron combs and removed from his bones, yet, allthat did not cause him to revert from his religion. By Allah! This religion (Islam) will be completed(and triumph) till a rider (traveler) goes from San`a' (the capital of Yemen) to Hadramout fearingnobody except Allah and the wolf lest it should trouble his sheep, but you are impatient.""",حَدَّثَنَا مُسَدَّدٌ، حَدَّثَنَا يَحْيَى، عَنْ إِسْمَاعِيلَ، حَدَّثَنَا قَيْسٌ، عَنْ خَبَّابِ بْنِ الأَرَتِّ، قَالَ شَكَوْنَا إِلَى رَسُولِ اللَّهِ صلى الله عليه وسلم وَهْوَ مُتَوَسِّدٌ بُرْدَةً لَهُ فِي ظِلِّ الْكَعْبَةِ فَقُلْنَا أَلاَ تَسْتَنْصِرُ لَنَا أَلاَ تَدْعُو لَنَا‏.‏ فَقَالَ ‏ ‏ قَدْ كَانَ مَنْ قَبْلَكُمْ يُؤْخَذُ الرَّجُلُ فَيُحْفَرُ لَهُ فِي الأَرْضِ فَيُجْعَلُ فِيهَا، فَيُجَاءُ بِالْمِنْشَارِ فَيُوضَعُ عَلَى رَأْسِهِ فَيُجْعَلُ نِصْفَيْنِ، وَيُمَشَّطُ بِأَمْشَاطِ الْحَدِيدِ مَا دُونَ لَحْمِهِ وَعَظْمِهِ، فَمَا يَصُدُّهُ ذَلِكَ عَنْ دِينِهِ، وَاللَّهِ لَيَتِمَّنَّ هَذَا الأَمْرُ، حَتَّى يَسِيرَ الرَّاكِبُ مِنْ صَنْعَاءَ إِلَى حَضْرَمَوْتَ لاَ يَخَافُ إِلاَّ اللَّهَ وَالذِّئْبَ عَلَى غَنَمِهِ، وَلَكِنَّكُمْ تَسْتَعْجِلُونَ ‏‏‏.‏,حَدَّثَنَا مُسَدَّدٌ، حَدَّثَنَا يَحْيَى، عَنْ إِسْمَاعِيلَ، حَدَّثَنَا قَيْسٌ، عَنْ خَبَّابِ بْنِ الأَرَتِّ، قَالَ,شَكَوْنَا إِلَى رَسُولِ اللَّهِ صلى الله عليه وسلم وَهْوَ مُتَوَسِّدٌ بُرْدَةً لَهُ فِي ظِلِّ الْكَعْبَةِ فَقُلْنَا أَلاَ تَسْتَنْصِرُ لَنَا أَلاَ تَدْعُو لَنَا‏.‏ فَقَالَ ‏ ‏ قَدْ كَانَ مَنْ قَبْلَكُمْ يُؤْخَذُ الرَّجُلُ فَيُحْفَرُ لَهُ فِي الأَرْضِ فَيُجْعَلُ فِيهَا، فَيُجَاءُ بِالْمِنْشَارِ فَيُوضَعُ عَلَى رَأْسِهِ فَيُجْعَلُ نِصْفَيْنِ، وَيُمَشَّطُ بِأَمْشَاطِ الْحَدِيدِ مَا دُونَ لَحْمِهِ وَعَظْمِهِ، فَمَا يَصُدُّهُ ذَلِكَ عَنْ دِينِهِ، وَاللَّهِ لَيَتِمَّنَّ هَذَا الأَمْرُ، حَتَّى يَسِيرَ الرَّاكِبُ مِنْ صَنْعَاءَ إِلَى حَضْرَمَوْتَ لاَ يَخَافُ إِلاَّ اللَّهَ وَالذِّئْبَ عَلَى غَنَمِهِ، وَلَكِنَّكُمْ تَسْتَعْجِلُونَ ‏‏‏.‏,nan,Sahih-Authentic,صحيح
89.0,(Statements made under) Coercion,كتاب الإكراه,2.0,Selling under coercion or other circumstances to repay a debt or the like,فِي بَيْعِ الْمُكْرَهِ وَنَحْوِهِ فِي الْحَقِّ وَغَيْرِهِ,6944.0,"Narrated Abu Huraira: While we were in the mosque, Allah's Messenger (ﷺ) came out to us and said, ""Let us proceed to the Jews.""So we went along with him till we reached Bait-al-Midras (a place where the Torah used to be recitedand all the Jews of the town used to gather). The Prophet (ﷺ) stood up and addressed them, ""O Assemblyof Jews! Embrace Islam and you will be safe!"" The Jews replied, ""O Aba-l-Qasim! You haveconveyed Allah's message to us."" The Prophet (ﷺ) said, ""That is what I want (from you)."" He repeated hisfirst statement for the second time, and they said, ""You have conveyed Allah's message, O Aba-l-Qasim."" Then he said it for the third time and added, ""You should Know that the earth belongs toAllah and His Apostle, and I want to exile you fro,,, this land, so whoever among you owns someproperty, can sell it, otherwise you should know that the Earth belongs to Allah and His Apostle.""",Narrated Abu Huraira:,"While we were in the mosque, Allah's Messenger (ﷺ) came out to us and said, ""Let us proceed to the Jews.""So we went along with him till we reached Bait-al-Midras (a place where the Torah used to be recitedand all the Jews of the town used to gather). The Prophet (ﷺ) stood up and addressed them, ""O Assemblyof Jews! Embrace Islam and you will be safe!"" The Jews replied, ""O Aba-l-Qasim! You haveconveyed Allah's message to us."" The Prophet (ﷺ) said, ""That is what I want (from you)."" He repeated hisfirst statement for the second time, and they said, ""You have conveyed Allah's message, O Aba-l-Qasim."" Then he said it for the third time and added, ""You should Know that the earth belongs toAllah and His Apostle, and I want to exile you fro,,, this land, so whoever among you owns someproperty, can sell it, otherwise you should know that the Earth belongs to Allah and His Apostle.""","حَدَّثَنَا عَبْدُ الْعَزِيزِ بْنُ عَبْدِ اللَّهِ، حَدَّثَنَا اللَّيْثُ، عَنْ سَعِيدٍ الْمَقْبُرِيِّ، عَنْ أَبِيهِ، عَنْ أَبِي هُرَيْرَةَ ـ رضى الله عنه ـ قَالَ بَيْنَمَا نَحْنُ فِي الْمَسْجِدِ إِذْ خَرَجَ عَلَيْنَا رَسُولُ اللَّهِ صلى الله عليه وسلم فَقَالَ ‏""‏ انْطَلِقُوا إِلَى يَهُودَ ‏""‏‏.‏ فَخَرَجْنَا مَعَهُ حَتَّى جِئْنَا بَيْتَ الْمِدْرَاسِ فَقَامَ النَّبِيُّ صلى الله عليه وسلم فَنَادَاهُمْ ‏""‏ يَا مَعْشَرَ يَهُودَ أَسْلِمُوا تَسْلَمُوا ‏""‏‏.‏ فَقَالُوا قَدْ بَلَّغْتَ يَا أَبَا الْقَاسِمِ‏.‏ فَقَالَ ‏""‏ ذَلِكَ أُرِيدُ ‏""‏، ثُمَّ قَالَهَا الثَّانِيَةَ‏.‏ فَقَالُوا قَدْ بَلَّغْتَ يَا أَبَا الْقَاسِمِ‏.‏ ثُمَّ قَالَ الثَّالِثَةَ فَقَالَ ‏""‏ اعْلَمُوا أَنَّ الأَرْضَ لِلَّهِ وَرَسُولِهِ، وَإِنِّي أُرِيدُ أَنْ أُجْلِيَكُمْ، فَمَنْ وَجَدَ مِنْكُمْ بِمَالِهِ شَيْئًا فَلْيَبِعْهُ، وَإِلاَّ فَاعْلَمُوا أَنَّمَا الأَرْضُ لِلَّهِ وَرَسُولِهِ ‏""‏‏.‏",حَدَّثَنَا عَبْدُ الْعَزِيزِ بْنُ عَبْدِ اللَّهِ، حَدَّثَنَا اللَّيْثُ، عَنْ سَعِيدٍ الْمَقْبُرِيِّ، عَنْ أَبِيهِ، عَنْ أَبِي هُرَيْرَةَ ـ رضى الله عنه ـ قَالَ,"بَيْنَمَا نَحْنُ فِي الْمَسْجِدِ إِذْ خَرَجَ عَلَيْنَا رَسُولُ اللَّهِ صلى الله عليه وسلم فَقَالَ ‏""‏ انْطَلِقُوا إِلَى يَهُودَ ‏""‏‏.‏ فَخَرَجْنَا مَعَهُ حَتَّى جِئْنَا بَيْتَ الْمِدْرَاسِ فَقَامَ النَّبِيُّ صلى الله عليه وسلم فَنَادَاهُمْ ‏""‏ يَا مَعْشَرَ يَهُودَ أَسْلِمُوا تَسْلَمُوا ‏""‏‏.‏ فَقَالُوا قَدْ بَلَّغْتَ يَا أَبَا الْقَاسِمِ‏.‏ فَقَالَ ‏""‏ ذَلِكَ أُرِيدُ ‏""‏، ثُمَّ قَالَهَا الثَّانِيَةَ‏.‏ فَقَالُوا قَدْ بَلَّغْتَ يَا أَبَا الْقَاسِمِ‏.‏ ثُمَّ قَالَ الثَّالِثَةَ فَقَالَ ‏""‏ اعْلَمُوا أَنَّ الأَرْضَ لِلَّهِ وَرَسُولِهِ، وَإِنِّي أُرِيدُ أَنْ أُجْلِيَكُمْ، فَمَنْ وَجَدَ مِنْكُمْ بِمَالِهِ شَيْئًا فَلْيَبِعْهُ، وَإِلاَّ فَاعْلَمُوا أَنَّمَا الأَرْضُ لِلَّهِ وَرَسُولِهِ ‏""‏‏.‏",nan,Sahih-Authentic,صحيح
89.0,(Statements made under) Coercion,كتاب الإكراه,3.0,Marriage under coercion is invalid,لاَ يَجُوزُ نِكَاحُ الْمُكْرَهِ,6945.0,Narrated Khansa' bint Khidam Al-Ansariya: That her father gave her in marriage when she was a matron and she disliked that marriage. So shecame and (complained) to the Prophets and he declared that marriage invalid.,Narrated Khansa' bint Khidam Al-Ansariya:,That her father gave her in marriage when she was a matron and she disliked that marriage. So shecame and (complained) to the Prophets and he declared that marriage invalid.,حَدَّثَنَا يَحْيَى بْنُ قَزَعَةَ، حَدَّثَنَا مَالِكٌ، عَنْ عَبْدِ الرَّحْمَنِ بْنِ الْقَاسِمِ، عَنْ أَبِيهِ، عَنْ عَبْدِ الرَّحْمَنِ، وَمُجَمِّعٍ، ابْنَىْ يَزِيدَ بْنِ جَارِيَةَ الأَنْصَارِيِّ عَنْ خَنْسَاءَ بِنْتِ خِذَامٍ الأَنْصَارِيَّةِ، أَنَّ أَبَاهَا، زَوَّجَهَا وَهْىَ ثَيِّبٌ، فَكَرِهَتْ ذَلِكَ، فَأَتَتِ النَّبِيَّ صلى الله عليه وسلم فَرَدَّ نِكَاحَهَا‏.‏,حَدَّثَنَا يَحْيَى بْنُ قَزَعَةَ، حَدَّثَنَا مَالِكٌ، عَنْ عَبْدِ الرَّحْمَنِ بْنِ الْقَاسِمِ، عَنْ أَبِيهِ، عَنْ عَبْدِ الرَّحْمَنِ، وَمُجَمِّعٍ، ابْنَىْ يَزِيدَ بْنِ جَارِيَةَ الأَنْصَارِيِّ عَنْ خَنْسَاءَ بِنْتِ خِذَامٍ الأَنْصَارِيَّةِ،,أَنَّ أَبَاهَا، زَوَّجَهَا وَهْىَ ثَيِّبٌ، فَكَرِهَتْ ذَلِكَ، فَأَتَتِ النَّبِيَّ صلى الله عليه وسلم فَرَدَّ نِكَاحَهَا‏.‏,nan,Sahih-Authentic,صحيح
89.0,(Statements made under) Coercion,كتاب الإكراه,3.0,Marriage under coercion is invalid,لاَ يَجُوزُ نِكَاحُ الْمُكْرَهِ,6946.0,"Narrated `Aisha: I asked the Prophet, ""O Allah's Messenger (ﷺ)! Should the women be asked for their consent to theirmarriage?"" He said, ""Yes."" I said, ""A virgin, if asked, feels shy and keeps quiet."" He said, ""Her silencemeans her consent.""",Narrated `Aisha:,"I asked the Prophet, ""O Allah's Messenger (ﷺ)! Should the women be asked for their consent to theirmarriage?"" He said, ""Yes."" I said, ""A virgin, if asked, feels shy and keeps quiet."" He said, ""Her silencemeans her consent.""","حَدَّثَنَا مُحَمَّدُ بْنُ يُوسُفَ، حَدَّثَنَا سُفْيَانُ، عَنِ ابْنِ جُرَيْجٍ، عَنِ ابْنِ أَبِي مُلَيْكَةَ، عَنْ أَبِي عَمْرٍو ـ هُوَ ذَكْوَانُ ـ عَنْ عَائِشَةَ ـ رضى الله عنها ـ قَالَتْ قُلْتُ يَا رَسُولَ اللَّهِ يُسْتَأْمَرُ النِّسَاءُ فِي أَبْضَاعِهِنَّ قَالَ ‏""‏ نَعَمْ ‏""‏‏.‏ قُلْتُ فَإِنَّ الْبِكْرَ تُسْتَأْمَرُ فَتَسْتَحِي فَتَسْكُتُ‏.‏ قَالَ ‏""‏ سُكَاتُهَا إِذْنُهَا ‏""‏‏.‏",حَدَّثَنَا مُحَمَّدُ بْنُ يُوسُفَ، حَدَّثَنَا سُفْيَانُ، عَنِ ابْنِ جُرَيْجٍ، عَنِ ابْنِ أَبِي مُلَيْكَةَ، عَنْ أَبِي عَمْرٍو ـ هُوَ ذَكْوَانُ ـ عَنْ عَائِشَةَ ـ رضى الله عنها ـ قَالَتْ,"قُلْتُ يَا رَسُولَ اللَّهِ يُسْتَأْمَرُ النِّسَاءُ فِي أَبْضَاعِهِنَّ قَالَ ‏""‏ نَعَمْ ‏""‏‏.‏ قُلْتُ فَإِنَّ الْبِكْرَ تُسْتَأْمَرُ فَتَسْتَحِي فَتَسْكُتُ‏.‏ قَالَ ‏""‏ سُكَاتُهَا إِذْنُهَا ‏""‏‏.‏",nan,Sahih-Authentic,صحيح
89.0,(Statements made under) Coercion,كتاب الإكراه,4.0," If someone gives a slave as a present or sold him under coercion, his deed is invalid",إِذَا أُكْرِهَ حَتَّى وَهَبَ عَبْدًا أَوْ بَاعَهُ لَمْ يَجُزْ,6947.0,"Narrated Jabir: A man from the Ansar made his slave, a Mudabbar. And apart from that slave he did not have anyother property. This news reached Allah's Messenger (ﷺ) and he said, ""Who will buy that slave from me?"" SoNu'aim bin An-Nahham bought him for 800 Dirham. Jabir added: It was a coptic (Egyptian) slavewho died that year.",Narrated Jabir:,"A man from the Ansar made his slave, a Mudabbar. And apart from that slave he did not have anyother property. This news reached Allah's Messenger (ﷺ) and he said, ""Who will buy that slave from me?"" SoNu'aim bin An-Nahham bought him for 800 Dirham. Jabir added: It was a coptic (Egyptian) slavewho died that year.",حَدَّثَنَا أَبُو النُّعْمَانِ، حَدَّثَنَا حَمَّادُ بْنُ زَيْدٍ، عَنْ عَمْرِو بْنِ دِينَارٍ، عَنْ جَابِرٍ ـ رضى الله عنه ـ أَنَّ رَجُلاً، مِنَ الأَنْصَارِ دَبَّرَ مَمْلُوكًا، وَلَمْ يَكُنْ لَهُ مَالٌ غَيْرُهُ، فَبَلَغَ ذَلِكَ رَسُولَ اللَّهِ صلى الله عليه وسلم فَقَالَ ‏ ‏ مَنْ يَشْتَرِيهِ مِنِّي ‏‏‏.‏ فَاشْتَرَاهُ نُعَيْمُ بْنُ النَّحَّامِ بِثَمَانِمِائَةِ دِرْهَمٍ‏.‏ قَالَ فَسَمِعْتُ جَابِرًا يَقُولُ عَبْدًا قِبْطِيًّا مَاتَ عَامَ أَوَّلَ‏.‏,حَدَّثَنَا أَبُو النُّعْمَانِ، حَدَّثَنَا حَمَّادُ بْنُ زَيْدٍ، عَنْ عَمْرِو بْنِ دِينَارٍ، عَنْ جَابِرٍ ـ رضى الله عنه ـ أَنَّ,رَجُلاً، مِنَ الأَنْصَارِ دَبَّرَ مَمْلُوكًا، وَلَمْ يَكُنْ لَهُ مَالٌ غَيْرُهُ، فَبَلَغَ ذَلِكَ رَسُولَ اللَّهِ صلى الله عليه وسلم فَقَالَ ‏ ‏ مَنْ يَشْتَرِيهِ مِنِّي ‏‏‏.‏ فَاشْتَرَاهُ نُعَيْمُ بْنُ النَّحَّامِ بِثَمَانِمِائَةِ دِرْهَمٍ‏.‏ قَالَ فَسَمِعْتُ جَابِرًا يَقُولُ عَبْدًا قِبْطِيًّا مَاتَ عَامَ أَوَّلَ‏.‏,nan,Sahih-Authentic,صحيح
