Chapter_Number,Chapter_English,Chapter_Arabic,Section_Number,Section_English,Section_Arabic,Hadith_number,English_Hadith,English_Isnad,English_Matn,Arabic_Hadith,Arabic_Isnad,Arabic_Matn,Arabic_Comment,English_Grade,Arabic_Grade
53.0,Peacemaking,كتاب الصلح,7.0,To make peace with Al-Mushrikun,الصُّلْحِ مَعَ الْمُشْرِكِينَ,2700,"Narrated Al-Bara' bin 'Azib (ra): On the day of Hudaibiya, the Prophet (ﷺ), the Prophet (ﷺ) made a peace treaty with the Al-Mushrikun on three conditions:1. The Prophet (ﷺ) would return to them any person from Al-Mushrikun (polytheists, idolaters, pagans). 2. Al-Mushrikun pagans would not return any of the Muslims going to them, and3. The Prophet (ﷺ) and his companions would come to Makkah the following year and would stay there for three days and would enter with their weapons in cases, e.g., swords, arrows, bows, etc.Abu Jandal came hopping, his legs being chained, but the Prophet (ﷺ) returned him to Al-Mushrikun.",Narrated Al-Bara' bin 'Azib (ra):,"On the day of Hudaibiya, the Prophet (ﷺ), the Prophet (ﷺ) made a peace treaty with the Al-Mushrikun on three conditions:1. The Prophet (ﷺ) would return to them any person from Al-Mushrikun (polytheists, idolaters, pagans). 2. Al-Mushrikun pagans would not return any of the Muslims going to them, and3. The Prophet (ﷺ) and his companions would come to Makkah the following year and would stay there for three days and would enter with their weapons in cases, e.g., swords, arrows, bows, etc.Abu Jandal came hopping, his legs being chained, but the Prophet (ﷺ) returned him to Al-Mushrikun.",وَقَالَ مُوسَى بْنُ مَسْعُودٍ حَدَّثَنَا سُفْيَانُ بْنُ سَعِيدٍ، عَنْ أَبِي إِسْحَاقَ، عَنِ الْبَرَاءِ بْنِ عَازِبٍ ـ رضى الله عنهما ـ قَالَ صَالَحَ النَّبِيُّ صلى الله عليه وسلم الْمُشْرِكِينَ يَوْمَ الْحُدَيْبِيَةِ عَلَى ثَلاَثَةِ أَشْيَاءَ عَلَى أَنَّ مَنْ أَتَاهُ مِنَ الْمُشْرِكِينَ رَدَّهُ إِلَيْهِمْ، وَمَنْ أَتَاهُمْ مِنَ الْمُسْلِمِينَ لَمْ يَرُدُّوهُ، وَعَلَى أَنْ يَدْخُلَهَا مِنْ قَابِلٍ وَيُقِيمَ بِهَا ثَلاَثَةَ أَيَّامٍ، وَلاَ يَدْخُلَهَا إِلاَّ بِجُلُبَّانِ السِّلاَحِ السَّيْفِ وَالْقَوْسِ وَنَحْوِهِ‏.‏ فَجَاءَ أَبُو جَنْدَلٍ يَحْجُلُ فِي قُيُودِهِ فَرَدَّهُ إِلَيْهِمْ‏.‏ قَالَ لَمْ يَذْكُرْ مُؤَمَّلٌ عَنْ سُفْيَانَ أَبَا جَنْدَلٍ وَقَالَ إِلاَّ بِجُلُبِّ السِّلاَحِ‏.‏,وَقَالَ مُوسَى بْنُ مَسْعُودٍ حَدَّثَنَا سُفْيَانُ بْنُ سَعِيدٍ، عَنْ أَبِي إِسْحَاقَ، عَنِ الْبَرَاءِ بْنِ عَازِبٍ ـ رضى الله عنهما ـ قَالَ,صَالَحَ النَّبِيُّ صلى الله عليه وسلم الْمُشْرِكِينَ يَوْمَ الْحُدَيْبِيَةِ عَلَى ثَلاَثَةِ أَشْيَاءَ عَلَى أَنَّ مَنْ أَتَاهُ مِنَ الْمُشْرِكِينَ رَدَّهُ إِلَيْهِمْ، وَمَنْ أَتَاهُمْ مِنَ الْمُسْلِمِينَ لَمْ يَرُدُّوهُ، وَعَلَى أَنْ يَدْخُلَهَا مِنْ قَابِلٍ وَيُقِيمَ بِهَا ثَلاَثَةَ أَيَّامٍ، وَلاَ يَدْخُلَهَا إِلاَّ بِجُلُبَّانِ السِّلاَحِ السَّيْفِ وَالْقَوْسِ وَنَحْوِهِ‏.‏ فَجَاءَ أَبُو جَنْدَلٍ يَحْجُلُ فِي قُيُودِهِ فَرَدَّهُ إِلَيْهِمْ‏.‏ قَالَ لَمْ يَذْكُرْ مُؤَمَّلٌ عَنْ سُفْيَانَ أَبَا جَنْدَلٍ وَقَالَ إِلاَّ بِجُلُبِّ السِّلاَحِ‏.‏,nan,Sahih-Authentic,صحيح
53.0,Peacemaking,كتاب الصلح,7.0,To make peace with Al-Mushrikun,الصُّلْحِ مَعَ الْمُشْرِكِينَ,2701,"Narrated Ibn `Umar: Allah's Messenger (ﷺ) set out for the `Umra but the pagans of Quraish prevented him from reaching theKa`ba. So, he slaughtered his sacrifice and got his head shaved at Al-Hudaibiya, and agreed with themthat he would perform `Umra the following year and would not carry weapons except swords andwould not stay in Mecca except for the period they allowed. So, the Prophet (ﷺ) performed the `Umra inthe following year and entered Mecca according to the treaty, and when he stayed for three days, thepagans ordered him to depart, and he departed.",Narrated Ibn `Umar:,"Allah's Messenger (ﷺ) set out for the `Umra but the pagans of Quraish prevented him from reaching theKa`ba. So, he slaughtered his sacrifice and got his head shaved at Al-Hudaibiya, and agreed with themthat he would perform `Umra the following year and would not carry weapons except swords andwould not stay in Mecca except for the period they allowed. So, the Prophet (ﷺ) performed the `Umra inthe following year and entered Mecca according to the treaty, and when he stayed for three days, thepagans ordered him to depart, and he departed.",حَدَّثَنَا مُحَمَّدُ بْنُ رَافِعٍ، حَدَّثَنَا سُرَيْجُ بْنُ النُّعْمَانِ، حَدَّثَنَا فُلَيْحٌ، عَنْ نَافِعٍ، عَنِ ابْنِ عُمَرَ، رضى الله عنهما أَنَّ رَسُولَ اللَّهِ صلى الله عليه وسلم خَرَجَ مُعْتَمِرًا، فَحَالَ كُفَّارُ قُرَيْشٍ بَيْنَهُ وَبَيْنَ الْبَيْتِ، فَنَحَرَ هَدْيَهُ، وَحَلَقَ رَأْسَهُ بِالْحُدَيْبِيَةِ، وَقَاضَاهُمْ عَلَى أَنْ يَعْتَمِرَ الْعَامَ الْمُقْبِلَ، وَلاَ يَحْمِلَ سِلاَحًا عَلَيْهِمْ إِلاَّ سُيُوفًا، وَلاَ يُقِيمَ بِهَا إِلاَّ مَا أَحَبُّوا، فَاعْتَمَرَ مِنَ الْعَامِ الْمُقْبِلِ فَدَخَلَهَا كَمَا كَانَ صَالَحَهُمْ، فَلَمَّا أَقَامَ بِهَا ثَلاَثًا أَمَرُوهُ أَنْ يَخْرُجَ فَخَرَجَ‏.‏,حَدَّثَنَا مُحَمَّدُ بْنُ رَافِعٍ، حَدَّثَنَا سُرَيْجُ بْنُ النُّعْمَانِ، حَدَّثَنَا فُلَيْحٌ، عَنْ نَافِعٍ، عَنِ ابْنِ عُمَرَ، رضى الله عنهما,أَنَّ رَسُولَ اللَّهِ صلى الله عليه وسلم خَرَجَ مُعْتَمِرًا، فَحَالَ كُفَّارُ قُرَيْشٍ بَيْنَهُ وَبَيْنَ الْبَيْتِ، فَنَحَرَ هَدْيَهُ، وَحَلَقَ رَأْسَهُ بِالْحُدَيْبِيَةِ، وَقَاضَاهُمْ عَلَى أَنْ يَعْتَمِرَ الْعَامَ الْمُقْبِلَ، وَلاَ يَحْمِلَ سِلاَحًا عَلَيْهِمْ إِلاَّ سُيُوفًا، وَلاَ يُقِيمَ بِهَا إِلاَّ مَا أَحَبُّوا، فَاعْتَمَرَ مِنَ الْعَامِ الْمُقْبِلِ فَدَخَلَهَا كَمَا كَانَ صَالَحَهُمْ، فَلَمَّا أَقَامَ بِهَا ثَلاَثًا أَمَرُوهُ أَنْ يَخْرُجَ فَخَرَجَ‏.‏,nan,Sahih-Authentic,صحيح
53.0,Peacemaking,كتاب الصلح,7.0,To make peace with Al-Mushrikun,الصُّلْحِ مَعَ الْمُشْرِكِينَ,2702,Narrated Sahl bin Abu Hathma: `Abdullah bin Sahl and Muhaiyisa bin Mas`ud bin Zaid went to Khaibar when it had a peace treaty(with the Muslims).,Narrated Sahl bin Abu Hathma:,`Abdullah bin Sahl and Muhaiyisa bin Mas`ud bin Zaid went to Khaibar when it had a peace treaty(with the Muslims).,حَدَّثَنَا مُسَدَّدٌ، حَدَّثَنَا بِشْرٌ، حَدَّثَنَا يَحْيَى، عَنْ بُشَيْرِ بْنِ يَسَارٍ، عَنْ سَهْلِ بْنِ أَبِي حَثْمَةَ، قَالَ انْطَلَقَ عَبْدُ اللَّهِ بْنُ سَهْلٍ وَمُحَيِّصَةُ بْنُ مَسْعُودِ بْنِ زَيْدٍ إِلَى خَيْبَرَ، وَهْىَ يَوْمَئِذٍ صُلْحٌ‏.‏,حَدَّثَنَا مُسَدَّدٌ، حَدَّثَنَا بِشْرٌ، حَدَّثَنَا يَحْيَى، عَنْ بُشَيْرِ بْنِ يَسَارٍ، عَنْ سَهْلِ بْنِ أَبِي حَثْمَةَ، قَالَ,انْطَلَقَ عَبْدُ اللَّهِ بْنُ سَهْلٍ وَمُحَيِّصَةُ بْنُ مَسْعُودِ بْنِ زَيْدٍ إِلَى خَيْبَرَ، وَهْىَ يَوْمَئِذٍ صُلْحٌ‏.‏,nan,Sahih-Authentic,صحيح
53.0,Peacemaking,كتاب الصلح,8.0,Agreement about Diya (blood money),الصُّلْحِ فِي الدِّيَةِ,2703,"Narrated Anas: Ar-Rabi, the daughter of An-Nadr broke the tooth of a girl, and the relatives of Ar-Rabi` requested thegirl's relatives to accept the Irsh (compensation for wounds etc.) and forgive (the offender), but theyrefused. So, they went to the Prophet (ﷺ) who ordered them to bring about retaliation. Anas bin An-Nadrasked, ""O Allah""; Apostle! Will the tooth of Ar-Rabi` be broken? No, by Him Who has sent you withthe Truth, her tooth will not be broken."" The Prophet (ﷺ) said, ""O Anas! Allah""; law ordains retaliation.""Later the relatives of the girl agreed and forgave her. The Prophet (ﷺ) said, ""There are some of Allah'sslaves who, if they take an oath by Allah, are responded to by Allah i.e. their oath is fulfilled). Anasadded, ""The people agreed and accepted the Irsh.""",Narrated Anas:,"Ar-Rabi, the daughter of An-Nadr broke the tooth of a girl, and the relatives of Ar-Rabi` requested thegirl's relatives to accept the Irsh (compensation for wounds etc.) and forgive (the offender), but theyrefused. So, they went to the Prophet (ﷺ) who ordered them to bring about retaliation. Anas bin An-Nadrasked, ""O Allah""; Apostle! Will the tooth of Ar-Rabi` be broken? No, by Him Who has sent you withthe Truth, her tooth will not be broken."" The Prophet (ﷺ) said, ""O Anas! Allah""; law ordains retaliation.""Later the relatives of the girl agreed and forgave her. The Prophet (ﷺ) said, ""There are some of Allah'sslaves who, if they take an oath by Allah, are responded to by Allah i.e. their oath is fulfilled). Anasadded, ""The people agreed and accepted the Irsh.""","حَدَّثَنَا مُحَمَّدُ بْنُ عَبْدِ اللَّهِ الأَنْصَارِيُّ، قَالَ حَدَّثَنِي حُمَيْدٌ، أَنَّ أَنَسًا، حَدَّثَهُمْ أَنَّ الرُّبَيِّعَ ـ وَهْىَ ابْنَةُ النَّضْرِ ـ كَسَرَتْ ثَنِيَّةَ جَارِيَةٍ، فَطَلَبُوا الأَرْشَ وَطَلَبُوا الْعَفْوَ، فَأَبَوْا فَأَتَوُا النَّبِيَّ صلى الله عليه وسلم فَأَمَرَهُمْ بِالْقِصَاصِ‏.‏ فَقَالَ أَنَسُ بْنُ النَّضْرِ أَتُكْسَرُ ثَنِيَّةُ الرُّبَيِّعِ يَا رَسُولَ اللَّهِ لاَ وَالَّذِي بَعَثَكَ بِالْحَقِّ لاَ تُكْسَرُ ثَنِيَّتُهَا فَقَالَ ‏""‏ يَا أَنَسُ كِتَابُ اللَّهِ الْقِصَاصُ ‏""‏‏.‏ فَرَضِيَ الْقَوْمُ وَعَفَوْا فَقَالَ النَّبِيُّ صلى الله عليه وسلم ‏""‏ إِنَّ مِنْ عِبَادِ اللَّهِ مَنْ لَوْ أَقْسَمَ عَلَى اللَّهِ لأَبَرَّهُ ‏""‏‏.‏ زَادَ الْفَزَارِيُّ عَنْ حُمَيْدٍ عَنْ أَنَسٍ فَرَضِيَ الْقَوْمُ وَقَبِلُوا الأَرْشَ‏.‏",حَدَّثَنَا مُحَمَّدُ بْنُ عَبْدِ اللَّهِ الأَنْصَارِيُّ، قَالَ حَدَّثَنِي حُمَيْدٌ، أَنَّ أَنَسًا، حَدَّثَهُمْ,"أَنَّ الرُّبَيِّعَ ـ وَهْىَ ابْنَةُ النَّضْرِ ـ كَسَرَتْ ثَنِيَّةَ جَارِيَةٍ، فَطَلَبُوا الأَرْشَ وَطَلَبُوا الْعَفْوَ، فَأَبَوْا فَأَتَوُا النَّبِيَّ صلى الله عليه وسلم فَأَمَرَهُمْ بِالْقِصَاصِ‏.‏ فَقَالَ أَنَسُ بْنُ النَّضْرِ أَتُكْسَرُ ثَنِيَّةُ الرُّبَيِّعِ يَا رَسُولَ اللَّهِ لاَ وَالَّذِي بَعَثَكَ بِالْحَقِّ لاَ تُكْسَرُ ثَنِيَّتُهَا فَقَالَ ‏""‏ يَا أَنَسُ كِتَابُ اللَّهِ الْقِصَاصُ ‏""‏‏.‏ فَرَضِيَ الْقَوْمُ وَعَفَوْا فَقَالَ النَّبِيُّ صلى الله عليه وسلم ‏""‏ إِنَّ مِنْ عِبَادِ اللَّهِ مَنْ لَوْ أَقْسَمَ عَلَى اللَّهِ لأَبَرَّهُ ‏""‏‏.‏ زَادَ الْفَزَارِيُّ عَنْ حُمَيْدٍ عَنْ أَنَسٍ فَرَضِيَ الْقَوْمُ وَقَبِلُوا الأَرْشَ‏.‏",nan,Sahih-Authentic,صحيح
53.0,Peacemaking,كتاب الصلح,9.0," ""This son of mine is Sayyid.""",قَوْلُ النَّبِيِّ صَلَّى اللَّهُ عَلَيْهِ وَسَلَّمَ لِلْحَسَنِ بْنِ عَلِيٍّ رَضِيَ اللَّهُ عَنْهُمَا: «ابْنِي هَذَا سَيِّدٌ، وَلَعَلَّ اللَّهَ أَنْ يُصْلِحَ بِهِ بَيْنَ فِئَتَيْنِ عَظِيمَتَيْنِ»,2704,"Narrated Al-Hasan Al-Basri: By Allah, Al-Hasan bin `Ali led large battalions like mountains against Muawiya. `Amr bin Al-Assaid (to Muawiya), ""I surely see battalions which will not turn back before killing their opponents.""Muawiya who was really the best of the two men said to him, ""O `Amr! If these killed those and thosekilled these, who would be left with me for the jobs of the public, who would be left with me for theirwomen, who would be left with me for their children?"" Then Muawiya sent two Quraishi men fromthe tribe of `Abd-i-Shams called `Abdur Rahman bin Sumura and `Abdullah bin 'Amir bin Kuraiz toAl-Hasan saying to them, ""Go to this man (i.e. Al-Hasan) and negotiate peace with him and talk andappeal to him."" So, they went to Al-Hasan and talked and appealed to him to accept peace. Al-Hasansaid, ""We, the offspring of `Abdul Muttalib, have got wealth and people have indulged in killing andcorruption (and money only will appease them)."" They said to Al-Hasan, ""Muawiya offers you so andso, and appeals to you and entreats you to accept peace."" Al-Hasan said to them, ""But who will beresponsible for what you have said?"" They said, ""We will be responsible for it."" So, whatever Al-Hasan asked they said, ""We will be responsible for it for you."" So, Al-Hasan concluded a peace treatywith Muawiya. Al-Hasan (Al-Basri) said: I heard Abu Bakr saying, ""I saw Allah's Messenger (ﷺ) on thepulpit and Al-Hasan bin `Ali was by his side. The Prophet (ﷺ) was looking once at the people and once atAl-Hasan bin `Ali saying, 'This son of mine is a Saiyid (i.e. a noble) and may Allah make peacebetween two big groups of Muslims through him.""",Narrated Al-Hasan Al-Basri:,"By Allah, Al-Hasan bin `Ali led large battalions like mountains against Muawiya. `Amr bin Al-Assaid (to Muawiya), ""I surely see battalions which will not turn back before killing their opponents.""Muawiya who was really the best of the two men said to him, ""O `Amr! If these killed those and thosekilled these, who would be left with me for the jobs of the public, who would be left with me for theirwomen, who would be left with me for their children?"" Then Muawiya sent two Quraishi men fromthe tribe of `Abd-i-Shams called `Abdur Rahman bin Sumura and `Abdullah bin 'Amir bin Kuraiz toAl-Hasan saying to them, ""Go to this man (i.e. Al-Hasan) and negotiate peace with him and talk andappeal to him."" So, they went to Al-Hasan and talked and appealed to him to accept peace. Al-Hasansaid, ""We, the offspring of `Abdul Muttalib, have got wealth and people have indulged in killing andcorruption (and money only will appease them)."" They said to Al-Hasan, ""Muawiya offers you so andso, and appeals to you and entreats you to accept peace."" Al-Hasan said to them, ""But who will beresponsible for what you have said?"" They said, ""We will be responsible for it."" So, whatever Al-Hasan asked they said, ""We will be responsible for it for you."" So, Al-Hasan concluded a peace treatywith Muawiya. Al-Hasan (Al-Basri) said: I heard Abu Bakr saying, ""I saw Allah's Messenger (ﷺ) on thepulpit and Al-Hasan bin `Ali was by his side. The Prophet (ﷺ) was looking once at the people and once atAl-Hasan bin `Ali saying, 'This son of mine is a Saiyid (i.e. a noble) and may Allah make peacebetween two big groups of Muslims through him.""",حَدَّثَنَا عَبْدُ اللَّهِ بْنُ مُحَمَّدٍ، حَدَّثَنَا سُفْيَانُ، عَنْ أَبِي مُوسَى، قَالَ سَمِعْتُ الْحَسَنَ، يَقُولُ اسْتَقْبَلَ وَاللَّهِ الْحَسَنُ بْنُ عَلِيٍّ مُعَاوِيَةَ بِكَتَائِبَ أَمْثَالِ الْجِبَالِ فَقَالَ عَمْرُو بْنُ الْعَاصِ إِنِّي لأَرَى كَتَائِبَ لاَ تُوَلِّي حَتَّى تَقْتُلَ أَقْرَانَهَا‏.‏ فَقَالَ لَهُ مُعَاوِيَةُ ـ وَكَانَ وَاللَّهِ خَيْرَ الرَّجُلَيْنِ ـ أَىْ عَمْرُو إِنْ قَتَلَ هَؤُلاَءِ هَؤُلاَءِ وَهَؤُلاَءِ هَؤُلاَءِ مَنْ لِي بِأُمُورِ النَّاسِ مَنْ لِي بِنِسَائِهِمْ، مَنْ لِي بِضَيْعَتِهِمْ فَبَعَثَ إِلَيْهِ رَجُلَيْنِ مِنْ قُرَيْشٍ مِنْ بَنِي عَبْدِ شَمْسٍ عَبْدَ الرَّحْمَنِ بْنَ سَمُرَةَ وَعَبْدَ اللَّهِ بْنَ عَامِرِ بْنِ كُرَيْزٍ، فَقَالَ اذْهَبَا إِلَى هَذَا الرَّجُلِ فَاعْرِضَا عَلَيْهِ، وَقُولاَ لَهُ، وَاطْلُبَا إِلَيْهِ‏.‏ فَأَتَيَاهُ، فَدَخَلاَ عَلَيْهِ فَتَكَلَّمَا، وَقَالاَ لَهُ، فَطَلَبَا إِلَيْهِ، فَقَالَ لَهُمَا الْحَسَنُ بْنُ عَلِيٍّ إِنَّا بَنُو عَبْدِ الْمُطَّلِبِ، قَدْ أَصَبْنَا مِنْ هَذَا الْمَالِ، وَإِنَّ هَذِهِ الأُمَّةَ قَدْ عَاثَتْ فِي دِمَائِهَا‏.‏ قَالاَ فَإِنَّهُ يَعْرِضُ عَلَيْكَ كَذَا وَكَذَا وَيَطْلُبُ إِلَيْكَ وَيَسْأَلُكَ‏.‏ قَالَ فَمَنْ لِي بِهَذَا قَالاَ نَحْنُ لَكَ بِهِ‏.‏ فَمَا سَأَلَهُمَا شَيْئًا إِلاَّ قَالاَ نَحْنُ لَكَ بِهِ‏.‏ فَصَالَحَهُ، فَقَالَ الْحَسَنُ وَلَقَدْ سَمِعْتُ أَبَا بَكْرَةَ يَقُولُ رَأَيْتُ رَسُولَ اللَّهِ صلى الله عليه وسلم عَلَى الْمِنْبَرِ وَالْحَسَنُ بْنُ عَلِيٍّ إِلَى جَنْبِهِ، وَهْوَ يُقْبِلُ عَلَى النَّاسِ مَرَّةً وَعَلَيْهِ أُخْرَى وَيَقُولُ ‏ ‏ إِنَّ ابْنِي هَذَا سَيِّدٌ، وَلَعَلَّ اللَّهَ أَنْ يُصْلِحَ بِهِ بَيْنَ فِئَتَيْنِ عَظِيمَتَيْنِ مِنَ الْمُسْلِمِينَ ‏‏‏.‏ قَالَ لِي عَلِيُّ بْنُ عَبْدِ اللَّهِ إِنَّمَا ثَبَتَ لَنَا سَمَاعُ الْحَسَنِ مِنْ أَبِي بَكْرَةَ بِهَذَا الْحَدِيثِ‏.‏,حَدَّثَنَا عَبْدُ اللَّهِ بْنُ مُحَمَّدٍ، حَدَّثَنَا سُفْيَانُ، عَنْ أَبِي مُوسَى، قَالَ سَمِعْتُ الْحَسَنَ، يَقُولُ,اسْتَقْبَلَ وَاللَّهِ الْحَسَنُ بْنُ عَلِيٍّ مُعَاوِيَةَ بِكَتَائِبَ أَمْثَالِ الْجِبَالِ فَقَالَ عَمْرُو بْنُ الْعَاصِ إِنِّي لأَرَى كَتَائِبَ لاَ تُوَلِّي حَتَّى تَقْتُلَ أَقْرَانَهَا‏.‏ فَقَالَ لَهُ مُعَاوِيَةُ ـ وَكَانَ وَاللَّهِ خَيْرَ الرَّجُلَيْنِ ـ أَىْ عَمْرُو إِنْ قَتَلَ هَؤُلاَءِ هَؤُلاَءِ وَهَؤُلاَءِ هَؤُلاَءِ مَنْ لِي بِأُمُورِ النَّاسِ مَنْ لِي بِنِسَائِهِمْ، مَنْ لِي بِضَيْعَتِهِمْ فَبَعَثَ إِلَيْهِ رَجُلَيْنِ مِنْ قُرَيْشٍ مِنْ بَنِي عَبْدِ شَمْسٍ عَبْدَ الرَّحْمَنِ بْنَ سَمُرَةَ وَعَبْدَ اللَّهِ بْنَ عَامِرِ بْنِ كُرَيْزٍ، فَقَالَ اذْهَبَا إِلَى هَذَا الرَّجُلِ فَاعْرِضَا عَلَيْهِ، وَقُولاَ لَهُ، وَاطْلُبَا إِلَيْهِ‏.‏ فَأَتَيَاهُ، فَدَخَلاَ عَلَيْهِ فَتَكَلَّمَا، وَقَالاَ لَهُ، فَطَلَبَا إِلَيْهِ، فَقَالَ لَهُمَا الْحَسَنُ بْنُ عَلِيٍّ إِنَّا بَنُو عَبْدِ الْمُطَّلِبِ، قَدْ أَصَبْنَا مِنْ هَذَا الْمَالِ، وَإِنَّ هَذِهِ الأُمَّةَ قَدْ عَاثَتْ فِي دِمَائِهَا‏.‏ قَالاَ فَإِنَّهُ يَعْرِضُ عَلَيْكَ كَذَا وَكَذَا وَيَطْلُبُ إِلَيْكَ وَيَسْأَلُكَ‏.‏ قَالَ فَمَنْ لِي بِهَذَا قَالاَ نَحْنُ لَكَ بِهِ‏.‏ فَمَا سَأَلَهُمَا شَيْئًا إِلاَّ قَالاَ نَحْنُ لَكَ بِهِ‏.‏ فَصَالَحَهُ، فَقَالَ الْحَسَنُ وَلَقَدْ سَمِعْتُ أَبَا بَكْرَةَ يَقُولُ رَأَيْتُ رَسُولَ اللَّهِ صلى الله عليه وسلم عَلَى الْمِنْبَرِ وَالْحَسَنُ بْنُ عَلِيٍّ إِلَى جَنْبِهِ، وَهْوَ يُقْبِلُ عَلَى النَّاسِ مَرَّةً وَعَلَيْهِ أُخْرَى وَيَقُولُ ‏ ‏ إِنَّ ابْنِي هَذَا سَيِّدٌ، وَلَعَلَّ اللَّهَ أَنْ يُصْلِحَ بِهِ بَيْنَ فِئَتَيْنِ عَظِيمَتَيْنِ مِنَ الْمُسْلِمِينَ ‏‏‏.‏ قَالَ لِي عَلِيُّ بْنُ عَبْدِ اللَّهِ إِنَّمَا ثَبَتَ لَنَا سَمَاعُ الْحَسَنِ مِنْ أَبِي بَكْرَةَ بِهَذَا الْحَدِيثِ‏.‏,nan,Sahih-Authentic,صحيح
