Chapter_Number,Chapter_English,Chapter_Arabic,Section_Number,Section_English,Section_Arabic,Hadith_number,English_Hadith,English_Isnad,English_Matn,Arabic_Hadith,Arabic_Isnad,Arabic_Matn,Arabic_Comment,English_Grade,Arabic_Grade
31,Chapters on Medicine,كتاب الطب,nan,nan,nan,3575,"It was narrated that Abu Hurairah said: “The Prophet (ﷺ) came to visit me (when I was sick), and said to me: ‘Shall I not recite for you a Ruqyah that Jibra’il brought to me?’ I said: ‘May my father and mother be ransomed for you! Yes, O Messenger of Allah!’ He said: Bismillah arqika, wallahu yashfika, min kulli da’in fika, min sharrin- naffathati fil-‘uqad, wa min sharri hasidin idha hasad (In the Name of Allah I perform Ruqyah for you, from every disease that is in you, and from the evil of those who (practice witchcraft when they) blow in the knots, and from the evil of the envier when he envies), three times.”",It was narrated that Abu Hurairah said:,"“The Prophet (ﷺ) came to visit me (when I was sick), and said to me: ‘Shall I not recite for you a Ruqyah that Jibra’il brought to me?’ I said: ‘May my father and mother be ransomed for you! Yes, O Messenger of Allah!’ He said: Bismillah arqika, wallahu yashfika, min kulli da’in fika, min sharrin- naffathati fil-‘uqad, wa min sharri hasidin idha hasad (In the Name of Allah I perform Ruqyah for you, from every disease that is in you, and from the evil of those who (practice witchcraft when they) blow in the knots, and from the evil of the envier when he envies), three times.”","حَدَّثَنَا مُحَمَّدُ بْنُ بَشَّارٍ، وَحَفْصُ بْنُ عُمَرَ، قَالاَ حَدَّثَنَا عَبْدُ الرَّحْمَنِ، حَدَّثَنَا سُفْيَانُ، عَنْ عَاصِمِ بْنِ عُبَيْدِ اللَّهِ، عَنْ زِيَادِ بْنِ ثُوَيْبٍ، عَنْ أَبِي هُرَيْرَةَ، قَالَ جَاءَ النَّبِيُّ ـ صلى الله عليه وسلم ـ يَعُودُنِي فَقَالَ لِي ‏""‏ أَلاَ أَرْقِيكَ بِرُقْيَةٍ جَاءَنِي بِهَا جِبْرَائِيلُ ‏""‏ ‏.‏ قُلْتُ بِأَبِي وَأُمِّي بَلَى يَا رَسُولَ اللَّهِ ‏.‏ قَالَ ‏""‏ بِسْمِ اللَّهِ أَرْقِيكَ وَاللَّهُ يَشْفِيكَ مِنْ كُلِّ دَاءٍ فِيكَ مِنْ شَرِّ النَّفَّاثَاتِ فِي الْعُقَدِ وَمِنْ شَرِّ حَاسِدٍ إِذَا حَسَدَ ‏""‏ ‏.‏ ثَلاَثَ مَرَّاتٍ ‏.‏",حَدَّثَنَا مُحَمَّدُ بْنُ بَشَّارٍ، وَحَفْصُ بْنُ عُمَرَ، قَالاَ حَدَّثَنَا عَبْدُ الرَّحْمَنِ، حَدَّثَنَا سُفْيَانُ، عَنْ عَاصِمِ بْنِ عُبَيْدِ اللَّهِ، عَنْ زِيَادِ بْنِ ثُوَيْبٍ، عَنْ أَبِي هُرَيْرَةَ،,قَالَ جَاءَ النَّبِيُّ صلى الله عليه وسلم يَعُودُنِي فَقَالَ لِي أَلاَ أَرْقِيكَ بِرُقْيَةٍ جَاءَنِي بِهَا جِبْرَائِيلُ قُلْتُ بِأَبِي وَأُمِّي بَلَى يَا رَسُولَ اللَّهِ قَالَ بِسْمِ اللَّهِ أَرْقِيكَ وَاللَّهُ يَشْفِيكَ مِنْ كُلِّ دَاءٍ فِيكَ مِنْ شَرِّ النَّفَّاثَاتِ فِي الْعُقَدِ وَمِنْ شَرِّ حَاسِدٍ إِذَا حَسَدَ ثَلاَثَ مَرَّاتٍ, ,Daif - Weak, 
31,Chapters on Medicine,كتاب الطب,nan,nan,nan,3576,"It was narrated that Ibn ‘Abbas said: “The Prophet (ﷺ) used to seek refuge for Hasan and Husain and say: A’udhu bi kalimatil-lahil- tammati, min kulli shaitanin wa hammah, wa min kulli ‘aynin lammah (I seek refuge for you both in the Perfect Words of Allah, from every devil and every poisonous reptile, and from every evil eye).’ And he would say: ‘Thus Ibrahim used to seek refuge with Allah for Isma’il and Ishaq,’ or he said: ‘for Isma’il and Ya’qub.’”",It was narrated that Ibn ‘Abbas said:,"“The Prophet (ﷺ) used to seek refuge for Hasan and Husain and say: A’udhu bi kalimatil-lahil- tammati, min kulli shaitanin wa hammah, wa min kulli ‘aynin lammah (I seek refuge for you both in the Perfect Words of Allah, from every devil and every poisonous reptile, and from every evil eye).’ And he would say: ‘Thus Ibrahim used to seek refuge with Allah for Isma’il and Ishaq,’ or he said: ‘for Isma’il and Ya’qub.’”","حَدَّثَنَا مُحَمَّدُ بْنُ سُلَيْمَانَ بْنِ هِشَامٍ الْبَغْدَادِيُّ، حَدَّثَنَا وَكِيعٌ، ح وَحَدَّثَنَا أَبُو بَكْرِ بْنُ خَلاَّدٍ الْبَاهِلِيُّ، حَدَّثَنَا أَبُو عَامِرٍ، قَالاَ حَدَّثَنَا سُفْيَانُ، عَنْ مَنْصُورٍ، عَنْ مِنْهَالٍ، عَنْ سَعِيدِ بْنِ جُبَيْرٍ، عَنِ ابْنِ عَبَّاسٍ، قَالَ كَانَ النَّبِيُّ ـ صلى الله عليه وسلم ـ يُعَوِّذُ الْحَسَنَ وَالْحُسَيْنَ يَقُولُ ‏""‏ أَعُوذُ بِكَلِمَاتِ اللَّهِ التَّامَّةِ مِنْ كُلِّ شَيْطَانٍ وَهَامَّةٍ وَمِنْ كُلِّ عَيْنٍ لاَمَّةٍ ‏""‏ ‏.‏ قَالَ ‏""‏ وَكَانَ أَبُونَا إِبْرَاهِيمُ يَعُوِّذُ بِهَا إِسْمَاعِيلَ وَإِسْحَاقَ ‏""‏ ‏.‏ أَوْ قَالَ ‏""‏ إِسْمَاعِيلَ وَيَعْقُوبَ ‏""‏ ‏.‏ وَهَذَا حَدِيثُ وَكِيعٍ ‏.‏",حَدَّثَنَا مُحَمَّدُ بْنُ سُلَيْمَانَ بْنِ هِشَامٍ الْبَغْدَادِيُّ، حَدَّثَنَا وَكِيعٌ، ح وَحَدَّثَنَا أَبُو بَكْرِ بْنُ خَلاَّدٍ الْبَاهِلِيُّ، حَدَّثَنَا أَبُو عَامِرٍ، قَالاَ حَدَّثَنَا سُفْيَانُ، عَنْ مَنْصُورٍ، عَنْ مِنْهَالٍ، عَنْ سَعِيدِ بْنِ جُبَيْرٍ، عَنِ ابْنِ عَبَّاسٍ،,قَالَ كَانَ النَّبِيُّ صلى الله عليه وسلم يُعَوِّذُ الْحَسَنَ وَالْحُسَيْنَ يَقُولُ أَعُوذُ بِكَلِمَاتِ اللَّهِ التَّامَّةِ مِنْ كُلِّ شَيْطَانٍ وَهَامَّةٍ وَمِنْ كُلِّ عَيْنٍ لاَمَّةٍ قَالَ وَكَانَ أَبُونَا إِبْرَاهِيمُ يَعُوِّذُ بِهَا إِسْمَاعِيلَ وَإِسْحَاقَ أَوْ قَالَ إِسْمَاعِيلَ وَيَعْقُوبَ وَهَذَا حَدِيثُ وَكِيعٍ, ,Sahih - Authentic,صحيح
31,Chapters on Medicine,كتاب الطب,nan,nan,nan,3577,"It was narrated from Ibn ‘Abbas that, for fever and all kinds of pain, the Prophet (ﷺ) used to teach them to say: “Bismillahil-kabir, a’udhu billahil-‘Azim min sharri ‘irqin na’ar wa, min sharri harrin- nar (In the Name of Allah the Great, I seek refuge with Allah the Almighty from the evil of a vein gushing (with blood) and the evil of the heat of the Fire.” (One of the narrators) Abu `Ammar said: “I differed with the people on this, I said: ‘Screaming.’” Another chain from Ibn `Abbas, from the Prophet (ﷺ) with similar wording, and he said: “From the evil of a vein screaming (with blood).”","It was narrated from Ibn ‘Abbas that, for fever and all kinds of pain, the Prophet (ﷺ) used to teach them to say:","“Bismillahil-kabir, a’udhu billahil-‘Azim min sharri ‘irqin na’ar wa, min sharri harrin- nar (In the Name of Allah the Great, I seek refuge with Allah the Almighty from the evil of a vein gushing (with blood) and the evil of the heat of the Fire.” (One of the narrators) Abu `Ammar said: “I differed with the people on this, I said: ‘Screaming.’” Another chain from Ibn `Abbas, from the Prophet (ﷺ) with similar wording, and he said: “From the evil of a vein screaming (with blood).”","حَدَّثَنَا مُحَمَّدُ بْنُ بَشَّارٍ، حَدَّثَنَا أَبُو عَامِرٍ، حَدَّثَنَا إِبْرَاهِيمُ الأَشْهَلِيُّ، عَنْ دَاوُدَ بْنِ حُصَيْنٍ، عَنْ عِكْرِمَةَ، عَنِ ابْنِ عَبَّاسٍ، أَنَّ النَّبِيَّ ـ صلى الله عليه وسلم ـ كَانَ يُعَلِّمُهُمْ مِنَ الْحُمَّى وَمِنَ الأَوْجَاعِ كُلِّهَا أَنْ يَقُولُوا ‏""‏ بِسْمِ اللَّهِ الْكَبِيرِ أَعُوذُ بِاللَّهِ الْعَظِيمِ مِنْ شَرِّ عِرْقٍ نَعَّارٍ وَمِنْ شَرِّ حَرِّ النَّارِ ‏""‏ ‏.‏ قَالَ أَبُو عَامِرٍ أَنَا أُخَالِفُ النَّاسَ فِي هَذَا أَقُولُ يَعَّارٍ ‏.‏ حَدَّثَنَا عَبْدُ الرَّحْمَنِ بْنُ إِبْرَاهِيمَ الدِّمَشْقِيُّ، حَدَّثَنَا ابْنُ أَبِي فُدَيْكٍ، أَخْبَرَنِي إِبْرَاهِيمُ بْنُ إِسْمَاعِيلَ بْنِ أَبِي حَبِيبَةَ الأَشْهَلِيُّ، عَنْ دَاوُدَ بْنِ الْحُصَيْنِ، عَنْ عِكْرِمَةَ، عَنِ ابْنِ عَبَّاسٍ، عَنِ النَّبِيِّ ـ صلى الله عليه وسلم ـ نَحْوَهُ وَقَالَ ‏""‏ مِنْ شَرِّ عِرْقٍ نَعَّارٍ ‏""‏ ‏.‏",حَدَّثَنَا مُحَمَّدُ بْنُ بَشَّارٍ، حَدَّثَنَا أَبُو عَامِرٍ، حَدَّثَنَا إِبْرَاهِيمُ الأَشْهَلِيُّ، عَنْ دَاوُدَ بْنِ حُصَيْنٍ، عَنْ عِكْرِمَةَ، عَنِ ابْنِ عَبَّاسٍ،,أَنَّ النَّبِيَّ صلى الله عليه وسلم كَانَ يُعَلِّمُهُمْ مِنَ الْحُمَّى وَمِنَ الأَوْجَاعِ كُلِّهَا أَنْ يَقُولُوا بِسْمِ اللَّهِ الْكَبِيرِ أَعُوذُ بِاللَّهِ الْعَظِيمِ مِنْ شَرِّ عِرْقٍ نَعَّارٍ وَمِنْ شَرِّ حَرِّ النَّارِ قَالَ أَبُو عَامِرٍ أَنَا أُخَالِفُ النَّاسَ فِي هَذَا أَقُولُ يَعَّارٍ حَدَّثَنَا عَبْدُ الرَّحْمَنِ بْنُ إِبْرَاهِيمَ الدِّمَشْقِيُّ، حَدَّثَنَا ابْنُ أَبِي فُدَيْكٍ، أَخْبَرَنِي إِبْرَاهِيمُ بْنُ إِسْمَاعِيلَ بْنِ أَبِي حَبِيبَةَ الأَشْهَلِيُّ، عَنْ دَاوُدَ بْنِ الْحُصَيْنِ، عَنْ عِكْرِمَةَ، عَنِ ابْنِ عَبَّاسٍ، عَنِ النَّبِيِّ صلى الله عليه وسلم نَحْوَهُ وَقَالَ مِنْ شَرِّ عِرْقٍ نَعَّارٍ, ,Daif - Weak, 
31,Chapters on Medicine,كتاب الطب,nan,nan,nan,3578,"It was narrated from ‘Umair that he heard Junadah bin Abu Umayyah say: “I heard ‘Ubadah bin Samit say: ‘Jibra’il (as) came to the Prophet (ﷺ) when he was suffering from fever and said: ‘Bismillahi arqika, min kulli shay’in yu’dhika, min hasadi hasidin, wa min kulli ‘aynin, Allahu yashfika (In the Name of Allah I perform Ruqyah for you, from everything that is harming you; from the envy of the envier and from every evil eye, may Allah heal you).’”",It was narrated from ‘Umair that he heard Junadah bin Abu Umayyah say:,"“I heard ‘Ubadah bin Samit say: ‘Jibra’il (as) came to the Prophet (ﷺ) when he was suffering from fever and said: ‘Bismillahi arqika, min kulli shay’in yu’dhika, min hasadi hasidin, wa min kulli ‘aynin, Allahu yashfika (In the Name of Allah I perform Ruqyah for you, from everything that is harming you; from the envy of the envier and from every evil eye, may Allah heal you).’”",حَدَّثَنَا عَمْرُو بْنُ عُثْمَانَ بْنِ سَعِيدِ بْنِ كَثِيرِ بْنِ دِينَارٍ الْحِمْصِيُّ، حَدَّثَنَا أَبِي، عَنِ ابْنِ ثَوْبَانَ، عَنْ عُمَيْرٍ، أَنَّهُ سَمِعَ جُنَادَةَ بْنَ أَبِي أُمَيَّةَ، قَالَ سَمِعْتُ عُبَادَةَ بْنَ الصَّامِتِ، يَقُولُ أَتَى جِبْرَائِيلُ عَلَيْهِ السَّلاَمُ النَّبِيَّ ـ صلى الله عليه وسلم ـ وَهُوَ يُوعَكُ فَقَالَ بِسْمِ اللَّهِ أَرْقِيكَ مِنْ كُلِّ شَىْءٍ يُؤْذِيكَ مِنْ حَسَدِ حَاسِدٍ وَمِنْ كُلِّ عَيْنٍ اللَّهُ يَشْفِيكَ ‏.‏,حَدَّثَنَا عَمْرُو بْنُ عُثْمَانَ بْنِ سَعِيدِ بْنِ كَثِيرِ بْنِ دِينَارٍ الْحِمْصِيُّ، حَدَّثَنَا أَبِي، عَنِ ابْنِ ثَوْبَانَ، عَنْ عُمَيْرٍ، أَنَّهُ سَمِعَ جُنَادَةَ بْنَ أَبِي أُمَيَّةَ، قَالَ سَمِعْتُ عُبَادَةَ بْنَ الصَّامِتِ،,يَقُولُ أَتَى جِبْرَائِيلُ عَلَيْهِ السَّلاَمُ النَّبِيَّ صلى الله عليه وسلم وَهُوَ يُوعَكُ فَقَالَ بِسْمِ اللَّهِ أَرْقِيكَ مِنْ كُلِّ شَىْءٍ يُؤْذِيكَ مِنْ حَسَدِ حَاسِدٍ وَمِنْ كُلِّ عَيْنٍ اللَّهُ يَشْفِيكَ, ,Hasan - Good,حسن
31,Chapters on Medicine,كتاب الطب,nan,nan,nan,3579,It was narrated from ‘Aishah that the Prophet (ﷺ) used to blow when performing Ruqyah.,nan,"It was
narrated from ‘Aishah that the Prophet (ﷺ) used to blow when
performing Ruqyah.",حَدَّثَنَا أَبُو بَكْرِ بْنُ أَبِي شَيْبَةَ، وَعَلِيُّ بْنُ مَيْمُونٍ الرَّقِّيُّ، وَسَهْلُ بْنُ أَبِي سَهْلٍ، قَالُوا حَدَّثَنَا وَكِيعٌ، عَنْ مَالِكِ بْنِ أَنَسٍ، عَنِ الزُّهْرِيِّ، عَنْ عُرْوَةَ، عَنْ عَائِشَةَ، أَنَّ النَّبِيَّ ـ صلى الله عليه وسلم ـ كَانَ يَنْفِثُ فِي الرُّقْيَةِ ‏.‏, حَدَّثَنَا أَبُو بَكْرِ بْنُ أَبِي شَيْبَةَ، وَعَلِيُّ بْنُ مَيْمُونٍ الرَّقِّيُّ، وَسَهْلُ بْنُ أَبِي سَهْلٍ، قَالُوا حَدَّثَنَا وَكِيعٌ، عَنْ مَالِكِ بْنِ أَنَسٍ، عَنِ الزُّهْرِيِّ، عَنْ عُرْوَةَ، عَنْ, عَائِشَةَ، أَنَّ النَّبِيَّ صلى الله عليه وسلم كَانَ يَنْفِثُ فِي الرُّقْيَةِ, ,Sahih - Authentic,صحيح
31,Chapters on Medicine,كتاب الطب,nan,nan,nan,3580,"It was narrated from ‘Aishah: “Whenever the Prophet (ﷺ) fell ill, he would recite the Mu’awwidhat and blow, and when his pain grew worse, I would recite over him and wipe his hand over him, hoping for its blessing.”",It was narrated from ‘Aishah:,"“Whenever the Prophet (ﷺ) fell ill, he would recite the Mu’awwidhat and blow, and when his pain grew worse, I would recite over him and wipe his hand over him, hoping for its blessing.”",حَدَّثَنَا سَهْلُ بْنُ أَبِي سَهْلٍ، قَالَ حَدَّثَنَا مَعْنُ بْنُ عِيسَى، ح وَحَدَّثَنَا مُحَمَّدُ بْنُ يَحْيَى، حَدَّثَنَا بِشْرُ بْنُ عُمَرَ، قَالاَ حَدَّثَنَا مَالِكٌ، عَنِ ابْنِ شِهَابٍ، عَنْ عُرْوَةَ، عَنْ عَائِشَةَ، أَنَّ النَّبِيَّ ـ صلى الله عليه وسلم ـ كَانَ إِذَا اشْتَكَى يَقْرَأُ عَلَى نَفْسِهِ الْمُعَوِّذَاتِ وَيَنْفِثُ فَلَمَّا اشْتَدَّ وَجَعُهُ كُنْتُ أَقْرَأُ عَلَيْهِ وَأَمْسَحُ بِيَدِهِ رَجَاءَ بَرَكَتِهَا ‏.‏,حَدَّثَنَا سَهْلُ بْنُ أَبِي سَهْلٍ، قَالَ حَدَّثَنَا مَعْنُ بْنُ عِيسَى، ح وَحَدَّثَنَا مُحَمَّدُ بْنُ يَحْيَى، حَدَّثَنَا بِشْرُ بْنُ عُمَرَ، قَالاَ حَدَّثَنَا مَالِكٌ، عَنِ ابْنِ شِهَابٍ، عَنْ عُرْوَةَ، عَنْ,عَائِشَةَ، أَنَّ النَّبِيَّ صلى الله عليه وسلم كَانَ إِذَا اشْتَكَى يَقْرَأُ عَلَى نَفْسِهِ الْمُعَوِّذَاتِ وَيَنْفِثُ فَلَمَّا اشْتَدَّ وَجَعُهُ كُنْتُ أَقْرَأُ عَلَيْهِ وَأَمْسَحُ بِيَدِهِ رَجَاءَ بَرَكَتِهَا, ,Sahih - Authentic,صحيح
