Chapter_Number,Chapter_English,Chapter_Arabic,Section_Number,Section_English,Section_Arabic,Hadith_number,English_Hadith,English_Isnad,English_Matn,Arabic_Hadith,Arabic_Isnad,Arabic_Matn,Arabic_Comment,English_Grade,Arabic_Grade
31,Chapters on Medicine,كتاب الطب,nan,nan,nan,3551,"It was narrated that Tariq bin Suwaid Al-Hadrami said: “I said: ‘O Messenger of Allah, in our land there are grapes which we squeeze (to make wine). Can we drink from it?’ He said: ‘No.’ I repeated the question and said: ‘We treat the sick with it.’ He said: ‘That is not a cure, it is a disease.’”",It was narrated that Tariq bin Suwaid Al-Hadrami said:,"“I said: ‘O Messenger of Allah, in our land there are grapes which we squeeze (to make wine). Can we drink from it?’ He said: ‘No.’ I repeated the question and said: ‘We treat the sick with it.’ He said: ‘That is not a cure, it is a disease.’”","حَدَّثَنَا أَبُو بَكْرِ بْنُ أَبِي شَيْبَةَ، حَدَّثَنَا عَفَّانُ، حَدَّثَنَا حَمَّادُ بْنُ سَلَمَةَ، أَنْبَأَنَا سِمَاكُ بْنُ حَرْبٍ، عَنْ عَلْقَمَةَ بْنِ وَائِلٍ الْحَضْرَمِيِّ، عَنْ طَارِقِ بْنِ سُوَيْدٍ الْحَضْرَمِيِّ، قَالَ قُلْتُ يَا رَسُولَ اللَّهِ إِنَّ بِأَرْضِنَا أَعْنَابًا نَعْتَصِرُهَا فَنَشْرَبُ مِنْهَا قَالَ ‏""‏ لاَ ‏""‏ ‏.‏ فَرَاجَعْتُهُ قُلْتُ إِنَّا نَسْتَشْفِي بِهِ لِلْمَرِيضِ ‏.‏ قَالَ ‏""‏ إِنَّ ذَلِكَ لَيْسَ بِشِفَاءٍ وَلَكِنَّهُ دَاءٌ ‏""‏ ‏.‏",حَدَّثَنَا أَبُو بَكْرِ بْنُ أَبِي شَيْبَةَ، حَدَّثَنَا عَفَّانُ، حَدَّثَنَا حَمَّادُ بْنُ سَلَمَةَ، أَنْبَأَنَا سِمَاكُ بْنُ حَرْبٍ، عَنْ عَلْقَمَةَ بْنِ وَائِلٍ الْحَضْرَمِيِّ، عَنْ طَارِقِ بْنِ سُوَيْدٍ,الْحَضْرَمِيِّ، قَالَ قُلْتُ يَا رَسُولَ اللَّهِ إِنَّ بِأَرْضِنَا أَعْنَابًا نَعْتَصِرُهَا فَنَشْرَبُ مِنْهَا قَالَ لاَ فَرَاجَعْتُهُ قُلْتُ إِنَّا نَسْتَشْفِي بِهِ لِلْمَرِيضِ قَالَ إِنَّ ذَلِكَ لَيْسَ بِشِفَاءٍ وَلَكِنَّهُ دَاءٌ, ,Sahih - Authentic,صحيح
31,Chapters on Medicine,كتاب الطب,nan,nan,nan,3552,It was narrated from ‘Ali that the Messenger of Allah (ﷺ) said: “The best remedy is the Qur’an.”,It was narrated from ‘Ali that the Messenger of Allah (ﷺ) said:,“The best remedy is the Qur’an.”,حَدَّثَنَا مُحَمَّدُ بْنُ عُبَيْدِ بْنِ عُتْبَةَ بْنِ عَبْدِ الرَّحْمَنِ الْكِنْدِيُّ، حَدَّثَنَا عَلِيُّ بْنُ ثَابِتٍ، حَدَّثَنَا سَعَّادُ بْنُ سُلَيْمَانَ، عَنْ أَبِي إِسْحَاقَ، عَنِ الْحَارِثِ، عَنْ عَلِيٍّ، قَالَ قَالَ رَسُولُ اللَّهِ ـ صلى الله عليه وسلم ـ ‏ ‏ خَيْرُ الدَّوَاءِ الْقُرْآنُ ‏‏ ‏.‏,حَدَّثَنَا مُحَمَّدُ بْنُ عُبَيْدِ بْنِ عُتْبَةَ بْنِ عَبْدِ الرَّحْمَنِ الْكِنْدِيُّ، حَدَّثَنَا عَلِيُّ بْنُ ثَابِتٍ، حَدَّثَنَا سَعَّادُ بْنُ سُلَيْمَانَ، عَنْ أَبِي إِسْحَاقَ، عَنِ الْحَارِثِ، عَنْ عَلِيٍّ، قَالَ,قَالَ رَسُولُ اللَّهِ صلى الله عليه وسلم خَيْرُ الدَّوَاءِ الْقُرْآنُ, ,Daif - Weak, 
31,Chapters on Medicine,كتاب الطب,nan,nan,nan,3553,"Salma Umm Rafi’, the freed slave woman of the Messenger of Allah (ﷺ), said: “The Prophet (ﷺ) did not suffer any injury or thorn- prick but he would apply henna to it.”","Salma Umm Rafi’, the freed slave woman of the Messenger of Allah (ﷺ), said:",“The Prophet (ﷺ) did not suffer any injury or thorn- prick but he would apply henna to it.”,حَدَّثَنَا أَبُو بَكْرِ بْنُ أَبِي شَيْبَةَ، حَدَّثَنَا زَيْدُ بْنُ الْحُبَابِ، حَدَّثَنَا فَائِدٌ، مَوْلَى عُبَيْدِ اللَّهِ بْنِ عَلِيِّ بْنِ أَبِي رَافِعٍ حَدَّثَنِي مَوْلاَىَ، عُبَيْدُ اللَّهِ حَدَّثَتْنِي جَدَّتِي، سَلْمَى أُمُّ رَافِعٍ مَوْلاَةُ رَسُولِ اللَّهِ ـ صلى الله عليه وسلم ـ قَالَتْ كَانَ لاَ يُصِيبُ النَّبِيَّ ـ صلى الله عليه وسلم ـ قَرْحَةٌ وَلاَ شَوْكَةٌ إِلاَّ وَضَعَ عَلَيْهِ الْحِنَّاءَ ‏.‏,حَدَّثَنَا أَبُو بَكْرِ بْنُ أَبِي شَيْبَةَ، حَدَّثَنَا زَيْدُ بْنُ الْحُبَابِ، حَدَّثَنَا فَائِدٌ، مَوْلَى عُبَيْدِ اللَّهِ بْنِ عَلِيِّ بْنِ أَبِي رَافِعٍ حَدَّثَنِي مَوْلاَىَ، عُبَيْدُ اللَّهِ حَدَّثَتْنِي,جَدَّتِي، سَلْمَى أُمُّ رَافِعٍ مَوْلاَةُ رَسُولِ اللَّهِ صلى الله عليه وسلم قَالَتْ كَانَ لاَ يُصِيبُ النَّبِيَّ صلى الله عليه وسلم قَرْحَةٌ وَلاَ شَوْكَةٌ إِلاَّ وَضَعَ عَلَيْهِ الْحِنَّاءَ, ,Daif - Weak, 
31,Chapters on Medicine,كتاب الطب,nan,nan,nan,3554,"It was narrated from Anas that some people from ‘Urainah came to the Messenger of Allah (ﷺ) but they were averse to the climate of Al- Madinah. He (ﷺ) said: “Why don’t you go out to a flock of camels of ours, and drink their milk and urine.” And they did that.",It was narrated from Anas that some people from ‘Urainah came to the Messenger of Allah (ﷺ) but they were averse to the climate of Al- Madinah. He (ﷺ) said:,"“Why don’t you go out to a flock of camels of ours, and drink their milk and urine.” And they did that.",حَدَّثَنَا نَصْرُ بْنُ عَلِيٍّ الْجَهْضَمِيُّ، حَدَّثَنَا عَبْدُ الْوَهَّابِ، حَدَّثَنَا حُمَيْدٌ، عَنْ أَنَسٍ، أَنَّ نَاسًا، مِنْ عُرَيْنَةَ قَدِمُوا عَلَى رَسُولِ اللَّهِ ـ صلى الله عليه وسلم ـ فَاجْتَوَوُا الْمَدِينَةَ فَقَالَ ـ صلى الله عليه وسلم ـ ‏ ‏ لَوْ خَرَجْتُمْ إِلَى ذَوْدٍ لَنَا فَشَرِبْتُمْ مِنْ أَلْبَانِهَا وَأَبْوَالِهَا ‏‏ ‏.‏ فَفَعَلُوا ‏.‏,حَدَّثَنَا نَصْرُ بْنُ عَلِيٍّ الْجَهْضَمِيُّ، حَدَّثَنَا عَبْدُ الْوَهَّابِ، حَدَّثَنَا حُمَيْدٌ، عَنْ,أَنَسٍ، أَنَّ نَاسًا، مِنْ عُرَيْنَةَ قَدِمُوا عَلَى رَسُولِ اللَّهِ صلى الله عليه وسلم فَاجْتَوَوُا الْمَدِينَةَ فَقَالَ صلى الله عليه وسلم لَوْ خَرَجْتُمْ إِلَى ذَوْدٍ لَنَا فَشَرِبْتُمْ مِنْ أَلْبَانِهَا وَأَبْوَالِهَا فَفَعَلُوا, ,Sahih - Authentic,صحيح
31,Chapters on Medicine,كتاب الطب,nan,nan,nan,3555,"Abu Sa’eed narrated that the Messenger of Allah (ﷺ) said: “On one of the wings of a fly there is a poison and on the other is the cure. If it falls into the food, then dip it into it, for it puts the poison first and holds back the cure.”",Abu Sa’eed narrated that the Messenger of Allah (ﷺ) said:,"“On one of the wings of a fly there is a poison and on the other is the cure. If it falls into the food, then dip it into it, for it puts the poison first and holds back the cure.”",حَدَّثَنَا أَبُو بَكْرِ بْنُ أَبِي شَيْبَةَ، حَدَّثَنَا يَزِيدُ بْنُ هَارُونَ، عَنِ ابْنِ أَبِي ذِئْبٍ، عَنْ سَعِيدِ بْنِ خَالِدٍ، عَنْ أَبِي سَلَمَةَ، حَدَّثَنِي أَبُو سَعِيدٍ، أَنَّ رَسُولَ اللَّهِ ـ صلى الله عليه وسلم ـ قَالَ ‏ ‏ فِي أَحَدِ جَنَاحَىِ الذُّبَابِ سُمٌّ وَفِي الآخَرِ شِفَاءٌ فَإِذَا وَقَعَ فِي الطَّعَامِ فَامْقُلُوهُ فِيهِ فَإِنَّهُ يُقَدِّمُ السُّمَّ وَيُؤَخِّرُ الشِّفَاءَ ‏‏ ‏.‏,حَدَّثَنَا أَبُو بَكْرِ بْنُ أَبِي شَيْبَةَ، حَدَّثَنَا يَزِيدُ بْنُ هَارُونَ، عَنِ ابْنِ أَبِي ذِئْبٍ، عَنْ سَعِيدِ بْنِ خَالِدٍ، عَنْ أَبِي سَلَمَةَ، حَدَّثَنِي أَبُو سَعِيدٍ،,أَنَّ رَسُولَ اللَّهِ صلى الله عليه وسلم قَالَ فِي أَحَدِ جَنَاحَىِ الذُّبَابِ سُمٌّ وَفِي الآخَرِ شِفَاءٌ فَإِذَا وَقَعَ فِي الطَّعَامِ فَامْقُلُوهُ فِيهِ فَإِنَّهُ يُقَدِّمُ السُّمَّ وَيُؤَخِّرُ الشِّفَاءَ, ,Hasan - Good,حسن
31,Chapters on Medicine,كتاب الطب,nan,nan,nan,3556,"It was narrated from Abu Hurairah that the Prophet (ﷺ) said: “If a fly falls into your drink, dip it into it then throw it away, for on one of its wings is a disease and on the other is a cure.”",It was narrated from Abu Hurairah that the Prophet (ﷺ) said:,"“If a fly falls into your drink, dip it into it then throw it away, for on one of its wings is a disease and on the other is a cure.”",حَدَّثَنَا سُوَيْدُ بْنُ سَعِيدٍ، حَدَّثَنَا مُسْلِمُ بْنُ خَالِدٍ، عَنْ عُتْبَةَ بْنِ مُسْلِمٍ، عَنْ عُبَيْدِ بْنِ حُنَيْنٍ، عَنْ أَبِي هُرَيْرَةَ، عَنِ النَّبِيِّ ـ صلى الله عليه وسلم ـ قَالَ ‏ ‏ إِذَا وَقَعَ الذُّبَابُ فِي شَرَابِكُمْ فَلْيَغْمِسْهُ فِيهِ ثُمَّ لْيَطْرَحْهُ فَإِنَّ فِي أَحَدِ جَنَاحَيْهِ دَاءً وَفِي الآخَرِ شِفَاءً ‏‏ ‏.‏,حَدَّثَنَا سُوَيْدُ بْنُ سَعِيدٍ، حَدَّثَنَا مُسْلِمُ بْنُ خَالِدٍ، عَنْ عُتْبَةَ بْنِ مُسْلِمٍ، عَنْ عُبَيْدِ بْنِ حُنَيْنٍ، عَنْ أَبِي هُرَيْرَةَ،,عَنِ النَّبِيِّ صلى الله عليه وسلم قَالَ إِذَا وَقَعَ الذُّبَابُ فِي شَرَابِكُمْ فَلْيَغْمِسْهُ فِيهِ ثُمَّ لْيَطْرَحْهُ فَإِنَّ فِي أَحَدِ جَنَاحَيْهِ دَاءً وَفِي الآخَرِ شِفَاءً, ,Sahih - Authentic,صحيح
31,Chapters on Medicine,كتاب الطب,nan,nan,nan,3557,"It was narrated from ‘Abdullah bin ‘Amir bin Rabi’ah, from his father, that the Prophet (ﷺ) said: “The evil eye is real.”","It was narrated from ‘Abdullah bin ‘Amir bin Rabi’ah, from his father, that the Prophet (ﷺ) said:",“The evil eye is real.”,حَدَّثَنَا مُحَمَّدُ بْنُ عَبْدِ اللَّهِ بْنِ نُمَيْرٍ، حَدَّثَنَا مُعَاوِيَةُ بْنُ هِشَامٍ، حَدَّثَنَا عَمَّارُ بْنُ رُزَيْقٍ، عَنْ عَبْدِ اللَّهِ بْنِ عِيسَى، عَنْ أُمَيَّةَ بْنِ هِنْدٍ، عَنْ عَبْدِ اللَّهِ بْنِ عَامِرِ بْنِ رَبِيعَةَ، عَنْ أَبِيهِ، عَنِ النَّبِيِّ ـ صلى الله عليه وسلم ـ قَالَ ‏ ‏ الْعَيْنُ حَقٌّ ‏‏ ‏.‏,حَدَّثَنَا مُحَمَّدُ بْنُ عَبْدِ اللَّهِ بْنِ نُمَيْرٍ، حَدَّثَنَا مُعَاوِيَةُ بْنُ هِشَامٍ، حَدَّثَنَا عَمَّارُ بْنُ رُزَيْقٍ، عَنْ عَبْدِ اللَّهِ بْنِ عِيسَى، عَنْ أُمَيَّةَ بْنِ هِنْدٍ، عَنْ عَبْدِ اللَّهِ بْنِ عَامِرِ بْنِ رَبِيعَةَ، عَنْ أَبِيهِ،,عَنِ النَّبِيِّ صلى الله عليه وسلم قَالَ الْعَيْنُ حَقٌّ, ,Sahih - Authentic,صحيح
31,Chapters on Medicine,كتاب الطب,nan,nan,nan,3558,It was narrated from Abu Hurairah that the Messenger of Allah (ﷺ) said: ‘The evil eye is real.”,It was narrated from Abu Hurairah that the Messenger of Allah (ﷺ) said:,‘The evil eye is real.”,حَدَّثَنَا أَبُو بَكْرِ بْنُ أَبِي شَيْبَةَ، حَدَّثَنَا إِسْمَاعِيلُ ابْنُ عُلَيَّةَ، عَنِ الْجُرَيْرِيِّ، عَنْ مُضَارِبِ بْنِ حَزْنٍ، عَنْ أَبِي هُرَيْرَةَ، قَالَ قَالَ رَسُولُ اللَّهِ ـ صلى الله عليه وسلم ـ ‏ ‏ الْعَيْنُ حَقٌّ ‏‏ ‏.‏,حَدَّثَنَا أَبُو بَكْرِ بْنُ أَبِي شَيْبَةَ، حَدَّثَنَا إِسْمَاعِيلُ ابْنُ عُلَيَّةَ، عَنِ الْجُرَيْرِيِّ، عَنْ مُضَارِبِ بْنِ حَزْنٍ، عَنْ أَبِي هُرَيْرَةَ، قَالَ,قَالَ رَسُولُ اللَّهِ صلى الله عليه وسلم الْعَيْنُ حَقٌّ, ,Daif - Weak, 
31,Chapters on Medicine,كتاب الطب,nan,nan,nan,3559,"It was narrated from ‘Aishah that the Messenger of Allah (ﷺ) said: ‘Seek refuge with Allah, for the evil eye is real.”",It was narrated from ‘Aishah that the Messenger of Allah (ﷺ) said:,"‘Seek refuge with Allah, for the evil eye is real.”",حَدَّثَنَا مُحَمَّدُ بْنُ بَشَّارٍ، حَدَّثَنَا أَبُو هِشَامٍ الْمَخْزُومِيُّ، حَدَّثَنَا وُهَيْبٌ، عَنْ أَبِي وَاقِدٍ، عَنْ أَبِي سَلَمَةَ بْنِ عَبْدِ الرَّحْمَنِ، عَنْ عَائِشَةَ، قَالَتْ قَالَ رَسُولُ اللَّهِ ـ صلى الله عليه وسلم ـ ‏ ‏ اسْتَعِيذُوا بِاللَّهِ فَإِنَّ الْعَيْنَ حَقٌّ ‏‏ ‏.‏,حَدَّثَنَا مُحَمَّدُ بْنُ بَشَّارٍ، حَدَّثَنَا أَبُو هِشَامٍ الْمَخْزُومِيُّ، حَدَّثَنَا وُهَيْبٌ، عَنْ أَبِي وَاقِدٍ، عَنْ أَبِي سَلَمَةَ بْنِ عَبْدِ الرَّحْمَنِ، عَنْ عَائِشَةَ، قَالَتْ,قَالَ رَسُولُ اللَّهِ صلى الله عليه وسلم اسْتَعِيذُوا بِاللَّهِ فَإِنَّ الْعَيْنَ حَقٌّ, ,Daif - Weak, 
31,Chapters on Medicine,كتاب الطب,nan,nan,nan,3560,"It was narrated that Abu Umamah bin Sahl bin Hunaif said: “ ‘Amir bin Rabi’ah passed by Sahl bin Hunaif when he was having a bath, and said: ‘I have never seen such beautiful skin.’ Straightaway, he (Sahl) fell to the ground. He was brought to the Prophet (ﷺ) and it was said: ‘Sahl has had a fit.’ He said: ‘Whom do you accuse with regard to him?’ They said: “ ‘Amir bin Rabi’ah.’ They said: ‘Why would anyone of you kill his brother? If he sees something that he likes, then let him pray for blessing for him.’ Then he called for water, and he told ‘Amir to perform ablution, then he washed his face and his arms up to the elbows, his knees and inside his lower garment, then he told him to pour the water over him.”",It was narrated that Abu Umamah bin Sahl bin Hunaif said:,"“ ‘Amir bin Rabi’ah passed by Sahl bin Hunaif when he was having a bath, and said: ‘I have never seen such beautiful skin.’ Straightaway, he (Sahl) fell to the ground. He was brought to the Prophet (ﷺ) and it was said: ‘Sahl has had a fit.’ He said: ‘Whom do you accuse with regard to him?’ They said: “ ‘Amir bin Rabi’ah.’ They said: ‘Why would anyone of you kill his brother? If he sees something that he likes, then let him pray for blessing for him.’ Then he called for water, and he told ‘Amir to perform ablution, then he washed his face and his arms up to the elbows, his knees and inside his lower garment, then he told him to pour the water over him.”","حَدَّثَنَا هِشَامُ بْنُ عَمَّارٍ، حَدَّثَنَا سُفْيَانُ، عَنِ الزُّهْرِيِّ، عَنْ أَبِي أُمَامَةَ بْنِ سَهْلِ بْنِ حُنَيْفٍ، قَالَ مَرَّ عَامِرُ بْنُ رَبِيعَةَ بِسَهْلِ بْنِ حُنَيْفٍ وَهُوَ يَغْتَسِلُ فَقَالَ لَمْ أَرَ كَالْيَوْمِ وَلاَ جِلْدَ مُخَبَّأَةٍ ‏.‏ فَمَا لَبِثَ أَنْ لُبِطَ بِهِ فَأُتِيَ بِهِ النَّبِيَّ ـ صلى الله عليه وسلم ـ فَقِيلَ لَهُ أَدْرِكْ سَهْلاً صَرِيعًا ‏.‏ قَالَ ‏""‏ مَنْ تَتَّهِمُونَ بِهِ ‏""‏ ‏.‏ قَالُوا عَامِرَ بْنَ رَبِيعَةَ ‏.‏ قَالَ ‏""‏ عَلاَمَ يَقْتُلُ أَحَدُكُمْ أَخَاهُ إِذَا رَأَى أَحَدُكُمْ مِنْ أَخِيهِ مَا يُعْجِبُهُ فَلْيَدْعُ لَهُ بِالْبَرَكَةِ ‏""‏ ‏.‏ ثُمَّ دَعَا بِمَاءٍ فَأَمَرَ عَامِرًا أَنْ يَتَوَضَّأَ فَيَغْسِلَ وَجْهَهُ وَيَدَيْهِ إِلَى الْمِرْفَقَيْنِ وَرُكْبَتَيْهِ وَدَاخِلَةَ إِزَارِهِ وَأَمَرَهُ أَنْ يَصُبَّ عَلَيْهِ ‏.‏ قَالَ سُفْيَانُ قَالَ مَعْمَرٌ عَنِ الزُّهْرِيِّ وَأَمَرَهُ أَنْ يَكْفَأَ الإِنَاءَ مِنْ خَلْفِهِ ‏.‏",حَدَّثَنَا هِشَامُ بْنُ عَمَّارٍ، حَدَّثَنَا سُفْيَانُ، عَنِ الزُّهْرِيِّ، عَنْ أَبِي أُمَامَةَ بْنِ سَهْلِ بْنِ حُنَيْفٍ، قَالَ مَرَّ عَامِرُ بْنُ رَبِيعَةَ بِسَهْلِ بْنِ,حُنَيْفٍ وَهُوَ يَغْتَسِلُ فَقَالَ لَمْ أَرَ كَالْيَوْمِ وَلاَ جِلْدَ مُخَبَّأَةٍ فَمَا لَبِثَ أَنْ لُبِطَ بِهِ فَأُتِيَ بِهِ النَّبِيَّ صلى الله عليه وسلم فَقِيلَ لَهُ أَدْرِكْ سَهْلاً صَرِيعًا قَالَ مَنْ تَتَّهِمُونَ بِهِ قَالُوا عَامِرَ بْنَ رَبِيعَةَ قَالَ عَلاَمَ يَقْتُلُ أَحَدُكُمْ أَخَاهُ إِذَا رَأَى أَحَدُكُمْ مِنْ أَخِيهِ مَا يُعْجِبُهُ فَلْيَدْعُ لَهُ بِالْبَرَكَةِ ثُمَّ دَعَا بِمَاءٍ فَأَمَرَ عَامِرًا أَنْ يَتَوَضَّأَ فَيَغْسِلَ وَجْهَهُ وَيَدَيْهِ إِلَى الْمِرْفَقَيْنِ وَرُكْبَتَيْهِ وَدَاخِلَةَ إِزَارِهِ وَأَمَرَهُ أَنْ يَصُبَّ عَلَيْهِ قَالَ سُفْيَانُ قَالَ مَعْمَرٌ عَنِ الزُّهْرِيِّ وَأَمَرَهُ أَنْ يَكْفَأَ الإِنَاءَ مِنْ خَلْفِهِ, ,Sahih - Authentic,صحيح
31,Chapters on Medicine,كتاب الطب,nan,nan,nan,3561,"It was narrated that ‘Ubaid bin Rifa’ah Az-Zuraqi said: “Asma’ said: ‘O Messenger of Allah! The children of Ja’far have been afflicted by the evil eye, shall I recite Ruqyah* for them?’ He said: ‘Yes, for if anything were to overtake the Divine decree it would be the evil eye.’”",It was narrated that ‘Ubaid bin Rifa’ah Az-Zuraqi said:,"“Asma’ said: ‘O Messenger of Allah! The children of Ja’far have been afflicted by the evil eye, shall I recite Ruqyah* for them?’ He said: ‘Yes, for if anything were to overtake the Divine decree it would be the evil eye.’”",حَدَّثَنَا أَبُو بَكْرِ بْنُ أَبِي شَيْبَةَ، حَدَّثَنَا سُفْيَانُ بْنُ عُيَيْنَةَ، عَنْ عَمْرِو بْنِ دِينَارٍ، عَنْ عُرْوَةَ بْنِ عَامِرٍ، عَنْ عُبَيْدِ بْنِ رِفَاعَةَ الزُّرَقِيِّ، قَالَ قَالَتْ أَسْمَاءُ يَا رَسُولَ اللَّهِ إِنَّ بَنِي جَعْفَرٍ تُصِيبُهُمُ الْعَيْنُ فَأَسْتَرْقِي لَهُمْ قَالَ ‏ ‏ نَعَمْ فَلَوْ كَانَ شَىْءٌ سَابَقَ الْقَدَرَ سَبَقَتْهُ الْعَيْنُ ‏‏ ‏.‏,حَدَّثَنَا أَبُو بَكْرِ بْنُ أَبِي شَيْبَةَ، حَدَّثَنَا سُفْيَانُ بْنُ عُيَيْنَةَ، عَنْ عَمْرِو بْنِ دِينَارٍ، عَنْ عُرْوَةَ بْنِ عَامِرٍ، عَنْ عُبَيْدِ بْنِ رِفَاعَةَ الزُّرَقِيِّ، قَالَ,قَالَتْ أَسْمَاءُ يَا رَسُولَ اللَّهِ إِنَّ بَنِي جَعْفَرٍ تُصِيبُهُمُ الْعَيْنُ فَأَسْتَرْقِي لَهُمْ قَالَ نَعَمْ فَلَوْ كَانَ شَىْءٌ سَابَقَ الْقَدَرَ سَبَقَتْهُ الْعَيْنُ, ,Sahih - Authentic,صحيح
31,Chapters on Medicine,كتاب الطب,nan,nan,nan,3562,"It was narrated that Abu Sa’eed said: “The Messenger of Allah (ﷺ) used to seek refuge from the evil eye of the jinn and of mankind. When the Mu’awwidhatain* were revealed, he started to recite them and stopped reciting anything else.”",It was narrated that Abu Sa’eed said:,"“The Messenger of Allah (ﷺ) used to seek refuge from the evil eye of the jinn and of mankind. When the Mu’awwidhatain* were revealed, he started to recite them and stopped reciting anything else.”",حَدَّثَنَا أَبُو بَكْرِ بْنُ أَبِي شَيْبَةَ، حَدَّثَنَا سَعِيدُ بْنُ سُلَيْمَانَ، عَنْ عَبَّادٍ، عَنِ الْجُرَيْرِيِّ، عَنْ أَبِي نَضْرَةَ، عَنْ أَبِي سَعِيدٍ، قَالَ كَانَ رَسُولُ اللَّهِ ـ صلى الله عليه وسلم ـ يَتَعَوَّذُ مِنْ عَيْنِ الْجَانِّ وَأَعْيُنِ الإِنْسِ فَلَمَّا نَزَلَتِ الْمُعَوِّذَتَانِ أَخَذَهُمَا وَتَرَكَ مَا سِوَى ذَلِكَ ‏.‏,حَدَّثَنَا أَبُو بَكْرِ بْنُ أَبِي شَيْبَةَ، حَدَّثَنَا سَعِيدُ بْنُ سُلَيْمَانَ، عَنْ عَبَّادٍ، عَنِ الْجُرَيْرِيِّ، عَنْ أَبِي نَضْرَةَ، عَنْ أَبِي سَعِيدٍ،,قَالَ كَانَ رَسُولُ اللَّهِ صلى الله عليه وسلم يَتَعَوَّذُ مِنْ عَيْنِ الْجَانِّ وَأَعْيُنِ الإِنْسِ فَلَمَّا نَزَلَتِ الْمُعَوِّذَتَانِ أَخَذَهُمَا وَتَرَكَ مَا سِوَى ذَلِكَ, ,Daif - Weak, 
31,Chapters on Medicine,كتاب الطب,nan,nan,nan,3563,It was narrated from ‘Aishah that the Prophet (ﷺ) commanded her to recite Ruqyah to treat the evil eye.,nan,"It was
narrated from ‘Aishah that the Prophet (ﷺ) commanded her to
recite Ruqyah to treat the evil eye.",حَدَّثَنَا عَلِيُّ بْنُ أَبِي الْخَصِيبِ، حَدَّثَنَا وَكِيعٌ، عَنْ سُفْيَانَ، وَمِسْعَرٍ، عَنْ مَعْبَدِ بْنِ خَالِدٍ، عَنْ عَبْدِ اللَّهِ بْنِ شَدَّادٍ، عَنْ عَائِشَةَ، أَنَّ النَّبِيَّ ـ صلى الله عليه وسلم ـ أَمَرَهَا أَنْ تَسْتَرْقِيَ مِنَ الْعَيْنِ ‏.‏, حَدَّثَنَا عَلِيُّ بْنُ أَبِي الْخَصِيبِ، حَدَّثَنَا وَكِيعٌ، عَنْ سُفْيَانَ، وَمِسْعَرٍ، عَنْ مَعْبَدِ بْنِ خَالِدٍ، عَنْ عَبْدِ اللَّهِ بْنِ شَدَّادٍ، عَنْ, عَائِشَةَ، أَنَّ النَّبِيَّ صلى الله عليه وسلم أَمَرَهَا أَنْ تَسْتَرْقِيَ مِنَ الْعَيْنِ, ,Sahih - Authentic,صحيح
